"No.","Time","Source","Destination","Protocol","Length","Sequence Number","TCP Segment Len","Info"
"843","11.552349","fe80::14d5:83a5:43c7:5ce8","ff02::1","UDP","72","","","57115  >  15118 Len=10"
"853","11.697833","fe80::aa:1623:2a4e:a858","fe80::14d5:83a5:43c7:5ce8","UDP","90","","","15118  >  57115 Len=28"
"863","12.417457","fe80::14d5:83a5:43c7:5ce8","fe80::aa:1623:2a4e:a858","TCP","98","0","0","57647  >  64036 [SYN] Seq=0 Win=65535 Len=0 MSS=1440 WS=64 TSval=3327976439 TSecr=0 SACK_PERM=1"
"866","12.482794","fe80::aa:1623:2a4e:a858","fe80::14d5:83a5:43c7:5ce8","TCP","98","0","0","64036  >  57647 [SYN, ACK] Seq=0 Ack=1 Win=65535 Len=0 MSS=1440 WS=64 TSval=3800872124 TSecr=3327976439 SACK_PERM=1"
"867","12.482889","fe80::14d5:83a5:43c7:5ce8","fe80::aa:1623:2a4e:a858","TCP","86","1","0","57647  >  64036 [ACK] Seq=1 Ack=1 Win=131328 Len=0 TSval=3327976505 TSecr=3800872124"
"868","12.518339","fe80::aa:1623:2a4e:a858","fe80::14d5:83a5:43c7:5ce8","TCP","86","1","0","[TCP Window Update] 64036  >  57647 [ACK] Seq=1 Ack=1 Win=131328 Len=0 TSval=3800872160 TSecr=3327976505"
"869","12.547683","fe80::14d5:83a5:43c7:5ce8","fe80::aa:1623:2a4e:a858","TLSv1.2","288","1","202","Client Hello"
"870","12.580690","fe80::aa:1623:2a4e:a858","fe80::14d5:83a5:43c7:5ce8","TCP","86","1","0","64036  >  57647 [ACK] Seq=1 Ack=203 Win=131136 Len=0 TSval=3800872222 TSecr=3327976570"
"871","12.614833","fe80::aa:1623:2a4e:a858","fe80::14d5:83a5:43c7:5ce8","TLSv1.2","176","1","90","Server Hello"
"872","12.614903","fe80::14d5:83a5:43c7:5ce8","fe80::aa:1623:2a4e:a858","TCP","86","203","0","57647  >  64036 [ACK] Seq=203 Ack=91 Win=131264 Len=0 TSval=3327976637 TSecr=3800872256"
"873","12.615004","fe80::aa:1623:2a4e:a858","fe80::14d5:83a5:43c7:5ce8","TCP","1514","91","1428","64036  >  57647 [ACK] Seq=91 Ack=203 Win=131136 Len=1428 TSval=3800872256 TSecr=3327976570 [TCP segment of a reassembled PDU]"
"874","12.615004","fe80::aa:1623:2a4e:a858","fe80::14d5:83a5:43c7:5ce8","TLSv1.2","96","1519","10","Certificate"
"875","12.615030","fe80::14d5:83a5:43c7:5ce8","fe80::aa:1623:2a4e:a858","TCP","86","203","0","57647  >  64036 [ACK] Seq=203 Ack=1529 Win=129792 Len=0 TSval=3327976637 TSecr=3800872256"
"877","12.649817","fe80::aa:1623:2a4e:a858","fe80::14d5:83a5:43c7:5ce8","TLSv1.2","215","1529","129","Server Key Exchange, Server Hello Done"
"879","12.649915","fe80::14d5:83a5:43c7:5ce8","fe80::aa:1623:2a4e:a858","TCP","86","203","0","57647  >  64036 [ACK] Seq=203 Ack=1658 Win=130880 Len=0 TSval=3327976672 TSecr=3800872290"
"880","12.696336","fe80::14d5:83a5:43c7:5ce8","fe80::aa:1623:2a4e:a858","TLSv1.2","128","203","42","Client Key Exchange"
"881","12.729796","fe80::aa:1623:2a4e:a858","fe80::14d5:83a5:43c7:5ce8","TCP","86","1658","0","64036  >  57647 [ACK] Seq=1658 Ack=245 Win=131072 Len=0 TSval=3800872371 TSecr=3327976718"
"882","12.729862","fe80::14d5:83a5:43c7:5ce8","fe80::aa:1623:2a4e:a858","TLSv1.2","177","245","91","Change Cipher Spec, Encrypted Handshake Message"
"883","12.762771","fe80::aa:1623:2a4e:a858","fe80::14d5:83a5:43c7:5ce8","TCP","86","1658","0","64036  >  57647 [ACK] Seq=1658 Ack=336 Win=131008 Len=0 TSval=3800872404 TSecr=3327976752"
"884","12.762916","fe80::aa:1623:2a4e:a858","fe80::14d5:83a5:43c7:5ce8","TLSv1.2","92","1658","6","Change Cipher Spec"
"885","12.762963","fe80::14d5:83a5:43c7:5ce8","fe80::aa:1623:2a4e:a858","TCP","86","336","0","57647  >  64036 [ACK] Seq=336 Ack=1664 Win=131008 Len=0 TSval=3327976785 TSecr=3800872409"
"886","12.798647","fe80::aa:1623:2a4e:a858","fe80::14d5:83a5:43c7:5ce8","TLSv1.2","171","1664","85","Encrypted Handshake Message"
"887","12.798758","fe80::14d5:83a5:43c7:5ce8","fe80::aa:1623:2a4e:a858","TCP","86","336","0","57647  >  64036 [ACK] Seq=336 Ack=1749 Win=130944 Len=0 TSval=3327976821 TSecr=3800872438"
"889","12.885262","fe80::14d5:83a5:43c7:5ce8","fe80::aa:1623:2a4e:a858","TLSv1.2","187","336","101","Application Data"
"891","12.892047","fe80::aa:1623:2a4e:a858","fe80::14d5:83a5:43c7:5ce8","TCP","86","1749","0","64036  >  57647 [ACK] Seq=1749 Ack=437 Win=130944 Len=0 TSval=3800872560 TSecr=3327976907"
"892","13.015317","fe80::aa:1623:2a4e:a858","fe80::14d5:83a5:43c7:5ce8","TLSv1.2","155","1749","69","Application Data"
"893","13.015422","fe80::14d5:83a5:43c7:5ce8","fe80::aa:1623:2a4e:a858","TCP","86","437","0","57647  >  64036 [ACK] Seq=437 Ack=1818 Win=130944 Len=0 TSval=3327977037 TSecr=3800872657"
"896","13.154295","fe80::14d5:83a5:43c7:5ce8","fe80::aa:1623:2a4e:a858","TLSv1.2","171","437","85","Application Data"
"897","13.158618","fe80::aa:1623:2a4e:a858","fe80::14d5:83a5:43c7:5ce8","TCP","86","1818","0","64036  >  57647 [ACK] Seq=1818 Ack=522 Win=130944 Len=0 TSval=3800872829 TSecr=3327977176"
"898","13.193066","fe80::aa:1623:2a4e:a858","fe80::14d5:83a5:43c7:5ce8","TLSv1.2","187","1818","101","Application Data"
"899","13.193138","fe80::14d5:83a5:43c7:5ce8","fe80::aa:1623:2a4e:a858","TCP","86","522","0","57647  >  64036 [ACK] Seq=522 Ack=1919 Win=130944 Len=0 TSval=3327977215 TSecr=3800872854"
"900","13.201713","fe80::14d5:83a5:43c7:5ce8","fe80::aa:1623:2a4e:a858","TLSv1.2","171","522","85","Application Data"
"901","13.205413","fe80::aa:1623:2a4e:a858","fe80::14d5:83a5:43c7:5ce8","TCP","86","1919","0","64036  >  57647 [ACK] Seq=1919 Ack=607 Win=130944 Len=0 TSval=3800872876 TSecr=3327977224"
"902","13.213387","fe80::aa:1623:2a4e:a858","fe80::14d5:83a5:43c7:5ce8","TLSv1.2","251","1919","165","Application Data"
"903","13.213457","fe80::14d5:83a5:43c7:5ce8","fe80::aa:1623:2a4e:a858","TCP","86","607","0","57647  >  64036 [ACK] Seq=607 Ack=2084 Win=130880 Len=0 TSval=3327977235 TSecr=3800872884"
"904","13.381350","fe80::14d5:83a5:43c7:5ce8","fe80::aa:1623:2a4e:a858","TLSv1.2","171","607","85","Application Data"
"905","13.385373","fe80::aa:1623:2a4e:a858","fe80::14d5:83a5:43c7:5ce8","TCP","86","2084","0","64036  >  57647 [ACK] Seq=2084 Ack=692 Win=130944 Len=0 TSval=3800873056 TSecr=3327977403"
"906","13.398022","fe80::aa:1623:2a4e:a858","fe80::14d5:83a5:43c7:5ce8","TLSv1.2","171","2084","85","Application Data"
"907","13.398093","fe80::14d5:83a5:43c7:5ce8","fe80::aa:1623:2a4e:a858","TCP","86","692","0","57647  >  64036 [ACK] Seq=692 Ack=2169 Win=130944 Len=0 TSval=3327977420 TSecr=3800873069"
"910","13.571805","fe80::14d5:83a5:43c7:5ce8","fe80::aa:1623:2a4e:a858","TCP","1514","692","1428","57647  >  64036 [ACK] Seq=692 Ack=2169 Win=131072 Len=1428 TSval=3327977594 TSecr=3800873069 [TCP segment of a reassembled PDU]"
"911","13.571872","fe80::14d5:83a5:43c7:5ce8","fe80::aa:1623:2a4e:a858","TLSv1.2","183","2120","97","Application Data"
"912","13.576583","fe80::aa:1623:2a4e:a858","fe80::14d5:83a5:43c7:5ce8","TCP","86","2169","0","64036  >  57647 [ACK] Seq=2169 Ack=2217 Win=129536 Len=0 TSval=3800873247 TSecr=3327977594"
"913","13.629551","fe80::aa:1623:2a4e:a858","fe80::14d5:83a5:43c7:5ce8","TLSv1.2","187","2169","101","Application Data"
"914","13.629651","fe80::14d5:83a5:43c7:5ce8","fe80::aa:1623:2a4e:a858","TCP","86","2217","0","57647  >  64036 [ACK] Seq=2217 Ack=2270 Win=130944 Len=0 TSval=3327977651 TSecr=3800873300"
"915","13.726831","fe80::14d5:83a5:43c7:5ce8","fe80::aa:1623:2a4e:a858","TLSv1.2","459","2217","373","Application Data"
"916","13.733484","fe80::aa:1623:2a4e:a858","fe80::14d5:83a5:43c7:5ce8","TCP","86","2270","0","64036  >  57647 [ACK] Seq=2270 Ack=2590 Win=130688 Len=0 TSval=3800873402 TSecr=3327977749"
"917","13.758924","fe80::aa:1623:2a4e:a858","fe80::14d5:83a5:43c7:5ce8","TLSv1.2","171","2270","85","Application Data"
"918","13.759026","fe80::14d5:83a5:43c7:5ce8","fe80::aa:1623:2a4e:a858","TCP","86","2590","0","57647  >  64036 [ACK] Seq=2590 Ack=2355 Win=130944 Len=0 TSval=3327977781 TSecr=3800873429"
"919","13.773855","fe80::14d5:83a5:43c7:5ce8","fe80::aa:1623:2a4e:a858","TLSv1.2","187","2590","101","Application Data"
"920","13.788944","fe80::aa:1623:2a4e:a858","fe80::14d5:83a5:43c7:5ce8","TCP","86","2355","0","64036  >  57647 [ACK] Seq=2355 Ack=2691 Win=130944 Len=0 TSval=3800873459 TSecr=3327977796"
"921","13.818929","fe80::aa:1623:2a4e:a858","fe80::14d5:83a5:43c7:5ce8","TLSv1.2","491","2355","405","Application Data"
"922","13.819034","fe80::14d5:83a5:43c7:5ce8","fe80::aa:1623:2a4e:a858","TCP","86","2691","0","57647  >  64036 [ACK] Seq=2691 Ack=2760 Win=130624 Len=0 TSval=3327977841 TSecr=3800873489"
"923","13.900756","fe80::14d5:83a5:43c7:5ce8","fe80::aa:1623:2a4e:a858","TLSv1.2","171","2691","85","Application Data"
"924","13.907094","fe80::aa:1623:2a4e:a858","fe80::14d5:83a5:43c7:5ce8","TCP","86","2760","0","64036  >  57647 [ACK] Seq=2760 Ack=2776 Win=130944 Len=0 TSval=3800873575 TSecr=3327977923"
"925","13.917790","fe80::aa:1623:2a4e:a858","fe80::14d5:83a5:43c7:5ce8","TLSv1.2","171","2760","85","Application Data"
"926","13.917892","fe80::14d5:83a5:43c7:5ce8","fe80::aa:1623:2a4e:a858","TCP","86","2776","0","57647  >  64036 [ACK] Seq=2776 Ack=2845 Win=130944 Len=0 TSval=3327977940 TSecr=3800873588"
"927","13.928135","fe80::14d5:83a5:43c7:5ce8","fe80::aa:1623:2a4e:a858","TLSv1.2","171","2776","85","Application Data"
"928","13.932494","fe80::aa:1623:2a4e:a858","fe80::14d5:83a5:43c7:5ce8","TCP","86","2845","0","64036  >  57647 [ACK] Seq=2845 Ack=2861 Win=130944 Len=0 TSval=3800873603 TSecr=3327977950"
"929","13.943837","fe80::aa:1623:2a4e:a858","fe80::14d5:83a5:43c7:5ce8","TLSv1.2","203","2845","117","Application Data"
"930","13.943947","fe80::14d5:83a5:43c7:5ce8","fe80::aa:1623:2a4e:a858","TCP","86","2861","0","57647  >  64036 [ACK] Seq=2861 Ack=2962 Win=130944 Len=0 TSval=3327977966 TSecr=3800873614"
"953","15.967293","fe80::14d5:83a5:43c7:5ce8","fe80::aa:1623:2a4e:a858","TLSv1.2","171","2861","85","Application Data"
"954","16.038084","fe80::aa:1623:2a4e:a858","fe80::14d5:83a5:43c7:5ce8","TCP","86","2962","0","64036  >  57647 [ACK] Seq=2962 Ack=2946 Win=130944 Len=0 TSval=3800875708 TSecr=3327979989"
"955","16.048903","fe80::aa:1623:2a4e:a858","fe80::14d5:83a5:43c7:5ce8","TLSv1.2","203","2962","117","Application Data"
"956","16.049006","fe80::14d5:83a5:43c7:5ce8","fe80::aa:1623:2a4e:a858","TCP","86","2946","0","57647  >  64036 [ACK] Seq=2946 Ack=3079 Win=130944 Len=0 TSval=3327980071 TSecr=3800875719"
"1033","18.066706","fe80::14d5:83a5:43c7:5ce8","fe80::aa:1623:2a4e:a858","TLSv1.2","171","2946","85","Application Data"
"1037","18.187066","fe80::aa:1623:2a4e:a858","fe80::14d5:83a5:43c7:5ce8","TCP","86","3079","0","64036  >  57647 [ACK] Seq=3079 Ack=3031 Win=130944 Len=0 TSval=3800877857 TSecr=3327982088"
"1038","18.195331","fe80::aa:1623:2a4e:a858","fe80::14d5:83a5:43c7:5ce8","TLSv1.2","203","3079","117","Application Data"
"1039","18.195441","fe80::14d5:83a5:43c7:5ce8","fe80::aa:1623:2a4e:a858","TCP","86","3031","0","57647  >  64036 [ACK] Seq=3031 Ack=3196 Win=130944 Len=0 TSval=3327982217 TSecr=3800877866"
"1055","20.211588","fe80::14d5:83a5:43c7:5ce8","fe80::aa:1623:2a4e:a858","TLSv1.2","171","3031","85","Application Data"
"1056","20.337884","fe80::aa:1623:2a4e:a858","fe80::14d5:83a5:43c7:5ce8","TCP","86","3196","0","64036  >  57647 [ACK] Seq=3196 Ack=3116 Win=130944 Len=0 TSval=3800880008 TSecr=3327984233"
"1057","20.348452","fe80::aa:1623:2a4e:a858","fe80::14d5:83a5:43c7:5ce8","TLSv1.2","203","3196","117","Application Data"
"1058","20.348560","fe80::14d5:83a5:43c7:5ce8","fe80::aa:1623:2a4e:a858","TCP","86","3116","0","57647  >  64036 [ACK] Seq=3116 Ack=3313 Win=130944 Len=0 TSval=3327984370 TSecr=3800880019"
"1070","22.358772","fe80::14d5:83a5:43c7:5ce8","fe80::aa:1623:2a4e:a858","TLSv1.2","171","3116","85","Application Data"
"1071","22.385903","fe80::aa:1623:2a4e:a858","fe80::14d5:83a5:43c7:5ce8","TCP","86","3313","0","64036  >  57647 [ACK] Seq=3313 Ack=3201 Win=130944 Len=0 TSval=3800882056 TSecr=3327986380"
"1072","22.397705","fe80::aa:1623:2a4e:a858","fe80::14d5:83a5:43c7:5ce8","TLSv1.2","203","3313","117","Application Data"
"1073","22.397774","fe80::14d5:83a5:43c7:5ce8","fe80::aa:1623:2a4e:a858","TCP","86","3201","0","57647  >  64036 [ACK] Seq=3201 Ack=3430 Win=130944 Len=0 TSval=3327986419 TSecr=3800882066"
"1101","24.415914","fe80::14d5:83a5:43c7:5ce8","fe80::aa:1623:2a4e:a858","TLSv1.2","171","3201","85","Application Data"
"1102","24.536435","fe80::aa:1623:2a4e:a858","fe80::14d5:83a5:43c7:5ce8","TCP","86","3430","0","64036  >  57647 [ACK] Seq=3430 Ack=3286 Win=130944 Len=0 TSval=3800884207 TSecr=3327988438"
"1103","24.548349","fe80::aa:1623:2a4e:a858","fe80::14d5:83a5:43c7:5ce8","TLSv1.2","203","3430","117","Application Data"
"1104","24.548461","fe80::14d5:83a5:43c7:5ce8","fe80::aa:1623:2a4e:a858","TCP","86","3286","0","57647  >  64036 [ACK] Seq=3286 Ack=3547 Win=130944 Len=0 TSval=3327988570 TSecr=3800884217"
"1136","26.564891","fe80::14d5:83a5:43c7:5ce8","fe80::aa:1623:2a4e:a858","TLSv1.2","171","3286","85","Application Data"
"1139","26.694407","fe80::aa:1623:2a4e:a858","fe80::14d5:83a5:43c7:5ce8","TCP","86","3547","0","64036  >  57647 [ACK] Seq=3547 Ack=3371 Win=130944 Len=0 TSval=3800886365 TSecr=3327990586"
"1140","26.704505","fe80::aa:1623:2a4e:a858","fe80::14d5:83a5:43c7:5ce8","TLSv1.2","203","3547","117","Application Data"
"1141","26.704570","fe80::14d5:83a5:43c7:5ce8","fe80::aa:1623:2a4e:a858","TCP","86","3371","0","57647  >  64036 [ACK] Seq=3371 Ack=3664 Win=130944 Len=0 TSval=3327990726 TSecr=3800886375"
"1154","28.718178","fe80::14d5:83a5:43c7:5ce8","fe80::aa:1623:2a4e:a858","TLSv1.2","171","3371","85","Application Data"
"1155","28.839048","fe80::aa:1623:2a4e:a858","fe80::14d5:83a5:43c7:5ce8","TCP","86","3664","0","64036  >  57647 [ACK] Seq=3664 Ack=3456 Win=130944 Len=0 TSval=3800888509 TSecr=3327992739"
"1156","28.849207","fe80::aa:1623:2a4e:a858","fe80::14d5:83a5:43c7:5ce8","TLSv1.2","203","3664","117","Application Data"
"1157","28.849307","fe80::14d5:83a5:43c7:5ce8","fe80::aa:1623:2a4e:a858","TCP","86","3456","0","57647  >  64036 [ACK] Seq=3456 Ack=3781 Win=130944 Len=0 TSval=3327992871 TSecr=3800888519"
"1182","30.865808","fe80::14d5:83a5:43c7:5ce8","fe80::aa:1623:2a4e:a858","TLSv1.2","171","3456","85","Application Data"
"1183","30.987905","fe80::aa:1623:2a4e:a858","fe80::14d5:83a5:43c7:5ce8","TCP","86","3781","0","64036  >  57647 [ACK] Seq=3781 Ack=3541 Win=130944 Len=0 TSval=3800890658 TSecr=3327994887"
"1184","30.999562","fe80::aa:1623:2a4e:a858","fe80::14d5:83a5:43c7:5ce8","TLSv1.2","203","3781","117","Application Data"
"1185","30.999673","fe80::14d5:83a5:43c7:5ce8","fe80::aa:1623:2a4e:a858","TCP","86","3541","0","57647  >  64036 [ACK] Seq=3541 Ack=3898 Win=130944 Len=0 TSval=3327995021 TSecr=3800890668"
"1199","33.013052","fe80::14d5:83a5:43c7:5ce8","fe80::aa:1623:2a4e:a858","TLSv1.2","171","3541","85","Application Data"
"1200","33.034878","fe80::aa:1623:2a4e:a858","fe80::14d5:83a5:43c7:5ce8","TCP","86","3898","0","64036  >  57647 [ACK] Seq=3898 Ack=3626 Win=130944 Len=0 TSval=3800892706 TSecr=3327997034"
"1201","33.044566","fe80::aa:1623:2a4e:a858","fe80::14d5:83a5:43c7:5ce8","TLSv1.2","203","3898","117","Application Data"
"1202","33.044713","fe80::14d5:83a5:43c7:5ce8","fe80::aa:1623:2a4e:a858","TCP","86","3626","0","57647  >  64036 [ACK] Seq=3626 Ack=4015 Win=130944 Len=0 TSval=3327997066 TSecr=3800892716"
"1219","35.059882","fe80::14d5:83a5:43c7:5ce8","fe80::aa:1623:2a4e:a858","TLSv1.2","171","3626","85","Application Data"
"1220","35.082972","fe80::aa:1623:2a4e:a858","fe80::14d5:83a5:43c7:5ce8","TCP","86","4015","0","64036  >  57647 [ACK] Seq=4015 Ack=3711 Win=130944 Len=0 TSval=3800894755 TSecr=3327999081"
"1221","35.092307","fe80::aa:1623:2a4e:a858","fe80::14d5:83a5:43c7:5ce8","TLSv1.2","203","4015","117","Application Data"
"1222","35.092554","fe80::14d5:83a5:43c7:5ce8","fe80::aa:1623:2a4e:a858","TCP","86","3711","0","57647  >  64036 [ACK] Seq=3711 Ack=4132 Win=130944 Len=0 TSval=3327999114 TSecr=3800894764"
"1223","35.106910","fe80::14d5:83a5:43c7:5ce8","fe80::aa:1623:2a4e:a858","TLSv1.2","171","3711","85","Application Data"
"1225","35.110393","fe80::aa:1623:2a4e:a858","fe80::14d5:83a5:43c7:5ce8","TCP","86","4132","0","64036  >  57647 [ACK] Seq=4132 Ack=3796 Win=130944 Len=0 TSval=3800894782 TSecr=3327999128"
"1227","35.119162","fe80::aa:1623:2a4e:a858","fe80::14d5:83a5:43c7:5ce8","TLSv1.2","171","4132","85","Application Data"
"1228","35.119234","fe80::14d5:83a5:43c7:5ce8","fe80::aa:1623:2a4e:a858","TCP","86","3796","0","57647  >  64036 [ACK] Seq=3796 Ack=4217 Win=130944 Len=0 TSval=3327999141 TSecr=3800894791"
"1229","35.125100","fe80::14d5:83a5:43c7:5ce8","fe80::aa:1623:2a4e:a858","TLSv1.2","171","3796","85","Application Data"
"1230","35.127902","fe80::aa:1623:2a4e:a858","fe80::14d5:83a5:43c7:5ce8","TCP","86","4217","0","64036  >  57647 [ACK] Seq=4217 Ack=3881 Win=130944 Len=0 TSval=3800894800 TSecr=3327999147"
"1231","35.134352","fe80::aa:1623:2a4e:a858","fe80::14d5:83a5:43c7:5ce8","TLSv1.2","171","4217","85","Application Data"
"1232","35.134464","fe80::14d5:83a5:43c7:5ce8","fe80::aa:1623:2a4e:a858","TCP","86","3881","0","57647  >  64036 [ACK] Seq=3881 Ack=4302 Win=130944 Len=0 TSval=3327999156 TSecr=3800894806"
"1233","35.160648","fe80::14d5:83a5:43c7:5ce8","fe80::aa:1623:2a4e:a858","TLSv1.2","155","3881","69","Encrypted Alert"
"1234","35.161095","fe80::14d5:83a5:43c7:5ce8","fe80::aa:1623:2a4e:a858","TCP","86","3950","0","57647  >  64036 [FIN, ACK] Seq=3950 Ack=4302 Win=131072 Len=0 TSval=3327999182 TSecr=3800894806"
"1235","35.163659","fe80::aa:1623:2a4e:a858","fe80::14d5:83a5:43c7:5ce8","TCP","86","4302","0","64036  >  57647 [ACK] Seq=4302 Ack=3950 Win=130944 Len=0 TSval=3800894836 TSecr=3327999182"
"1236","35.163768","fe80::aa:1623:2a4e:a858","fe80::14d5:83a5:43c7:5ce8","TCP","86","4302","0","64036  >  57647 [ACK] Seq=4302 Ack=3951 Win=130944 Len=0 TSval=3800894836 TSecr=3327999182"
"1298","40.149471","fe80::aa:1623:2a4e:a858","fe80::14d5:83a5:43c7:5ce8","TLSv1.2","155","4302","69","Encrypted Alert"
"1299","40.149472","fe80::aa:1623:2a4e:a858","fe80::14d5:83a5:43c7:5ce8","TCP","86","4371","0","64036  >  57647 [FIN, ACK] Seq=4371 Ack=3951 Win=130944 Len=0 TSval=3800899815 TSecr=3327999182"
"1300","40.149657","fe80::14d5:83a5:43c7:5ce8","fe80::aa:1623:2a4e:a858","TCP","74","3951","0","57647  >  64036 [RST] Seq=3951 Win=0 Len=0"
"1301","40.149828","fe80::aa:1623:2a4e:a858","fe80::14d5:83a5:43c7:5ce8","TCP","74","4372","0","64036  >  57647 [RST, ACK] Seq=4372 Ack=3951 Win=130944 Len=0"
"1302","40.149961","fe80::14d5:83a5:43c7:5ce8","fe80::aa:1623:2a4e:a858","TCP","74","3951","0","57647  >  64036 [RST] Seq=3951 Win=0 Len=0"
"1311","41.667564","fe80::14d5:83a5:43c7:5ce8","ff02::1","UDP","72","","","53914  >  15118 Len=10"
"1312","41.741642","fe80::aa:1623:2a4e:a858","fe80::14d5:83a5:43c7:5ce8","UDP","90","","","15118  >  53914 Len=28"
"1317","42.316920","fe80::14d5:83a5:43c7:5ce8","fe80::aa:1623:2a4e:a858","TCP","98","0","0","57648  >  64036 [SYN] Seq=0 Win=65535 Len=0 MSS=1440 WS=64 TSval=1973891903 TSecr=0 SACK_PERM=1"
"1318","42.353447","fe80::aa:1623:2a4e:a858","fe80::14d5:83a5:43c7:5ce8","TCP","98","0","0","64036  >  57648 [SYN, ACK] Seq=0 Ack=1 Win=65535 Len=0 MSS=1440 WS=64 TSval=2951644709 TSecr=1973891903 SACK_PERM=1"
"1319","42.353516","fe80::14d5:83a5:43c7:5ce8","fe80::aa:1623:2a4e:a858","TCP","86","1","0","57648  >  64036 [ACK] Seq=1 Ack=1 Win=131328 Len=0 TSval=1973891940 TSecr=2951644709"
"1320","42.357725","fe80::aa:1623:2a4e:a858","fe80::14d5:83a5:43c7:5ce8","TCP","86","1","0","[TCP Window Update] 64036  >  57648 [ACK] Seq=1 Ack=1 Win=131328 Len=0 TSval=2951644714 TSecr=1973891940"
"1321","42.389180","fe80::14d5:83a5:43c7:5ce8","fe80::aa:1623:2a4e:a858","TLSv1.2","288","1","202","Client Hello"
"1322","42.391603","fe80::aa:1623:2a4e:a858","fe80::14d5:83a5:43c7:5ce8","TCP","86","1","0","64036  >  57648 [ACK] Seq=1 Ack=203 Win=131136 Len=0 TSval=2951644748 TSecr=1973891975"
"1323","42.400305","fe80::aa:1623:2a4e:a858","fe80::14d5:83a5:43c7:5ce8","TLSv1.2","176","1","90","Server Hello"
"1324","42.400363","fe80::14d5:83a5:43c7:5ce8","fe80::aa:1623:2a4e:a858","TCP","86","203","0","57648  >  64036 [ACK] Seq=203 Ack=91 Win=131264 Len=0 TSval=1973891987 TSecr=2951644756"
"1325","42.401358","fe80::aa:1623:2a4e:a858","fe80::14d5:83a5:43c7:5ce8","TCP","1514","91","1428","64036  >  57648 [ACK] Seq=91 Ack=203 Win=131136 Len=1428 TSval=2951644756 TSecr=1973891975 [TCP segment of a reassembled PDU]"
"1326","42.401359","fe80::aa:1623:2a4e:a858","fe80::14d5:83a5:43c7:5ce8","TLSv1.2","96","1519","10","Certificate"
"1327","42.401418","fe80::14d5:83a5:43c7:5ce8","fe80::aa:1623:2a4e:a858","TCP","86","203","0","57648  >  64036 [ACK] Seq=203 Ack=1529 Win=129792 Len=0 TSval=1973891988 TSecr=2951644756"
"1328","42.404326","fe80::aa:1623:2a4e:a858","fe80::14d5:83a5:43c7:5ce8","TLSv1.2","215","1529","129","Server Key Exchange, Server Hello Done"
"1329","42.404404","fe80::14d5:83a5:43c7:5ce8","fe80::aa:1623:2a4e:a858","TCP","86","203","0","57648  >  64036 [ACK] Seq=203 Ack=1658 Win=130880 Len=0 TSval=1973891990 TSecr=2951644760"
"1330","42.454878","fe80::14d5:83a5:43c7:5ce8","fe80::aa:1623:2a4e:a858","TLSv1.2","128","203","42","Client Key Exchange"
"1331","42.460092","fe80::aa:1623:2a4e:a858","fe80::14d5:83a5:43c7:5ce8","TCP","86","1658","0","64036  >  57648 [ACK] Seq=1658 Ack=245 Win=131072 Len=0 TSval=2951644816 TSecr=1973892041"
"1332","42.463856","fe80::14d5:83a5:43c7:5ce8","fe80::aa:1623:2a4e:a858","TLSv1.2","92","245","6","Change Cipher Spec"
"1333","42.468550","fe80::aa:1623:2a4e:a858","fe80::14d5:83a5:43c7:5ce8","TCP","86","1658","0","64036  >  57648 [ACK] Seq=1658 Ack=251 Win=131072 Len=0 TSval=2951644823 TSecr=1973892050"
"1334","42.468601","fe80::14d5:83a5:43c7:5ce8","fe80::aa:1623:2a4e:a858","TLSv1.2","171","251","85","Encrypted Handshake Message"
"1335","42.470977","fe80::aa:1623:2a4e:a858","fe80::14d5:83a5:43c7:5ce8","TCP","86","1658","0","64036  >  57648 [ACK] Seq=1658 Ack=336 Win=131008 Len=0 TSval=2951644827 TSecr=1973892055"
"1336","42.471807","fe80::aa:1623:2a4e:a858","fe80::14d5:83a5:43c7:5ce8","TLSv1.2","92","1658","6","Change Cipher Spec"
"1337","42.471838","fe80::14d5:83a5:43c7:5ce8","fe80::aa:1623:2a4e:a858","TCP","86","336","0","57648  >  64036 [ACK] Seq=336 Ack=1664 Win=131008 Len=0 TSval=1973892057 TSecr=2951644827"
"1338","42.474284","fe80::aa:1623:2a4e:a858","fe80::14d5:83a5:43c7:5ce8","TLSv1.2","171","1664","85","Encrypted Handshake Message"
"1339","42.474331","fe80::14d5:83a5:43c7:5ce8","fe80::aa:1623:2a4e:a858","TCP","86","336","0","57648  >  64036 [ACK] Seq=336 Ack=1749 Win=130944 Len=0 TSval=1973892061 TSecr=2951644830"
"1340","42.524517","fe80::14d5:83a5:43c7:5ce8","fe80::aa:1623:2a4e:a858","TLSv1.2","187","336","101","Application Data"
"1341","42.527534","fe80::aa:1623:2a4e:a858","fe80::14d5:83a5:43c7:5ce8","TCP","86","1749","0","64036  >  57648 [ACK] Seq=1749 Ack=437 Win=130944 Len=0 TSval=2951644884 TSecr=1973892111"
"1343","42.539032","fe80::aa:1623:2a4e:a858","fe80::14d5:83a5:43c7:5ce8","TLSv1.2","155","1749","69","Application Data"
"1344","42.539091","fe80::14d5:83a5:43c7:5ce8","fe80::aa:1623:2a4e:a858","TCP","86","437","0","57648  >  64036 [ACK] Seq=437 Ack=1818 Win=130944 Len=0 TSval=1973892125 TSecr=2951644895"
"1345","42.634468","fe80::14d5:83a5:43c7:5ce8","fe80::aa:1623:2a4e:a858","TLSv1.2","171","437","85","Application Data"
"1346","42.637500","fe80::aa:1623:2a4e:a858","fe80::14d5:83a5:43c7:5ce8","TCP","86","1818","0","64036  >  57648 [ACK] Seq=1818 Ack=522 Win=130944 Len=0 TSval=2951644994 TSecr=1973892221"
"1347","42.647454","fe80::aa:1623:2a4e:a858","fe80::14d5:83a5:43c7:5ce8","TLSv1.2","187","1818","101","Application Data"
"1348","42.647514","fe80::14d5:83a5:43c7:5ce8","fe80::aa:1623:2a4e:a858","TCP","86","522","0","57648  >  64036 [ACK] Seq=522 Ack=1919 Win=130944 Len=0 TSval=1973892234 TSecr=2951645003"
"1349","42.655073","fe80::14d5:83a5:43c7:5ce8","fe80::aa:1623:2a4e:a858","TLSv1.2","171","522","85","Application Data"
"1350","42.658023","fe80::aa:1623:2a4e:a858","fe80::14d5:83a5:43c7:5ce8","TCP","86","1919","0","64036  >  57648 [ACK] Seq=1919 Ack=607 Win=130944 Len=0 TSval=2951645014 TSecr=1973892241"
"1351","42.668233","fe80::aa:1623:2a4e:a858","fe80::14d5:83a5:43c7:5ce8","TLSv1.2","251","1919","165","Application Data"
"1352","42.668316","fe80::14d5:83a5:43c7:5ce8","fe80::aa:1623:2a4e:a858","TCP","86","607","0","57648  >  64036 [ACK] Seq=607 Ack=2084 Win=130880 Len=0 TSval=1973892255 TSecr=2951645024"
"1353","42.751596","fe80::14d5:83a5:43c7:5ce8","fe80::aa:1623:2a4e:a858","TLSv1.2","171","607","85","Application Data"
"1354","42.756799","fe80::aa:1623:2a4e:a858","fe80::14d5:83a5:43c7:5ce8","TCP","86","2084","0","64036  >  57648 [ACK] Seq=2084 Ack=692 Win=130944 Len=0 TSval=2951645111 TSecr=1973892338"
"1355","42.763030","fe80::aa:1623:2a4e:a858","fe80::14d5:83a5:43c7:5ce8","TLSv1.2","171","2084","85","Application Data"
"1356","42.763088","fe80::14d5:83a5:43c7:5ce8","fe80::aa:1623:2a4e:a858","TCP","86","692","0","57648  >  64036 [ACK] Seq=692 Ack=2169 Win=130944 Len=0 TSval=1973892349 TSecr=2951645119"
"1359","42.964367","fe80::14d5:83a5:43c7:5ce8","fe80::aa:1623:2a4e:a858","TCP","1514","692","1428","57648  >  64036 [ACK] Seq=692 Ack=2169 Win=131072 Len=1428 TSval=1973892551 TSecr=2951645119 [TCP segment of a reassembled PDU]"
"1360","42.964448","fe80::14d5:83a5:43c7:5ce8","fe80::aa:1623:2a4e:a858","TLSv1.2","183","2120","97","Application Data"
"1361","42.967767","fe80::aa:1623:2a4e:a858","fe80::14d5:83a5:43c7:5ce8","TCP","86","2169","0","64036  >  57648 [ACK] Seq=2169 Ack=2217 Win=129536 Len=0 TSval=2951645324 TSecr=1973892551"
"1362","43.008131","fe80::aa:1623:2a4e:a858","fe80::14d5:83a5:43c7:5ce8","TLSv1.2","187","2169","101","Application Data"
"1363","43.008187","fe80::14d5:83a5:43c7:5ce8","fe80::aa:1623:2a4e:a858","TCP","86","2217","0","57648  >  64036 [ACK] Seq=2217 Ack=2270 Win=130944 Len=0 TSval=1973892594 TSecr=2951645364"
"1364","43.122778","fe80::14d5:83a5:43c7:5ce8","fe80::aa:1623:2a4e:a858","TLSv1.2","459","2217","373","Application Data"
"1365","43.128402","fe80::aa:1623:2a4e:a858","fe80::14d5:83a5:43c7:5ce8","TCP","86","2270","0","64036  >  57648 [ACK] Seq=2270 Ack=2590 Win=130688 Len=0 TSval=2951645483 TSecr=1973892709"
"1366","43.149094","fe80::aa:1623:2a4e:a858","fe80::14d5:83a5:43c7:5ce8","TLSv1.2","171","2270","85","Application Data"
"1367","43.149152","fe80::14d5:83a5:43c7:5ce8","fe80::aa:1623:2a4e:a858","TCP","86","2590","0","57648  >  64036 [ACK] Seq=2590 Ack=2355 Win=130944 Len=0 TSval=1973892735 TSecr=2951645504"
"1368","43.160097","fe80::14d5:83a5:43c7:5ce8","fe80::aa:1623:2a4e:a858","TLSv1.2","187","2590","101","Application Data"
"1369","43.196573","fe80::aa:1623:2a4e:a858","fe80::14d5:83a5:43c7:5ce8","TCP","86","2355","0","64036  >  57648 [ACK] Seq=2355 Ack=2691 Win=130944 Len=0 TSval=2951645520 TSecr=1973892746"
"1370","43.196801","fe80::aa:1623:2a4e:a858","fe80::14d5:83a5:43c7:5ce8","TLSv1.2","491","2355","405","Application Data"
"1371","43.196845","fe80::14d5:83a5:43c7:5ce8","fe80::aa:1623:2a4e:a858","TCP","86","2691","0","57648  >  64036 [ACK] Seq=2691 Ack=2760 Win=130624 Len=0 TSval=1973892783 TSecr=2951645536"
"1372","43.291466","fe80::14d5:83a5:43c7:5ce8","fe80::aa:1623:2a4e:a858","TLSv1.2","171","2691","85","Application Data"
"1373","43.299118","fe80::aa:1623:2a4e:a858","fe80::14d5:83a5:43c7:5ce8","TCP","86","2760","0","64036  >  57648 [ACK] Seq=2760 Ack=2776 Win=130944 Len=0 TSval=2951645654 TSecr=1973892878"
"1374","43.309428","fe80::aa:1623:2a4e:a858","fe80::14d5:83a5:43c7:5ce8","TLSv1.2","171","2760","85","Application Data"
"1375","43.309493","fe80::14d5:83a5:43c7:5ce8","fe80::aa:1623:2a4e:a858","TCP","86","2776","0","57648  >  64036 [ACK] Seq=2776 Ack=2845 Win=130944 Len=0 TSval=1973892896 TSecr=2951645664"
"1376","43.316082","fe80::14d5:83a5:43c7:5ce8","fe80::aa:1623:2a4e:a858","TLSv1.2","171","2776","85","Application Data"
"1377","43.321409","fe80::aa:1623:2a4e:a858","fe80::14d5:83a5:43c7:5ce8","TCP","86","2845","0","64036  >  57648 [ACK] Seq=2845 Ack=2861 Win=130944 Len=0 TSval=2951645676 TSecr=1973892902"
"1378","43.332477","fe80::aa:1623:2a4e:a858","fe80::14d5:83a5:43c7:5ce8","TLSv1.2","203","2845","117","Application Data"
"1379","43.332548","fe80::14d5:83a5:43c7:5ce8","fe80::aa:1623:2a4e:a858","TCP","86","2861","0","57648  >  64036 [ACK] Seq=2861 Ack=2962 Win=130944 Len=0 TSval=1973892919 TSecr=2951645685"
"1388","45.345983","fe80::14d5:83a5:43c7:5ce8","fe80::aa:1623:2a4e:a858","TLSv1.2","171","2861","85","Application Data"
"1389","45.429294","fe80::aa:1623:2a4e:a858","fe80::14d5:83a5:43c7:5ce8","TCP","86","2962","0","64036  >  57648 [ACK] Seq=2962 Ack=2946 Win=130944 Len=0 TSval=2951647782 TSecr=1973894932"
"1390","45.435599","fe80::aa:1623:2a4e:a858","fe80::14d5:83a5:43c7:5ce8","TLSv1.2","203","2962","117","Application Data"
"1391","45.435711","fe80::14d5:83a5:43c7:5ce8","fe80::aa:1623:2a4e:a858","TCP","86","2946","0","57648  >  64036 [ACK] Seq=2946 Ack=3079 Win=130944 Len=0 TSval=1973895022 TSecr=2951647790"
"1441","47.452755","fe80::14d5:83a5:43c7:5ce8","fe80::aa:1623:2a4e:a858","TLSv1.2","171","2946","85","Application Data"
"1442","47.474687","fe80::aa:1623:2a4e:a858","fe80::14d5:83a5:43c7:5ce8","TCP","86","3079","0","64036  >  57648 [ACK] Seq=3079 Ack=3031 Win=130944 Len=0 TSval=2951649829 TSecr=1973897039"
"1443","47.483226","fe80::aa:1623:2a4e:a858","fe80::14d5:83a5:43c7:5ce8","TLSv1.2","203","3079","117","Application Data"
"1444","47.483336","fe80::14d5:83a5:43c7:5ce8","fe80::aa:1623:2a4e:a858","TCP","86","3031","0","57648  >  64036 [ACK] Seq=3031 Ack=3196 Win=130944 Len=0 TSval=1973897069 TSecr=2951649838"
"1483","49.497678","fe80::14d5:83a5:43c7:5ce8","fe80::aa:1623:2a4e:a858","TLSv1.2","171","3031","85","Application Data"
"1484","49.503280","fe80::aa:1623:2a4e:a858","fe80::14d5:83a5:43c7:5ce8","TCP","86","3196","0","64036  >  57648 [ACK] Seq=3196 Ack=3116 Win=130944 Len=0 TSval=2951651857 TSecr=1973899084"
"1486","49.511277","fe80::aa:1623:2a4e:a858","fe80::14d5:83a5:43c7:5ce8","TLSv1.2","203","3196","117","Application Data"
"1487","49.511396","fe80::14d5:83a5:43c7:5ce8","fe80::aa:1623:2a4e:a858","TCP","86","3116","0","57648  >  64036 [ACK] Seq=3116 Ack=3313 Win=130944 Len=0 TSval=1973899098 TSecr=2951651866"
"1502","51.528154","fe80::14d5:83a5:43c7:5ce8","fe80::aa:1623:2a4e:a858","TLSv1.2","171","3116","85","Application Data"
"1507","51.570769","fe80::aa:1623:2a4e:a858","fe80::14d5:83a5:43c7:5ce8","TCP","86","3313","0","64036  >  57648 [ACK] Seq=3313 Ack=3201 Win=130944 Len=0 TSval=2951653925 TSecr=1973901114"
"1508","51.579971","fe80::aa:1623:2a4e:a858","fe80::14d5:83a5:43c7:5ce8","TLSv1.2","203","3313","117","Application Data"
"1509","51.580069","fe80::14d5:83a5:43c7:5ce8","fe80::aa:1623:2a4e:a858","TCP","86","3201","0","57648  >  64036 [ACK] Seq=3201 Ack=3430 Win=130944 Len=0 TSval=1973901166 TSecr=2951653934"
"1528","53.596771","fe80::14d5:83a5:43c7:5ce8","fe80::aa:1623:2a4e:a858","TLSv1.2","171","3201","85","Application Data"
"1529","53.618787","fe80::aa:1623:2a4e:a858","fe80::14d5:83a5:43c7:5ce8","TCP","86","3430","0","64036  >  57648 [ACK] Seq=3430 Ack=3286 Win=130944 Len=0 TSval=2951655973 TSecr=1973903183"
"1530","53.627970","fe80::aa:1623:2a4e:a858","fe80::14d5:83a5:43c7:5ce8","TLSv1.2","203","3430","117","Application Data"
"1531","53.628095","fe80::14d5:83a5:43c7:5ce8","fe80::aa:1623:2a4e:a858","TCP","86","3286","0","57648  >  64036 [ACK] Seq=3286 Ack=3547 Win=130944 Len=0 TSval=1973903214 TSecr=2951655983"
"1559","55.649891","fe80::14d5:83a5:43c7:5ce8","fe80::aa:1623:2a4e:a858","TLSv1.2","171","3286","85","Application Data"
"1563","55.776942","fe80::aa:1623:2a4e:a858","fe80::14d5:83a5:43c7:5ce8","TCP","86","3547","0","64036  >  57648 [ACK] Seq=3547 Ack=3371 Win=130944 Len=0 TSval=2951658124 TSecr=1973905236"
"1564","55.789598","fe80::aa:1623:2a4e:a858","fe80::14d5:83a5:43c7:5ce8","TLSv1.2","203","3547","117","Application Data"
"1565","55.789711","fe80::14d5:83a5:43c7:5ce8","fe80::aa:1623:2a4e:a858","TCP","86","3371","0","57648  >  64036 [ACK] Seq=3371 Ack=3664 Win=130944 Len=0 TSval=1973905376 TSecr=2951658134"
"1611","57.805529","fe80::14d5:83a5:43c7:5ce8","fe80::aa:1623:2a4e:a858","TLSv1.2","171","3371","85","Application Data"
"1612","57.814434","fe80::aa:1623:2a4e:a858","fe80::14d5:83a5:43c7:5ce8","TCP","86","3664","0","64036  >  57648 [ACK] Seq=3664 Ack=3456 Win=130944 Len=0 TSval=2951660168 TSecr=1973907391"
"1613","57.821107","fe80::aa:1623:2a4e:a858","fe80::14d5:83a5:43c7:5ce8","TLSv1.2","203","3664","117","Application Data"
"1614","57.821211","fe80::14d5:83a5:43c7:5ce8","fe80::aa:1623:2a4e:a858","TCP","86","3456","0","57648  >  64036 [ACK] Seq=3456 Ack=3781 Win=130944 Len=0 TSval=1973907407 TSecr=2951660176"
"1624","59.836704","fe80::14d5:83a5:43c7:5ce8","fe80::aa:1623:2a4e:a858","TLSv1.2","171","3456","85","Application Data"
"1627","59.865511","fe80::aa:1623:2a4e:a858","fe80::14d5:83a5:43c7:5ce8","TCP","86","3781","0","64036  >  57648 [ACK] Seq=3781 Ack=3541 Win=130944 Len=0 TSval=2951662220 TSecr=1973909423"
"1628","59.873843","fe80::aa:1623:2a4e:a858","fe80::14d5:83a5:43c7:5ce8","TLSv1.2","203","3781","117","Application Data"
"1629","59.873914","fe80::14d5:83a5:43c7:5ce8","fe80::aa:1623:2a4e:a858","TCP","86","3541","0","57648  >  64036 [ACK] Seq=3541 Ack=3898 Win=130944 Len=0 TSval=1973909460 TSecr=2951662229"
"1657","61.890029","fe80::14d5:83a5:43c7:5ce8","fe80::aa:1623:2a4e:a858","TLSv1.2","171","3541","85","Application Data"
"1661","62.015724","fe80::aa:1623:2a4e:a858","fe80::14d5:83a5:43c7:5ce8","TCP","86","3898","0","64036  >  57648 [ACK] Seq=3898 Ack=3626 Win=130944 Len=0 TSval=2951664370 TSecr=1973911476"
"1662","62.022766","fe80::aa:1623:2a4e:a858","fe80::14d5:83a5:43c7:5ce8","TLSv1.2","203","3898","117","Application Data"
"1663","62.022866","fe80::14d5:83a5:43c7:5ce8","fe80::aa:1623:2a4e:a858","TCP","86","3626","0","57648  >  64036 [ACK] Seq=3626 Ack=4015 Win=130944 Len=0 TSval=1973911609 TSecr=2951664378"
"1692","64.035467","fe80::14d5:83a5:43c7:5ce8","fe80::aa:1623:2a4e:a858","TLSv1.2","171","3626","85","Application Data"
"1693","64.064455","fe80::aa:1623:2a4e:a858","fe80::14d5:83a5:43c7:5ce8","TCP","86","4015","0","64036  >  57648 [ACK] Seq=4015 Ack=3711 Win=130944 Len=0 TSval=2951666418 TSecr=1973913621"
"1694","64.071320","fe80::aa:1623:2a4e:a858","fe80::14d5:83a5:43c7:5ce8","TLSv1.2","203","4015","117","Application Data"
"1695","64.071387","fe80::14d5:83a5:43c7:5ce8","fe80::aa:1623:2a4e:a858","TCP","86","3711","0","57648  >  64036 [ACK] Seq=3711 Ack=4132 Win=130944 Len=0 TSval=1973913657 TSecr=2951666426"
"1696","64.078917","fe80::14d5:83a5:43c7:5ce8","fe80::aa:1623:2a4e:a858","TLSv1.2","171","3711","85","Application Data"
"1697","64.083836","fe80::aa:1623:2a4e:a858","fe80::14d5:83a5:43c7:5ce8","TCP","86","4132","0","64036  >  57648 [ACK] Seq=4132 Ack=3796 Win=130944 Len=0 TSval=2951666437 TSecr=1973913665"
"1698","64.088313","fe80::aa:1623:2a4e:a858","fe80::14d5:83a5:43c7:5ce8","TLSv1.2","171","4132","85","Application Data"
"1699","64.088376","fe80::14d5:83a5:43c7:5ce8","fe80::aa:1623:2a4e:a858","TCP","86","3796","0","57648  >  64036 [ACK] Seq=3796 Ack=4217 Win=130944 Len=0 TSval=1973913674 TSecr=2951666443"
"1700","64.093982","fe80::14d5:83a5:43c7:5ce8","fe80::aa:1623:2a4e:a858","TLSv1.2","171","3796","85","Application Data"
"1701","64.097949","fe80::aa:1623:2a4e:a858","fe80::14d5:83a5:43c7:5ce8","TCP","86","4217","0","64036  >  57648 [ACK] Seq=4217 Ack=3881 Win=130944 Len=0 TSval=2951666453 TSecr=1973913680"
"1702","64.103628","fe80::aa:1623:2a4e:a858","fe80::14d5:83a5:43c7:5ce8","TLSv1.2","171","4217","85","Application Data"
"1703","64.103695","fe80::14d5:83a5:43c7:5ce8","fe80::aa:1623:2a4e:a858","TCP","86","3881","0","57648  >  64036 [ACK] Seq=3881 Ack=4302 Win=130944 Len=0 TSval=1973913690 TSecr=2951666459"
"1704","64.122628","fe80::14d5:83a5:43c7:5ce8","fe80::aa:1623:2a4e:a858","TLSv1.2","155","3881","69","Encrypted Alert"
"1705","64.123087","fe80::14d5:83a5:43c7:5ce8","fe80::aa:1623:2a4e:a858","TCP","86","3950","0","57648  >  64036 [FIN, ACK] Seq=3950 Ack=4302 Win=131072 Len=0 TSval=1973913708 TSecr=2951666459"
"1706","64.128231","fe80::aa:1623:2a4e:a858","fe80::14d5:83a5:43c7:5ce8","TCP","86","4302","0","64036  >  57648 [ACK] Seq=4302 Ack=3950 Win=130944 Len=0 TSval=2951666482 TSecr=1973913708"
"1707","64.128231","fe80::aa:1623:2a4e:a858","fe80::14d5:83a5:43c7:5ce8","TCP","86","4302","0","64036  >  57648 [ACK] Seq=4302 Ack=3951 Win=130944 Len=0 TSval=2951666483 TSecr=1973913708"
"1844","69.180139","fe80::aa:1623:2a4e:a858","fe80::14d5:83a5:43c7:5ce8","TLSv1.2","155","4302","69","Encrypted Alert"
"1845","69.180140","fe80::aa:1623:2a4e:a858","fe80::14d5:83a5:43c7:5ce8","TCP","86","4371","0","64036  >  57648 [FIN, ACK] Seq=4371 Ack=3951 Win=130944 Len=0 TSval=2951671464 TSecr=1973913708"
"1846","69.180141","fe80::aa:1623:2a4e:a858","fe80::14d5:83a5:43c7:5ce8","TCP","74","4372","0","64036  >  57648 [RST, ACK] Seq=4372 Ack=3951 Win=130944 Len=0"
"1847","69.180327","fe80::14d5:83a5:43c7:5ce8","fe80::aa:1623:2a4e:a858","TCP","74","3951","0","57648  >  64036 [RST] Seq=3951 Win=0 Len=0"
"1848","69.180424","fe80::14d5:83a5:43c7:5ce8","fe80::aa:1623:2a4e:a858","TCP","74","3951","0","57648  >  64036 [RST] Seq=3951 Win=0 Len=0"
"1858","70.455854","fe80::14d5:83a5:43c7:5ce8","ff02::1","UDP","72","","","60548  >  15118 Len=10"
"1859","70.518716","fe80::aa:1623:2a4e:a858","fe80::14d5:83a5:43c7:5ce8","UDP","90","","","15118  >  60548 Len=28"
"1862","71.276256","fe80::14d5:83a5:43c7:5ce8","fe80::aa:1623:2a4e:a858","TCP","98","0","0","57650  >  64036 [SYN] Seq=0 Win=65535 Len=0 MSS=1440 WS=64 TSval=222961652 TSecr=0 SACK_PERM=1"
"1863","71.336749","fe80::aa:1623:2a4e:a858","fe80::14d5:83a5:43c7:5ce8","TCP","98","0","0","64036  >  57650 [SYN, ACK] Seq=0 Ack=1 Win=65535 Len=0 MSS=1440 WS=64 TSval=1168950412 TSecr=222961652 SACK_PERM=1"
"1864","71.336818","fe80::14d5:83a5:43c7:5ce8","fe80::aa:1623:2a4e:a858","TCP","86","1","0","57650  >  64036 [ACK] Seq=1 Ack=1 Win=131328 Len=0 TSval=222961713 TSecr=1168950412"
"1865","71.341179","fe80::aa:1623:2a4e:a858","fe80::14d5:83a5:43c7:5ce8","TCP","86","1","0","[TCP Window Update] 64036  >  57650 [ACK] Seq=1 Ack=1 Win=131328 Len=0 TSval=1168950419 TSecr=222961713"
"1866","71.373280","fe80::14d5:83a5:43c7:5ce8","fe80::aa:1623:2a4e:a858","TLSv1.2","288","1","202","Client Hello"
"1867","71.377108","fe80::aa:1623:2a4e:a858","fe80::14d5:83a5:43c7:5ce8","TCP","86","1","0","64036  >  57650 [ACK] Seq=1 Ack=203 Win=131136 Len=0 TSval=1168950455 TSecr=222961749"
"1868","71.382546","fe80::aa:1623:2a4e:a858","fe80::14d5:83a5:43c7:5ce8","TLSv1.2","176","1","90","Server Hello"
"1869","71.382605","fe80::14d5:83a5:43c7:5ce8","fe80::aa:1623:2a4e:a858","TCP","86","203","0","57650  >  64036 [ACK] Seq=203 Ack=91 Win=131264 Len=0 TSval=222961758 TSecr=1168950461"
"1870","71.382746","fe80::aa:1623:2a4e:a858","fe80::14d5:83a5:43c7:5ce8","TCP","1514","91","1428","64036  >  57650 [ACK] Seq=91 Ack=203 Win=131136 Len=1428 TSval=1168950461 TSecr=222961749 [TCP segment of a reassembled PDU]"
"1871","71.382747","fe80::aa:1623:2a4e:a858","fe80::14d5:83a5:43c7:5ce8","TLSv1.2","96","1519","10","Certificate"
"1872","71.382782","fe80::14d5:83a5:43c7:5ce8","fe80::aa:1623:2a4e:a858","TCP","86","203","0","57650  >  64036 [ACK] Seq=203 Ack=1529 Win=129792 Len=0 TSval=222961758 TSecr=1168950461"
"1873","71.387156","fe80::aa:1623:2a4e:a858","fe80::14d5:83a5:43c7:5ce8","TLSv1.2","215","1529","129","Server Key Exchange, Server Hello Done"
"1874","71.387230","fe80::14d5:83a5:43c7:5ce8","fe80::aa:1623:2a4e:a858","TCP","86","203","0","57650  >  64036 [ACK] Seq=203 Ack=1658 Win=130880 Len=0 TSval=222961763 TSecr=1168950464"
"1875","71.436212","fe80::14d5:83a5:43c7:5ce8","fe80::aa:1623:2a4e:a858","TLSv1.2","128","203","42","Client Key Exchange"
"1876","71.440662","fe80::aa:1623:2a4e:a858","fe80::14d5:83a5:43c7:5ce8","TCP","86","1658","0","64036  >  57650 [ACK] Seq=1658 Ack=245 Win=131072 Len=0 TSval=1168950519 TSecr=222961812"
"1877","71.445548","fe80::14d5:83a5:43c7:5ce8","fe80::aa:1623:2a4e:a858","TLSv1.2","92","245","6","Change Cipher Spec"
"1878","71.449612","fe80::aa:1623:2a4e:a858","fe80::14d5:83a5:43c7:5ce8","TCP","86","1658","0","64036  >  57650 [ACK] Seq=1658 Ack=251 Win=131072 Len=0 TSval=1168950528 TSecr=222961821"
