"No.","Time","Source","Destination","Protocol","Length","Sequence Number","TCP Segment Len","Info"
"72","21.289098","fe80::4e9:7ecb:78c2:fe8e","ff02::1","UDP","72","","","52276  >  15118 Len=10"
"73","21.544102","fe80::4e9:7ecb:78c2:fe8e","ff02::1","UDP","72","","","52276  >  15118 Len=10"
"74","21.800277","fe80::4e9:7ecb:78c2:fe8e","ff02::1","UDP","72","","","52276  >  15118 Len=10"
"75","21.865011","fe80::aa:1623:2a4e:a858","fe80::4e9:7ecb:78c2:fe8e","UDP","90","","","15118  >  52276 Len=28"
"78","22.432734","fe80::aa:1623:2a4e:a858","fe80::4e9:7ecb:78c2:fe8e","UDP","90","","","15118  >  52276 Len=28"
"85","23.986969","fe80::4e9:7ecb:78c2:fe8e","fe80::aa:1623:2a4e:a858","TCP","98","0","0","57156  >  63834 [SYN, ECN, CWR] Seq=0 Win=65535 Len=0 MSS=1440 WS=64 TSval=805245635 TSecr=0 SACK_PERM=1"
"86","24.146583","fe80::4e9:7ecb:78c2:fe8e","fe80::aa:1623:2a4e:a858","TCP","98","0","0","[TCP Retransmission] [TCP Port numbers reused] 57156  >  63834 [SYN] Seq=0 Win=65535 Len=0 MSS=1440 WS=64 TSval=805246636 TSecr=0 SACK_PERM=1"
"87","24.259988","fe80::aa:1623:2a4e:a858","fe80::4e9:7ecb:78c2:fe8e","TCP","98","0","0","63834  >  57156 [SYN, ACK] Seq=0 Ack=1 Win=65535 Len=0 MSS=1440 WS=64 TSval=1649074991 TSecr=805246636 SACK_PERM=1"
"88","24.260069","fe80::4e9:7ecb:78c2:fe8e","fe80::aa:1623:2a4e:a858","TCP","86","1","0","57156  >  63834 [ACK] Seq=1 Ack=1 Win=131328 Len=0 TSval=805246749 TSecr=1649074991"
"89","24.345767","fe80::4e9:7ecb:78c2:fe8e","fe80::aa:1623:2a4e:a858","TLSv1.2","288","1","202","Client Hello"
"90","24.378514","fe80::aa:1623:2a4e:a858","fe80::4e9:7ecb:78c2:fe8e","TCP","98","0","0","[TCP Retransmission] 63834  >  57156 [SYN, ACK] Seq=0 Ack=1 Win=65535 Len=0 MSS=1440 WS=64 TSval=1649075152 TSecr=805246636 SACK_PERM=1"
"91","24.378613","fe80::4e9:7ecb:78c2:fe8e","fe80::aa:1623:2a4e:a858","TCP","86","203","0","[TCP Dup ACK 88#1] 57156  >  63834 [ACK] Seq=203 Ack=1 Win=131328 Len=0 TSval=805246866 TSecr=1649074991"
"92","24.416788","fe80::aa:1623:2a4e:a858","fe80::4e9:7ecb:78c2:fe8e","TCP","86","1","0","63834  >  57156 [ACK] Seq=1 Ack=203 Win=131136 Len=0 TSval=1649075232 TSecr=805246834"
"95","24.531830","fe80::aa:1623:2a4e:a858","fe80::4e9:7ecb:78c2:fe8e","TLSv1.2","176","1","90","Server Hello"
"96","24.531905","fe80::4e9:7ecb:78c2:fe8e","fe80::aa:1623:2a4e:a858","TCP","86","203","0","57156  >  63834 [ACK] Seq=203 Ack=91 Win=131264 Len=0 TSval=805247017 TSecr=1649075307"
"97","24.595365","fe80::aa:1623:2a4e:a858","fe80::4e9:7ecb:78c2:fe8e","TCP","1514","91","1428","63834  >  57156 [ACK] Seq=91 Ack=203 Win=131136 Len=1428 TSval=1649075308 TSecr=805246866 [TCP segment of a reassembled PDU]"
"98","24.637348","fe80::aa:1623:2a4e:a858","fe80::4e9:7ecb:78c2:fe8e","TLSv1.2","96","1519","10","Certificate"
"99","24.637422","fe80::4e9:7ecb:78c2:fe8e","fe80::aa:1623:2a4e:a858","TCP","86","203","0","57156  >  63834 [ACK] Seq=203 Ack=1529 Win=131008 Len=0 TSval=805247120 TSecr=1649075308"
"100","24.664886","fe80::aa:1623:2a4e:a858","fe80::4e9:7ecb:78c2:fe8e","TLSv1.2","215","1529","129","Server Key Exchange, Server Hello Done"
"101","24.664988","fe80::4e9:7ecb:78c2:fe8e","fe80::aa:1623:2a4e:a858","TCP","86","203","0","57156  >  63834 [ACK] Seq=203 Ack=1658 Win=130880 Len=0 TSval=805247147 TSecr=1649075488"
"102","24.729212","fe80::4e9:7ecb:78c2:fe8e","fe80::aa:1623:2a4e:a858","TLSv1.2","128","203","42","Client Key Exchange"
"104","24.944376","fe80::aa:1623:2a4e:a858","fe80::4e9:7ecb:78c2:fe8e","TCP","86","1658","0","63834  >  57156 [ACK] Seq=1658 Ack=245 Win=131072 Len=0 TSval=1649075622 TSecr=805247210"
"105","24.944465","fe80::4e9:7ecb:78c2:fe8e","fe80::aa:1623:2a4e:a858","TLSv1.2","177","245","91","Change Cipher Spec, Encrypted Handshake Message"
"106","25.034804","fe80::aa:1623:2a4e:a858","fe80::4e9:7ecb:78c2:fe8e","TCP","86","1658","0","63834  >  57156 [ACK] Seq=1658 Ack=336 Win=131008 Len=0 TSval=1649075840 TSecr=805247424"
"107","25.063702","fe80::aa:1623:2a4e:a858","fe80::4e9:7ecb:78c2:fe8e","TLSv1.2","92","1658","6","Change Cipher Spec"
"108","25.063804","fe80::4e9:7ecb:78c2:fe8e","fe80::aa:1623:2a4e:a858","TCP","86","336","0","57156  >  63834 [ACK] Seq=336 Ack=1664 Win=131008 Len=0 TSval=805247542 TSecr=1649075847"
"109","25.165804","fe80::aa:1623:2a4e:a858","fe80::4e9:7ecb:78c2:fe8e","TLSv1.2","171","1664","85","Encrypted Handshake Message"
"110","25.165875","fe80::4e9:7ecb:78c2:fe8e","fe80::aa:1623:2a4e:a858","TCP","86","336","0","57156  >  63834 [ACK] Seq=336 Ack=1749 Win=130944 Len=0 TSval=805247644 TSecr=1649075978"
"111","25.262380","fe80::4e9:7ecb:78c2:fe8e","fe80::aa:1623:2a4e:a858","TLSv1.2","187","336","101","Application Data"
"112","25.423826","fe80::aa:1623:2a4e:a858","fe80::4e9:7ecb:78c2:fe8e","TCP","86","1749","0","63834  >  57156 [ACK] Seq=1749 Ack=437 Win=130944 Len=0 TSval=1649076175 TSecr=805247739"
"113","25.480590","fe80::aa:1623:2a4e:a858","fe80::4e9:7ecb:78c2:fe8e","TLSv1.2","155","1749","69","Application Data"
"114","25.480676","fe80::4e9:7ecb:78c2:fe8e","fe80::aa:1623:2a4e:a858","TCP","86","437","0","57156  >  63834 [ACK] Seq=437 Ack=1818 Win=130944 Len=0 TSval=805247956 TSecr=1649076278"
"115","25.677669","fe80::4e9:7ecb:78c2:fe8e","fe80::aa:1623:2a4e:a858","TLSv1.2","171","437","85","Application Data"
"116","26.120435","fe80::aa:1623:2a4e:a858","fe80::4e9:7ecb:78c2:fe8e","TCP","86","1818","0","63834  >  57156 [ACK] Seq=1818 Ack=522 Win=130944 Len=0 TSval=1649076548 TSecr=805248152"
"117","26.140914","fe80::aa:1623:2a4e:a858","fe80::4e9:7ecb:78c2:fe8e","TLSv1.2","187","1818","101","Application Data"
"118","26.140919","fe80::aa:1623:2a4e:a858","fe80::4e9:7ecb:78c2:fe8e","TCP","187","1818","101","[TCP Retransmission] 63834  >  57156 [PSH, ACK] Seq=1818 Ack=522 Win=131072 Len=101 TSval=1649076828 TSecr=805248152"
"119","26.141019","fe80::4e9:7ecb:78c2:fe8e","fe80::aa:1623:2a4e:a858","TCP","86","522","0","57156  >  63834 [ACK] Seq=522 Ack=1919 Win=130944 Len=0 TSval=805248614 TSecr=1649076561"
"120","26.141107","fe80::4e9:7ecb:78c2:fe8e","fe80::aa:1623:2a4e:a858","TCP","98","522","0","[TCP Dup ACK 119#1] 57156  >  63834 [ACK] Seq=522 Ack=1919 Win=130944 Len=0 TSval=805248614 TSecr=1649076828 SLE=1818 SRE=1919"
"121","26.154096","fe80::4e9:7ecb:78c2:fe8e","fe80::aa:1623:2a4e:a858","TLSv1.2","171","522","85","Application Data"
"122","26.270615","fe80::aa:1623:2a4e:a858","fe80::4e9:7ecb:78c2:fe8e","TCP","86","1919","0","63834  >  57156 [ACK] Seq=1919 Ack=607 Win=130944 Len=0 TSval=1649077087 TSecr=805248627"
"123","26.305357","fe80::aa:1623:2a4e:a858","fe80::4e9:7ecb:78c2:fe8e","TLSv1.2","251","1919","165","Application Data"
"124","26.305467","fe80::4e9:7ecb:78c2:fe8e","fe80::aa:1623:2a4e:a858","TCP","86","607","0","57156  >  63834 [ACK] Seq=607 Ack=2084 Win=130880 Len=0 TSval=805248776 TSecr=1649077102"
"125","26.467502","fe80::4e9:7ecb:78c2:fe8e","fe80::aa:1623:2a4e:a858","TLSv1.2","171","607","85","Application Data"
"126","26.579491","fe80::aa:1623:2a4e:a858","fe80::4e9:7ecb:78c2:fe8e","TCP","86","2084","0","63834  >  57156 [ACK] Seq=2084 Ack=692 Win=130944 Len=0 TSval=1649077333 TSecr=805248938"
"127","26.620138","fe80::aa:1623:2a4e:a858","fe80::4e9:7ecb:78c2:fe8e","TLSv1.2","171","2084","85","Application Data"
"128","26.620211","fe80::4e9:7ecb:78c2:fe8e","fe80::aa:1623:2a4e:a858","TCP","86","692","0","57156  >  63834 [ACK] Seq=692 Ack=2169 Win=130944 Len=0 TSval=805249090 TSecr=1649077345"
"130","26.889270","fe80::4e9:7ecb:78c2:fe8e","fe80::aa:1623:2a4e:a858","TCP","1514","692","1428","57156  >  63834 [ACK] Seq=692 Ack=2169 Win=131072 Len=1428 TSval=805249358 TSecr=1649077345 [TCP segment of a reassembled PDU]"
"131","26.889271","fe80::4e9:7ecb:78c2:fe8e","fe80::aa:1623:2a4e:a858","TLSv1.2","183","2120","97","Application Data"
"134","27.061254","fe80::aa:1623:2a4e:a858","fe80::4e9:7ecb:78c2:fe8e","TCP","86","2169","0","63834  >  57156 [ACK] Seq=2169 Ack=2120 Win=129600 Len=0 TSval=1649077829 TSecr=805249358"
"135","27.067619","fe80::aa:1623:2a4e:a858","fe80::4e9:7ecb:78c2:fe8e","TCP","86","2169","0","63834  >  57156 [ACK] Seq=2169 Ack=2217 Win=130944 Len=0 TSval=1649077854 TSecr=805249358"
"136","27.111290","fe80::aa:1623:2a4e:a858","fe80::4e9:7ecb:78c2:fe8e","TLSv1.2","187","2169","101","Application Data"
"137","27.111358","fe80::4e9:7ecb:78c2:fe8e","fe80::aa:1623:2a4e:a858","TCP","86","2217","0","57156  >  63834 [ACK] Seq=2217 Ack=2270 Win=130944 Len=0 TSval=805249578 TSecr=1649077920"
"138","27.261607","fe80::4e9:7ecb:78c2:fe8e","fe80::aa:1623:2a4e:a858","TLSv1.2","459","2217","373","Application Data"
"139","27.357605","fe80::aa:1623:2a4e:a858","fe80::4e9:7ecb:78c2:fe8e","TCP","86","2270","0","63834  >  57156 [ACK] Seq=2270 Ack=2590 Win=130688 Len=0 TSval=1649078154 TSecr=805249728"
"140","27.435227","fe80::aa:1623:2a4e:a858","fe80::4e9:7ecb:78c2:fe8e","TLSv1.2","171","2270","85","Application Data"
"141","27.435325","fe80::4e9:7ecb:78c2:fe8e","fe80::aa:1623:2a4e:a858","TCP","86","2590","0","57156  >  63834 [ACK] Seq=2590 Ack=2355 Win=130944 Len=0 TSval=805249901 TSecr=1649078180"
"142","27.448089","fe80::4e9:7ecb:78c2:fe8e","fe80::aa:1623:2a4e:a858","TLSv1.2","187","2590","101","Application Data"
"144","27.965192","fe80::aa:1623:2a4e:a858","fe80::4e9:7ecb:78c2:fe8e","TCP","171","2270","85","[TCP Spurious Retransmission] 63834  >  57156 [PSH, ACK] Seq=2270 Ack=2590 Win=131072 Len=85 TSval=1649078618 TSecr=805249728"
"145","27.965263","fe80::4e9:7ecb:78c2:fe8e","fe80::aa:1623:2a4e:a858","TCP","98","2691","0","[TCP Dup ACK 141#1] 57156  >  63834 [ACK] Seq=2691 Ack=2355 Win=131072 Len=0 TSval=805250430 TSecr=1649078618 SLE=2270 SRE=2355"
"146","28.553189","fe80::4e9:7ecb:78c2:fe8e","fe80::aa:1623:2a4e:a858","TCP","187","2590","101","[TCP Retransmission] 57156  >  63834 [PSH, ACK] Seq=2590 Ack=2355 Win=131072 Len=101 TSval=805251016 TSecr=1649078618"
"148","28.709504","fe80::aa:1623:2a4e:a858","fe80::4e9:7ecb:78c2:fe8e","TCP","86","2355","0","63834  >  57156 [ACK] Seq=2355 Ack=2691 Win=130944 Len=0 TSval=1649079524 TSecr=805251016"
"149","28.718481","fe80::aa:1623:2a4e:a858","fe80::4e9:7ecb:78c2:fe8e","TLSv1.2","491","2355","405","Application Data"
"150","28.718534","fe80::4e9:7ecb:78c2:fe8e","fe80::aa:1623:2a4e:a858","TCP","86","2691","0","57156  >  63834 [ACK] Seq=2691 Ack=2760 Win=130624 Len=0 TSval=805251180 TSecr=1649079543"
"151","28.828058","fe80::4e9:7ecb:78c2:fe8e","fe80::aa:1623:2a4e:a858","TLSv1.2","171","2691","85","Application Data"
"153","28.876759","fe80::aa:1623:2a4e:a858","fe80::4e9:7ecb:78c2:fe8e","TCP","86","2760","0","63834  >  57156 [ACK] Seq=2760 Ack=2776 Win=130944 Len=0 TSval=1649079696 TSecr=805251289"
"154","28.919655","fe80::aa:1623:2a4e:a858","fe80::4e9:7ecb:78c2:fe8e","TLSv1.2","171","2760","85","Application Data"
"155","28.919749","fe80::4e9:7ecb:78c2:fe8e","fe80::aa:1623:2a4e:a858","TCP","86","2776","0","57156  >  63834 [ACK] Seq=2776 Ack=2845 Win=130944 Len=0 TSval=805251379 TSecr=1649079709"
"156","28.928459","fe80::4e9:7ecb:78c2:fe8e","fe80::aa:1623:2a4e:a858","TLSv1.2","171","2776","85","Application Data"
"157","29.086409","fe80::aa:1623:2a4e:a858","fe80::4e9:7ecb:78c2:fe8e","TCP","86","2845","0","63834  >  57156 [ACK] Seq=2845 Ack=2861 Win=130944 Len=0 TSval=1649079872 TSecr=805251388"
"158","29.142129","fe80::aa:1623:2a4e:a858","fe80::4e9:7ecb:78c2:fe8e","TLSv1.2","203","2845","117","Application Data"
"159","29.142207","fe80::4e9:7ecb:78c2:fe8e","fe80::aa:1623:2a4e:a858","TCP","86","2861","0","57156  >  63834 [ACK] Seq=2861 Ack=2962 Win=130944 Len=0 TSval=805251601 TSecr=1649079882"
"161","29.805731","fe80::aa:1623:2a4e:a858","fe80::4e9:7ecb:78c2:fe8e","TCP","203","2845","117","[TCP Spurious Retransmission] 63834  >  57156 [PSH, ACK] Seq=2845 Ack=2861 Win=131072 Len=117 TSval=1649080303 TSecr=805251388"
"162","29.805809","fe80::4e9:7ecb:78c2:fe8e","fe80::aa:1623:2a4e:a858","TCP","98","2861","0","[TCP Window Update] 57156  >  63834 [ACK] Seq=2861 Ack=2962 Win=131072 Len=0 TSval=805252263 TSecr=1649080303 SLE=2845 SRE=2962"
"163","31.162581","fe80::4e9:7ecb:78c2:fe8e","fe80::aa:1623:2a4e:a858","TLSv1.2","171","2861","85","Application Data"
"164","31.323942","fe80::aa:1623:2a4e:a858","fe80::4e9:7ecb:78c2:fe8e","TCP","86","2962","0","63834  >  57156 [ACK] Seq=2962 Ack=2946 Win=130944 Len=0 TSval=1649082089 TSecr=805253619"
"165","31.375840","fe80::aa:1623:2a4e:a858","fe80::4e9:7ecb:78c2:fe8e","TLSv1.2","203","2962","117","Application Data"
"166","31.375915","fe80::4e9:7ecb:78c2:fe8e","fe80::aa:1623:2a4e:a858","TCP","86","2946","0","57156  >  63834 [ACK] Seq=2946 Ack=3079 Win=130944 Len=0 TSval=805253830 TSecr=1649082100"
"167","31.969565","fe80::aa:1623:2a4e:a858","fe80::4e9:7ecb:78c2:fe8e","TCP","203","2962","117","[TCP Spurious Retransmission] 63834  >  57156 [PSH, ACK] Seq=2962 Ack=2946 Win=131072 Len=117 TSval=1649082592 TSecr=805253619"
"168","31.969634","fe80::4e9:7ecb:78c2:fe8e","fe80::aa:1623:2a4e:a858","TCP","98","2946","0","[TCP Window Update] 57156  >  63834 [ACK] Seq=2946 Ack=3079 Win=131072 Len=0 TSval=805254422 TSecr=1649082592 SLE=2962 SRE=3079"
"171","33.390469","fe80::4e9:7ecb:78c2:fe8e","fe80::aa:1623:2a4e:a858","TLSv1.2","171","2946","85","Application Data"
"172","33.536507","fe80::aa:1623:2a4e:a858","fe80::4e9:7ecb:78c2:fe8e","TCP","86","3079","0","63834  >  57156 [ACK] Seq=3079 Ack=3031 Win=130944 Len=0 TSval=1649084356 TSecr=805255840"
"173","33.585172","fe80::aa:1623:2a4e:a858","fe80::4e9:7ecb:78c2:fe8e","TLSv1.2","203","3079","117","Application Data"
"174","33.585257","fe80::4e9:7ecb:78c2:fe8e","fe80::aa:1623:2a4e:a858","TCP","86","3031","0","57156  >  63834 [ACK] Seq=3031 Ack=3196 Win=130944 Len=0 TSval=805256034 TSecr=1649084367"
"181","35.595034","fe80::4e9:7ecb:78c2:fe8e","fe80::aa:1623:2a4e:a858","TLSv1.2","171","3031","85","Application Data"
"182","35.666373","fe80::aa:1623:2a4e:a858","fe80::4e9:7ecb:78c2:fe8e","TCP","86","3196","0","63834  >  57156 [ACK] Seq=3196 Ack=3116 Win=130944 Len=0 TSval=1649086485 TSecr=805258042"
"183","35.669676","fe80::aa:1623:2a4e:a858","fe80::4e9:7ecb:78c2:fe8e","TLSv1.2","203","3196","117","Application Data"
"184","35.669748","fe80::4e9:7ecb:78c2:fe8e","fe80::aa:1623:2a4e:a858","TCP","86","3116","0","57156  >  63834 [ACK] Seq=3116 Ack=3313 Win=130944 Len=0 TSval=805258116 TSecr=1649086495"
"186","37.683215","fe80::4e9:7ecb:78c2:fe8e","fe80::aa:1623:2a4e:a858","TLSv1.2","171","3116","85","Application Data"
"187","37.879428","fe80::aa:1623:2a4e:a858","fe80::4e9:7ecb:78c2:fe8e","TCP","86","3313","0","63834  >  57156 [ACK] Seq=3313 Ack=3201 Win=130944 Len=0 TSval=1649088653 TSecr=805260128"
"188","37.918371","fe80::aa:1623:2a4e:a858","fe80::4e9:7ecb:78c2:fe8e","TLSv1.2","203","3313","117","Application Data"
"189","37.918443","fe80::4e9:7ecb:78c2:fe8e","fe80::aa:1623:2a4e:a858","TCP","86","3201","0","57156  >  63834 [ACK] Seq=3201 Ack=3430 Win=130944 Len=0 TSval=805260362 TSecr=1649088662"
"197","39.928312","fe80::4e9:7ecb:78c2:fe8e","fe80::aa:1623:2a4e:a858","TLSv1.2","171","3201","85","Application Data"
"203","40.216570","fe80::aa:1623:2a4e:a858","fe80::4e9:7ecb:78c2:fe8e","TCP","86","3430","0","63834  >  57156 [ACK] Seq=3430 Ack=3286 Win=130944 Len=0 TSval=1649090920 TSecr=805262370"
"204","40.222735","fe80::aa:1623:2a4e:a858","fe80::4e9:7ecb:78c2:fe8e","TLSv1.2","203","3430","117","Application Data"
"205","40.222787","fe80::4e9:7ecb:78c2:fe8e","fe80::aa:1623:2a4e:a858","TCP","86","3286","0","57156  >  63834 [ACK] Seq=3286 Ack=3547 Win=130944 Len=0 TSval=805262664 TSecr=1649090930"
"259","42.233756","fe80::4e9:7ecb:78c2:fe8e","fe80::aa:1623:2a4e:a858","TLSv1.2","171","3286","85","Application Data"
"261","42.444130","fe80::aa:1623:2a4e:a858","fe80::4e9:7ecb:78c2:fe8e","TCP","86","3547","0","63834  >  57156 [ACK] Seq=3547 Ack=3371 Win=130944 Len=0 TSval=1649093266 TSecr=805264668"
"262","42.449606","fe80::aa:1623:2a4e:a858","fe80::4e9:7ecb:78c2:fe8e","TLSv1.2","203","3547","117","Application Data"
"263","42.449662","fe80::4e9:7ecb:78c2:fe8e","fe80::aa:1623:2a4e:a858","TCP","86","3371","0","57156  >  63834 [ACK] Seq=3371 Ack=3664 Win=130944 Len=0 TSval=805264883 TSecr=1649093276"
"275","44.457958","fe80::4e9:7ecb:78c2:fe8e","fe80::aa:1623:2a4e:a858","TLSv1.2","171","3371","85","Application Data"
"276","44.580517","fe80::aa:1623:2a4e:a858","fe80::4e9:7ecb:78c2:fe8e","TCP","86","3664","0","63834  >  57156 [ACK] Seq=3664 Ack=3456 Win=130944 Len=0 TSval=1649095400 TSecr=805266891"
"277","44.586047","fe80::aa:1623:2a4e:a858","fe80::4e9:7ecb:78c2:fe8e","TLSv1.2","203","3664","117","Application Data"
"278","44.586104","fe80::4e9:7ecb:78c2:fe8e","fe80::aa:1623:2a4e:a858","TCP","86","3456","0","57156  >  63834 [ACK] Seq=3456 Ack=3781 Win=130944 Len=0 TSval=805267018 TSecr=1649095410"
"282","46.599260","fe80::4e9:7ecb:78c2:fe8e","fe80::aa:1623:2a4e:a858","TLSv1.2","171","3456","85","Application Data"
"284","47.205805","fe80::4e9:7ecb:78c2:fe8e","fe80::aa:1623:2a4e:a858","TCP","171","3456","85","[TCP Retransmission] 57156  >  63834 [PSH, ACK] Seq=3456 Ack=3781 Win=131072 Len=85 TSval=805269634 TSecr=1649095410"
"285","47.224556","fe80::aa:1623:2a4e:a858","fe80::4e9:7ecb:78c2:fe8e","TCP","86","3781","0","63834  >  57156 [ACK] Seq=3781 Ack=3541 Win=130944 Len=0 TSval=1649097542 TSecr=805269029"
"286","47.240569","fe80::aa:1623:2a4e:a858","fe80::4e9:7ecb:78c2:fe8e","TLSv1.2","203","3781","117","Application Data"
"287","47.240572","fe80::aa:1623:2a4e:a858","fe80::4e9:7ecb:78c2:fe8e","TCP","203","3781","117","[TCP Retransmission] 63834  >  57156 [PSH, ACK] Seq=3781 Ack=3541 Win=131072 Len=117 TSval=1649097921 TSecr=805269029"
"288","47.240612","fe80::4e9:7ecb:78c2:fe8e","fe80::aa:1623:2a4e:a858","TCP","86","3541","0","57156  >  63834 [ACK] Seq=3541 Ack=3898 Win=130944 Len=0 TSval=805269668 TSecr=1649097553"
"289","47.240663","fe80::4e9:7ecb:78c2:fe8e","fe80::aa:1623:2a4e:a858","TCP","98","3541","0","[TCP Dup ACK 288#1] 57156  >  63834 [ACK] Seq=3541 Ack=3898 Win=130944 Len=0 TSval=805269668 TSecr=1649097921 SLE=3781 SRE=3898"
"290","47.257677","fe80::aa:1623:2a4e:a858","fe80::4e9:7ecb:78c2:fe8e","TCP","98","3898","0","[TCP Dup ACK 285#1] 63834  >  57156 [ACK] Seq=3898 Ack=3541 Win=131072 Len=0 TSval=1649098079 TSecr=805269634 SLE=3456 SRE=3541"
"292","49.254130","fe80::4e9:7ecb:78c2:fe8e","fe80::aa:1623:2a4e:a858","TLSv1.2","171","3541","85","Application Data"
"293","49.448028","fe80::aa:1623:2a4e:a858","fe80::4e9:7ecb:78c2:fe8e","TCP","86","3898","0","63834  >  57156 [ACK] Seq=3898 Ack=3626 Win=130944 Len=0 TSval=1649100232 TSecr=805271681"
"294","49.476998","fe80::aa:1623:2a4e:a858","fe80::4e9:7ecb:78c2:fe8e","TLSv1.2","203","3898","117","Application Data"
"295","49.477054","fe80::4e9:7ecb:78c2:fe8e","fe80::aa:1623:2a4e:a858","TCP","86","3626","0","57156  >  63834 [ACK] Seq=3626 Ack=4015 Win=130944 Len=0 TSval=805271902 TSecr=1649100243"
"296","51.490267","fe80::4e9:7ecb:78c2:fe8e","fe80::aa:1623:2a4e:a858","TLSv1.2","171","3626","85","Application Data"
"297","51.706102","fe80::aa:1623:2a4e:a858","fe80::4e9:7ecb:78c2:fe8e","TCP","86","4015","0","63834  >  57156 [ACK] Seq=4015 Ack=3711 Win=130944 Len=0 TSval=1649102509 TSecr=805273914"
"298","51.737758","fe80::aa:1623:2a4e:a858","fe80::4e9:7ecb:78c2:fe8e","TLSv1.2","203","4015","117","Application Data"
"299","51.737815","fe80::4e9:7ecb:78c2:fe8e","fe80::aa:1623:2a4e:a858","TCP","86","3711","0","57156  >  63834 [ACK] Seq=3711 Ack=4132 Win=130944 Len=0 TSval=805274160 TSecr=1649102518"
"300","51.746424","fe80::4e9:7ecb:78c2:fe8e","fe80::aa:1623:2a4e:a858","TLSv1.2","171","3711","85","Application Data"
"301","51.849883","fe80::aa:1623:2a4e:a858","fe80::4e9:7ecb:78c2:fe8e","TCP","86","4132","0","63834  >  57156 [ACK] Seq=4132 Ack=3796 Win=130944 Len=0 TSval=1649102645 TSecr=805274168"
"302","51.857779","fe80::aa:1623:2a4e:a858","fe80::4e9:7ecb:78c2:fe8e","TLSv1.2","171","4132","85","Application Data"
"303","51.857837","fe80::4e9:7ecb:78c2:fe8e","fe80::aa:1623:2a4e:a858","TCP","86","3796","0","57156  >  63834 [ACK] Seq=3796 Ack=4217 Win=130944 Len=0 TSval=805274278 TSecr=1649102654"
"304","51.864336","fe80::4e9:7ecb:78c2:fe8e","fe80::aa:1623:2a4e:a858","TLSv1.2","171","3796","85","Application Data"
"305","51.917118","fe80::aa:1623:2a4e:a858","fe80::4e9:7ecb:78c2:fe8e","TCP","86","4217","0","63834  >  57156 [ACK] Seq=4217 Ack=3881 Win=130944 Len=0 TSval=1649102734 TSecr=805274284"
"306","51.933239","fe80::aa:1623:2a4e:a858","fe80::4e9:7ecb:78c2:fe8e","TLSv1.2","171","4217","85","Application Data"
"307","51.933299","fe80::4e9:7ecb:78c2:fe8e","fe80::aa:1623:2a4e:a858","TCP","86","3881","0","57156  >  63834 [ACK] Seq=3881 Ack=4302 Win=130944 Len=0 TSval=805274352 TSecr=1649102742"
"308","51.965312","fe80::4e9:7ecb:78c2:fe8e","fe80::aa:1623:2a4e:a858","TLSv1.2","155","3881","69","Encrypted Alert"
"309","51.966668","fe80::4e9:7ecb:78c2:fe8e","fe80::aa:1623:2a4e:a858","TCP","86","3950","0","57156  >  63834 [FIN, ACK] Seq=3950 Ack=4302 Win=131072 Len=0 TSval=805274384 TSecr=1649102742"
"310","52.032769","fe80::aa:1623:2a4e:a858","fe80::4e9:7ecb:78c2:fe8e","TCP","86","4302","0","63834  >  57156 [ACK] Seq=4302 Ack=3950 Win=130944 Len=0 TSval=1649102850 TSecr=805274383"
"311","52.037310","fe80::aa:1623:2a4e:a858","fe80::4e9:7ecb:78c2:fe8e","TCP","86","4302","0","63834  >  57156 [ACK] Seq=4302 Ack=3951 Win=130944 Len=0 TSval=1649102865 TSecr=805274384"
"326","57.142537","fe80::aa:1623:2a4e:a858","fe80::4e9:7ecb:78c2:fe8e","TLSv1.2","155","4302","69","Encrypted Alert"
"327","57.142650","fe80::4e9:7ecb:78c2:fe8e","fe80::aa:1623:2a4e:a858","TCP","74","3951","0","57156  >  63834 [RST] Seq=3951 Win=0 Len=0"
"328","57.157878","fe80::aa:1623:2a4e:a858","fe80::4e9:7ecb:78c2:fe8e","TCP","86","4371","0","63834  >  57156 [FIN, ACK] Seq=4371 Ack=3951 Win=130944 Len=0 TSval=1649107749 TSecr=805274384"
"329","57.157881","fe80::aa:1623:2a4e:a858","fe80::4e9:7ecb:78c2:fe8e","TCP","74","4372","0","63834  >  57156 [RST, ACK] Seq=4372 Ack=3951 Win=130944 Len=0"
"330","57.157924","fe80::4e9:7ecb:78c2:fe8e","fe80::aa:1623:2a4e:a858","TCP","74","3951","0","57156  >  63834 [RST] Seq=3951 Win=0 Len=0"
"342","62.043664","fe80::4e9:7ecb:78c2:fe8e","ff02::1","UDP","72","","","54412  >  15118 Len=10"
"343","62.301406","fe80::4e9:7ecb:78c2:fe8e","ff02::1","UDP","72","","","54412  >  15118 Len=10"
"344","62.395543","fe80::aa:1623:2a4e:a858","fe80::4e9:7ecb:78c2:fe8e","UDP","90","","","15118  >  54412 Len=28"
"345","62.403215","fe80::aa:1623:2a4e:a858","fe80::4e9:7ecb:78c2:fe8e","UDP","90","","","15118  >  54412 Len=28"
"347","63.488450","fe80::4e9:7ecb:78c2:fe8e","fe80::aa:1623:2a4e:a858","TCP","98","0","0","57157  >  63834 [SYN, ECN, CWR] Seq=0 Win=65535 Len=0 MSS=1440 WS=64 TSval=805285900 TSecr=0 SACK_PERM=1"
"348","63.668565","fe80::aa:1623:2a4e:a858","fe80::4e9:7ecb:78c2:fe8e","TCP","98","0","0","63834  >  57157 [SYN, ACK, ECN] Seq=0 Ack=1 Win=65535 Len=0 MSS=1440 WS=64 TSval=3643025511 TSecr=805285900 SACK_PERM=1"
"349","63.668748","fe80::4e9:7ecb:78c2:fe8e","fe80::aa:1623:2a4e:a858","TCP","86","1","0","57157  >  63834 [ACK] Seq=1 Ack=1 Win=131328 Len=0 TSval=805286080 TSecr=3643025511"
"350","63.724809","fe80::aa:1623:2a4e:a858","fe80::4e9:7ecb:78c2:fe8e","TCP","86","1","0","[TCP Window Update] 63834  >  57157 [ACK] Seq=1 Ack=1 Win=131328 Len=0 TSval=3643025629 TSecr=805286080"
"351","63.737733","fe80::4e9:7ecb:78c2:fe8e","fe80::aa:1623:2a4e:a858","TLSv1.2","288","1","202","Client Hello"
"352","63.882085","fe80::aa:1623:2a4e:a858","fe80::4e9:7ecb:78c2:fe8e","TCP","86","1","0","63834  >  57157 [ACK] Seq=1 Ack=203 Win=131136 Len=0 TSval=3643025747 TSecr=805286148"
"353","63.893388","fe80::aa:1623:2a4e:a858","fe80::4e9:7ecb:78c2:fe8e","TLSv1.2","176","1","90","Server Hello"
"354","63.893472","fe80::4e9:7ecb:78c2:fe8e","fe80::aa:1623:2a4e:a858","TCP","86","203","0","57157  >  63834 [ACK] Seq=203 Ack=91 Win=131264 Len=0 TSval=805286303 TSecr=3643025759"
"355","63.911152","fe80::aa:1623:2a4e:a858","fe80::4e9:7ecb:78c2:fe8e","TCP","1514","91","1428","63834  >  57157 [ACK] Seq=91 Ack=203 Win=131136 Len=1428 TSval=3643025759 TSecr=805286148 [TCP segment of a reassembled PDU]"
"356","63.911156","fe80::aa:1623:2a4e:a858","fe80::4e9:7ecb:78c2:fe8e","TLSv1.2","96","1519","10","Certificate"
"357","63.911257","fe80::4e9:7ecb:78c2:fe8e","fe80::aa:1623:2a4e:a858","TCP","86","203","0","57157  >  63834 [ACK] Seq=203 Ack=1529 Win=129792 Len=0 TSval=805286320 TSecr=3643025759"
"358","64.035660","fe80::aa:1623:2a4e:a858","fe80::4e9:7ecb:78c2:fe8e","TLSv1.2","216","1529","130","Server Key Exchange, Server Hello Done"
"359","64.035762","fe80::4e9:7ecb:78c2:fe8e","fe80::aa:1623:2a4e:a858","TCP","86","203","0","57157  >  63834 [ACK] Seq=203 Ack=1659 Win=130880 Len=0 TSval=805286444 TSecr=3643025897"
"360","64.063291","fe80::4e9:7ecb:78c2:fe8e","fe80::aa:1623:2a4e:a858","TLSv1.2","128","203","42","Client Key Exchange"
"361","64.141714","fe80::aa:1623:2a4e:a858","fe80::4e9:7ecb:78c2:fe8e","TCP","86","1659","0","63834  >  57157 [ACK] Seq=1659 Ack=245 Win=131072 Len=0 TSval=3643026041 TSecr=805286471"
"362","64.141816","fe80::4e9:7ecb:78c2:fe8e","fe80::aa:1623:2a4e:a858","TLSv1.2","177","245","91","Change Cipher Spec, Encrypted Handshake Message"
"363","64.253304","fe80::aa:1623:2a4e:a858","fe80::4e9:7ecb:78c2:fe8e","TCP","86","1659","0","63834  >  57157 [ACK] Seq=1659 Ack=336 Win=131008 Len=0 TSval=3643026077 TSecr=805286549"
"364","64.255881","fe80::aa:1623:2a4e:a858","fe80::4e9:7ecb:78c2:fe8e","TLSv1.2","92","1659","6","Change Cipher Spec"
"365","64.255937","fe80::4e9:7ecb:78c2:fe8e","fe80::aa:1623:2a4e:a858","TCP","86","336","0","57157  >  63834 [ACK] Seq=336 Ack=1665 Win=131008 Len=0 TSval=805286662 TSecr=3643026078"
"366","64.348225","fe80::aa:1623:2a4e:a858","fe80::4e9:7ecb:78c2:fe8e","TLSv1.2","171","1665","85","Encrypted Handshake Message"
"367","64.348298","fe80::4e9:7ecb:78c2:fe8e","fe80::aa:1623:2a4e:a858","TCP","86","336","0","57157  >  63834 [ACK] Seq=336 Ack=1750 Win=130944 Len=0 TSval=805286754 TSecr=3643026218"
"368","64.421940","fe80::4e9:7ecb:78c2:fe8e","fe80::aa:1623:2a4e:a858","TLSv1.2","187","336","101","Application Data"
"369","64.505246","fe80::aa:1623:2a4e:a858","fe80::4e9:7ecb:78c2:fe8e","TCP","86","1750","0","63834  >  57157 [ACK] Seq=1750 Ack=437 Win=130944 Len=0 TSval=3643026374 TSecr=805286827"
"370","64.520195","fe80::aa:1623:2a4e:a858","fe80::4e9:7ecb:78c2:fe8e","TLSv1.2","155","1750","69","Application Data"
"371","64.520248","fe80::4e9:7ecb:78c2:fe8e","fe80::aa:1623:2a4e:a858","TCP","86","437","0","57157  >  63834 [ACK] Seq=437 Ack=1819 Win=130944 Len=0 TSval=805286924 TSecr=3643026386"
"372","64.677651","fe80::4e9:7ecb:78c2:fe8e","fe80::aa:1623:2a4e:a858","TLSv1.2","171","437","85","Application Data"
"373","64.745057","fe80::aa:1623:2a4e:a858","fe80::4e9:7ecb:78c2:fe8e","TCP","86","1819","0","63834  >  57157 [ACK] Seq=1819 Ack=522 Win=130944 Len=0 TSval=3643026637 TSecr=805287081"
"374","64.764025","fe80::aa:1623:2a4e:a858","fe80::4e9:7ecb:78c2:fe8e","TLSv1.2","187","1819","101","Application Data"
"375","64.764133","fe80::4e9:7ecb:78c2:fe8e","fe80::aa:1623:2a4e:a858","TCP","86","522","0","57157  >  63834 [ACK] Seq=522 Ack=1920 Win=130944 Len=0 TSval=805287166 TSecr=3643026646"
"376","64.777968","fe80::4e9:7ecb:78c2:fe8e","fe80::aa:1623:2a4e:a858","TLSv1.2","171","522","85","Application Data"
"378","64.835347","fe80::aa:1623:2a4e:a858","fe80::4e9:7ecb:78c2:fe8e","TCP","86","1920","0","63834  >  57157 [ACK] Seq=1920 Ack=607 Win=130944 Len=0 TSval=3643026715 TSecr=805287179"
"379","64.843556","fe80::aa:1623:2a4e:a858","fe80::4e9:7ecb:78c2:fe8e","TLSv1.2","251","1920","165","Application Data"
"380","64.843644","fe80::4e9:7ecb:78c2:fe8e","fe80::aa:1623:2a4e:a858","TCP","86","607","0","57157  >  63834 [ACK] Seq=607 Ack=2085 Win=130880 Len=0 TSval=805287244 TSecr=3643026725"
"381","64.974570","fe80::4e9:7ecb:78c2:fe8e","fe80::aa:1623:2a4e:a858","TLSv1.2","171","607","85","Application Data"
"382","65.047254","fe80::aa:1623:2a4e:a858","fe80::4e9:7ecb:78c2:fe8e","TCP","86","2085","0","63834  >  57157 [ACK] Seq=2085 Ack=692 Win=130944 Len=0 TSval=3643026900 TSecr=805287374"
"383","65.049470","fe80::aa:1623:2a4e:a858","fe80::4e9:7ecb:78c2:fe8e","TLSv1.2","171","2085","85","Application Data"
"384","65.049552","fe80::4e9:7ecb:78c2:fe8e","fe80::aa:1623:2a4e:a858","TCP","86","692","0","57157  >  63834 [ACK] Seq=692 Ack=2170 Win=130944 Len=0 TSval=805287448 TSecr=3643026909"
"385","65.417173","fe80::4e9:7ecb:78c2:fe8e","fe80::aa:1623:2a4e:a858","TCP","1514","692","1428","57157  >  63834 [ACK] Seq=692 Ack=2170 Win=131072 Len=1428 TSval=805287815 TSecr=3643026909 [TCP segment of a reassembled PDU]"
"386","65.417174","fe80::4e9:7ecb:78c2:fe8e","fe80::aa:1623:2a4e:a858","TLSv1.2","183","2120","97","Application Data"
"387","65.570485","fe80::aa:1623:2a4e:a858","fe80::4e9:7ecb:78c2:fe8e","TCP","86","2170","0","63834  >  57157 [ACK] Seq=2170 Ack=2120 Win=129600 Len=0 TSval=3643027464 TSecr=805287815"
"388","65.572272","fe80::aa:1623:2a4e:a858","fe80::4e9:7ecb:78c2:fe8e","TCP","86","2170","0","63834  >  57157 [ACK] Seq=2170 Ack=2217 Win=130944 Len=0 TSval=3643027476 TSecr=805287815"
"389","65.604077","fe80::aa:1623:2a4e:a858","fe80::4e9:7ecb:78c2:fe8e","TLSv1.2","187","2170","101","Application Data"
"390","65.604131","fe80::4e9:7ecb:78c2:fe8e","fe80::aa:1623:2a4e:a858","TCP","86","2217","0","57157  >  63834 [ACK] Seq=2217 Ack=2271 Win=130944 Len=0 TSval=805288000 TSecr=3643027511"
"391","65.754703","fe80::4e9:7ecb:78c2:fe8e","fe80::aa:1623:2a4e:a858","TLSv1.2","459","2217","373","Application Data"
"392","65.796696","fe80::aa:1623:2a4e:a858","fe80::4e9:7ecb:78c2:fe8e","TCP","86","2271","0","63834  >  57157 [ACK] Seq=2271 Ack=2590 Win=130688 Len=0 TSval=3643027699 TSecr=805288150"
"393","65.848974","fe80::aa:1623:2a4e:a858","fe80::4e9:7ecb:78c2:fe8e","TLSv1.2","171","2271","85","Application Data"
"394","65.849048","fe80::4e9:7ecb:78c2:fe8e","fe80::aa:1623:2a4e:a858","TCP","86","2590","0","57157  >  63834 [ACK] Seq=2590 Ack=2356 Win=130944 Len=0 TSval=805288244 TSecr=3643027720"
"395","65.861766","fe80::4e9:7ecb:78c2:fe8e","fe80::aa:1623:2a4e:a858","TLSv1.2","187","2590","101","Application Data"
"396","66.013781","fe80::aa:1623:2a4e:a858","fe80::4e9:7ecb:78c2:fe8e","TCP","86","2356","0","63834  >  57157 [ACK] Seq=2356 Ack=2691 Win=130944 Len=0 TSval=3643027843 TSecr=805288256"
"397","66.360025","fe80::aa:1623:2a4e:a858","fe80::4e9:7ecb:78c2:fe8e","TLSv1.2","491","2356","405","Application Data"
"398","66.360106","fe80::4e9:7ecb:78c2:fe8e","fe80::aa:1623:2a4e:a858","TCP","86","2691","0","57157  >  63834 [ACK] Seq=2691 Ack=2761 Win=130624 Len=0 TSval=805288753 TSecr=3643028088"
"399","66.483901","fe80::4e9:7ecb:78c2:fe8e","fe80::aa:1623:2a4e:a858","TLSv1.2","171","2691","85","Application Data"
"400","66.567641","fe80::aa:1623:2a4e:a858","fe80::4e9:7ecb:78c2:fe8e","TCP","86","2761","0","63834  >  57157 [ACK] Seq=2761 Ack=2776 Win=130944 Len=0 TSval=3643028462 TSecr=805288876"
"401","66.573939","fe80::aa:1623:2a4e:a858","fe80::4e9:7ecb:78c2:fe8e","TLSv1.2","171","2761","85","Application Data"
"402","66.573988","fe80::4e9:7ecb:78c2:fe8e","fe80::aa:1623:2a4e:a858","TCP","86","2776","0","57157  >  63834 [ACK] Seq=2776 Ack=2846 Win=130944 Len=0 TSval=805288965 TSecr=3643028469"
"403","66.581541","fe80::4e9:7ecb:78c2:fe8e","fe80::aa:1623:2a4e:a858","TLSv1.2","171","2776","85","Application Data"
"404","66.699490","fe80::aa:1623:2a4e:a858","fe80::4e9:7ecb:78c2:fe8e","TCP","86","2846","0","63834  >  57157 [ACK] Seq=2846 Ack=2861 Win=130944 Len=0 TSval=3643028545 TSecr=805288972"
"405","66.713593","fe80::aa:1623:2a4e:a858","fe80::4e9:7ecb:78c2:fe8e","TLSv1.2","203","2846","117","Application Data"
"406","66.713650","fe80::4e9:7ecb:78c2:fe8e","fe80::aa:1623:2a4e:a858","TCP","86","2861","0","57157  >  63834 [ACK] Seq=2861 Ack=2963 Win=130944 Len=0 TSval=805289104 TSecr=3643028551"
"412","68.724283","fe80::4e9:7ecb:78c2:fe8e","fe80::aa:1623:2a4e:a858","TLSv1.2","171","2861","85","Application Data"
"413","68.779429","fe80::aa:1623:2a4e:a858","fe80::4e9:7ecb:78c2:fe8e","TCP","86","2963","0","63834  >  57157 [ACK] Seq=2963 Ack=2946 Win=130944 Len=0 TSval=3643030674 TSecr=805291113"
"415","68.815010","fe80::aa:1623:2a4e:a858","fe80::4e9:7ecb:78c2:fe8e","TLSv1.2","203","2963","117","Application Data"
"416","68.815067","fe80::4e9:7ecb:78c2:fe8e","fe80::aa:1623:2a4e:a858","TCP","86","2946","0","57157  >  63834 [ACK] Seq=2946 Ack=3080 Win=130944 Len=0 TSval=805291203 TSecr=3643030682"
"423","70.828865","fe80::4e9:7ecb:78c2:fe8e","fe80::aa:1623:2a4e:a858","TLSv1.2","171","2946","85","Application Data"
"425","70.998782","fe80::aa:1623:2a4e:a858","fe80::4e9:7ecb:78c2:fe8e","TCP","86","3080","0","63834  >  57157 [ACK] Seq=3080 Ack=3031 Win=130944 Len=0 TSval=3643032886 TSecr=805293216"
"426","71.055369","fe80::aa:1623:2a4e:a858","fe80::4e9:7ecb:78c2:fe8e","TLSv1.2","203","3080","117","Application Data"
"427","71.055422","fe80::4e9:7ecb:78c2:fe8e","fe80::aa:1623:2a4e:a858","TCP","86","3031","0","57157  >  63834 [ACK] Seq=3031 Ack=3197 Win=130944 Len=0 TSval=805293441 TSecr=3643032895"
"429","73.069171","fe80::4e9:7ecb:78c2:fe8e","fe80::aa:1623:2a4e:a858","TLSv1.2","171","3031","85","Application Data"
"431","73.187538","fe80::aa:1623:2a4e:a858","fe80::4e9:7ecb:78c2:fe8e","TCP","86","3197","0","63834  >  57157 [ACK] Seq=3197 Ack=3116 Win=130944 Len=0 TSval=3643035060 TSecr=805295453"
"432","73.270896","fe80::aa:1623:2a4e:a858","fe80::4e9:7ecb:78c2:fe8e","TLSv1.2","203","3197","117","Application Data"
"433","73.270978","fe80::4e9:7ecb:78c2:fe8e","fe80::aa:1623:2a4e:a858","TCP","86","3116","0","57157  >  63834 [ACK] Seq=3116 Ack=3314 Win=130944 Len=0 TSval=805295654 TSecr=3643035068"
"435","75.280217","fe80::4e9:7ecb:78c2:fe8e","fe80::aa:1623:2a4e:a858","TLSv1.2","171","3116","85","Application Data"
"436","75.401216","fe80::aa:1623:2a4e:a858","fe80::4e9:7ecb:78c2:fe8e","TCP","86","3314","0","63834  >  57157 [ACK] Seq=3314 Ack=3201 Win=130944 Len=0 TSval=3643037295 TSecr=805297662"
"437","75.494531","fe80::aa:1623:2a4e:a858","fe80::4e9:7ecb:78c2:fe8e","TLSv1.2","203","3314","117","Application Data"
"438","75.494603","fe80::4e9:7ecb:78c2:fe8e","fe80::aa:1623:2a4e:a858","TCP","86","3201","0","57157  >  63834 [ACK] Seq=3201 Ack=3431 Win=130944 Len=0 TSval=805297876 TSecr=3643037303"
"439","77.503253","fe80::4e9:7ecb:78c2:fe8e","fe80::aa:1623:2a4e:a858","TLSv1.2","171","3201","85","Application Data"
"440","77.668130","fe80::aa:1623:2a4e:a858","fe80::4e9:7ecb:78c2:fe8e","TCP","86","3431","0","63834  >  57157 [ACK] Seq=3431 Ack=3286 Win=130944 Len=0 TSval=3643039536 TSecr=805299883"
"441","77.709058","fe80::aa:1623:2a4e:a858","fe80::4e9:7ecb:78c2:fe8e","TLSv1.2","203","3431","117","Application Data"
"442","77.709142","fe80::4e9:7ecb:78c2:fe8e","fe80::aa:1623:2a4e:a858","TCP","86","3286","0","57157  >  63834 [ACK] Seq=3286 Ack=3548 Win=130944 Len=0 TSval=805300087 TSecr=3643039544"
"444","79.721079","fe80::4e9:7ecb:78c2:fe8e","fe80::aa:1623:2a4e:a858","TLSv1.2","171","3286","85","Application Data"
"445","79.892460","fe80::aa:1623:2a4e:a858","fe80::4e9:7ecb:78c2:fe8e","TCP","86","3548","0","63834  >  57157 [ACK] Seq=3548 Ack=3371 Win=130944 Len=0 TSval=3643041699 TSecr=805302098"
"446","79.892463","fe80::aa:1623:2a4e:a858","fe80::4e9:7ecb:78c2:fe8e","TLSv1.2","203","3548","117","Application Data"
"447","79.892561","fe80::4e9:7ecb:78c2:fe8e","fe80::aa:1623:2a4e:a858","TCP","86","3371","0","57157  >  63834 [ACK] Seq=3371 Ack=3665 Win=130944 Len=0 TSval=805302269 TSecr=3643041708"
"456","81.903933","fe80::4e9:7ecb:78c2:fe8e","fe80::aa:1623:2a4e:a858","TLSv1.2","171","3371","85","Application Data"
"457","82.072924","fe80::aa:1623:2a4e:a858","fe80::4e9:7ecb:78c2:fe8e","TCP","86","3665","0","63834  >  57157 [ACK] Seq=3665 Ack=3456 Win=130944 Len=0 TSval=3643043968 TSecr=805304278"
"458","82.089299","fe80::aa:1623:2a4e:a858","fe80::4e9:7ecb:78c2:fe8e","TLSv1.2","203","3665","117","Application Data"
"459","82.089353","fe80::4e9:7ecb:78c2:fe8e","fe80::aa:1623:2a4e:a858","TCP","86","3456","0","57157  >  63834 [ACK] Seq=3456 Ack=3782 Win=130944 Len=0 TSval=805304463 TSecr=3643043976"
"465","84.102632","fe80::4e9:7ecb:78c2:fe8e","fe80::aa:1623:2a4e:a858","TLSv1.2","171","3456","85","Application Data"
"466","84.300509","fe80::aa:1623:2a4e:a858","fe80::4e9:7ecb:78c2:fe8e","TCP","86","3782","0","63834  >  57157 [ACK] Seq=3782 Ack=3541 Win=130944 Len=0 TSval=3643046100 TSecr=805306475"
"467","84.315324","fe80::aa:1623:2a4e:a858","fe80::4e9:7ecb:78c2:fe8e","TLSv1.2","203","3782","117","Application Data"
"468","84.315396","fe80::4e9:7ecb:78c2:fe8e","fe80::aa:1623:2a4e:a858","TCP","86","3541","0","57157  >  63834 [ACK] Seq=3541 Ack=3899 Win=130944 Len=0 TSval=805306686 TSecr=3643046109"
"485","86.328715","fe80::4e9:7ecb:78c2:fe8e","fe80::aa:1623:2a4e:a858","TLSv1.2","171","3541","85","Application Data"
"486","86.414485","fe80::aa:1623:2a4e:a858","fe80::4e9:7ecb:78c2:fe8e","TCP","86","3899","0","63834  >  57157 [ACK] Seq=3899 Ack=3626 Win=130944 Len=0 TSval=3643048294 TSecr=805308697"
"487","86.425182","fe80::aa:1623:2a4e:a858","fe80::4e9:7ecb:78c2:fe8e","TLSv1.2","203","3899","117","Application Data"
"488","86.425238","fe80::4e9:7ecb:78c2:fe8e","fe80::aa:1623:2a4e:a858","TCP","86","3626","0","57157  >  63834 [ACK] Seq=3626 Ack=4016 Win=130944 Len=0 TSval=805308792 TSecr=3643048302"
"497","88.437454","fe80::4e9:7ecb:78c2:fe8e","fe80::aa:1623:2a4e:a858","TLSv1.2","171","3626","85","Application Data"
"498","88.513179","fe80::aa:1623:2a4e:a858","fe80::4e9:7ecb:78c2:fe8e","TCP","86","4016","0","63834  >  57157 [ACK] Seq=4016 Ack=3711 Win=130944 Len=0 TSval=3643050394 TSecr=805310802"
"499","88.553483","fe80::aa:1623:2a4e:a858","fe80::4e9:7ecb:78c2:fe8e","TLSv1.2","203","4016","117","Application Data"
"500","88.553549","fe80::4e9:7ecb:78c2:fe8e","fe80::aa:1623:2a4e:a858","TCP","86","3711","0","57157  >  63834 [ACK] Seq=3711 Ack=4133 Win=130944 Len=0 TSval=805310917 TSecr=3643050403"
"501","88.561688","fe80::4e9:7ecb:78c2:fe8e","fe80::aa:1623:2a4e:a858","TLSv1.2","171","3711","85","Application Data"
"502","88.620734","fe80::aa:1623:2a4e:a858","fe80::4e9:7ecb:78c2:fe8e","TCP","86","4133","0","63834  >  57157 [ACK] Seq=4133 Ack=3796 Win=130944 Len=0 TSval=3643050494 TSecr=805310925"
"503","88.629044","fe80::aa:1623:2a4e:a858","fe80::4e9:7ecb:78c2:fe8e","TLSv1.2","171","4133","85","Application Data"
"504","88.629105","fe80::4e9:7ecb:78c2:fe8e","fe80::aa:1623:2a4e:a858","TCP","86","3796","0","57157  >  63834 [ACK] Seq=3796 Ack=4218 Win=130944 Len=0 TSval=805310992 TSecr=3643050498"
"505","88.635864","fe80::4e9:7ecb:78c2:fe8e","fe80::aa:1623:2a4e:a858","TLSv1.2","171","3796","85","Application Data"
"506","88.680218","fe80::aa:1623:2a4e:a858","fe80::4e9:7ecb:78c2:fe8e","TCP","86","4218","0","63834  >  57157 [ACK] Seq=4218 Ack=3881 Win=130944 Len=0 TSval=3643050585 TSecr=805310998"
"507","88.680551","fe80::aa:1623:2a4e:a858","fe80::4e9:7ecb:78c2:fe8e","TLSv1.2","171","4218","85","Application Data"
"508","88.680649","fe80::4e9:7ecb:78c2:fe8e","fe80::aa:1623:2a4e:a858","TCP","86","3881","0","57157  >  63834 [ACK] Seq=3881 Ack=4303 Win=130944 Len=0 TSval=805311042 TSecr=3643050588"
"509","88.698383","fe80::4e9:7ecb:78c2:fe8e","fe80::aa:1623:2a4e:a858","TLSv1.2","155","3881","69","Encrypted Alert"
"510","88.699821","fe80::4e9:7ecb:78c2:fe8e","fe80::aa:1623:2a4e:a858","TCP","86","3950","0","57157  >  63834 [FIN, ACK] Seq=3950 Ack=4303 Win=131072 Len=0 TSval=805311060 TSecr=3643050588"
"511","88.765232","fe80::aa:1623:2a4e:a858","fe80::4e9:7ecb:78c2:fe8e","TCP","86","4303","0","63834  >  57157 [ACK] Seq=4303 Ack=3950 Win=130944 Len=0 TSval=3643050653 TSecr=805311059"
"512","88.790945","fe80::aa:1623:2a4e:a858","fe80::4e9:7ecb:78c2:fe8e","TCP","86","4303","0","63834  >  57157 [ACK] Seq=4303 Ack=3951 Win=130944 Len=0 TSval=3643050672 TSecr=805311060"
"520","94.324371","fe80::aa:1623:2a4e:a858","fe80::4e9:7ecb:78c2:fe8e","TLSv1.2","155","4303","69","Encrypted Alert"
"521","94.324374","fe80::aa:1623:2a4e:a858","fe80::4e9:7ecb:78c2:fe8e","TCP","86","4372","0","63834  >  57157 [FIN, ACK] Seq=4372 Ack=3951 Win=130944 Len=0 TSval=3643055590 TSecr=805311060"
