"No.","Time","Source","Destination","Protocol","Length","Sequence Number","TCP Segment Len","Info"
"59","18.618562","fe80::4e9:7ecb:78c2:fe8e","ff02::1","UDP","72","","","59119  >  15118 Len=10"
"63","18.873384","fe80::4e9:7ecb:78c2:fe8e","ff02::1","UDP","72","","","59119  >  15118 Len=10"
"67","19.126336","fe80::4e9:7ecb:78c2:fe8e","ff02::1","UDP","72","","","59119  >  15118 Len=10"
"69","19.381631","fe80::4e9:7ecb:78c2:fe8e","ff02::1","UDP","72","","","59119  >  15118 Len=10"
"70","19.638329","fe80::4e9:7ecb:78c2:fe8e","ff02::1","UDP","72","","","59119  >  15118 Len=10"
"74","19.664017","fe80::aa:1623:2a4e:a858","fe80::4e9:7ecb:78c2:fe8e","UDP","90","","","15118  >  59119 Len=28"
"75","19.686794","fe80::aa:1623:2a4e:a858","fe80::4e9:7ecb:78c2:fe8e","UDP","90","","","15118  >  59119 Len=28"
"79","20.886392","fe80::4e9:7ecb:78c2:fe8e","fe80::aa:1623:2a4e:a858","TCP","98","0","0","57071  >  60645 [SYN, ECN, CWR] Seq=0 Win=65535 Len=0 MSS=1440 WS=64 TSval=803560258 TSecr=0 SACK_PERM=1"
"80","20.921711","fe80::aa:1623:2a4e:a858","fe80::4e9:7ecb:78c2:fe8e","TCP","98","0","0","60645  >  57071 [SYN, ACK, ECN] Seq=0 Ack=1 Win=65535 Len=0 MSS=1440 WS=64 TSval=1394092122 TSecr=803560258 SACK_PERM=1"
"81","20.921823","fe80::4e9:7ecb:78c2:fe8e","fe80::aa:1623:2a4e:a858","TCP","86","1","0","57071  >  60645 [ACK] Seq=1 Ack=1 Win=131328 Len=0 TSval=803560293 TSecr=1394092122"
"82","20.958696","fe80::aa:1623:2a4e:a858","fe80::4e9:7ecb:78c2:fe8e","TCP","86","1","0","[TCP Window Update] 60645  >  57071 [ACK] Seq=1 Ack=1 Win=131328 Len=0 TSval=1394092184 TSecr=803560293"
"83","21.002668","fe80::4e9:7ecb:78c2:fe8e","fe80::aa:1623:2a4e:a858","TLSv1.2","288","1","202","Client Hello"
"84","21.132373","fe80::aa:1623:2a4e:a858","fe80::4e9:7ecb:78c2:fe8e","TCP","86","1","0","60645  >  57071 [ACK] Seq=1 Ack=203 Win=131136 Len=0 TSval=1394092339 TSecr=803560372"
"85","21.165398","fe80::aa:1623:2a4e:a858","fe80::4e9:7ecb:78c2:fe8e","TLSv1.2","176","1","90","Server Hello"
"86","21.165525","fe80::4e9:7ecb:78c2:fe8e","fe80::aa:1623:2a4e:a858","TCP","86","203","0","57071  >  60645 [ACK] Seq=203 Ack=91 Win=131264 Len=0 TSval=803560533 TSecr=1394092384"
"87","21.166953","fe80::aa:1623:2a4e:a858","fe80::4e9:7ecb:78c2:fe8e","TCP","1514","91","1428","60645  >  57071 [ACK] Seq=91 Ack=203 Win=131136 Len=1428 TSval=1394092384 TSecr=803560372 [TCP segment of a reassembled PDU]"
"88","21.166959","fe80::aa:1623:2a4e:a858","fe80::4e9:7ecb:78c2:fe8e","TLSv1.2","96","1519","10","Certificate"
"89","21.167065","fe80::4e9:7ecb:78c2:fe8e","fe80::aa:1623:2a4e:a858","TCP","86","203","0","57071  >  60645 [ACK] Seq=203 Ack=1529 Win=129792 Len=0 TSval=803560534 TSecr=1394092384"
"90","21.171935","fe80::aa:1623:2a4e:a858","fe80::4e9:7ecb:78c2:fe8e","TLSv1.2","207","1529","121","Server Key Exchange"
"91","21.172081","fe80::4e9:7ecb:78c2:fe8e","fe80::aa:1623:2a4e:a858","TCP","86","203","0","57071  >  60645 [ACK] Seq=203 Ack=1650 Win=129664 Len=0 TSval=803560538 TSecr=1394092398"
"92","21.181870","fe80::aa:1623:2a4e:a858","fe80::4e9:7ecb:78c2:fe8e","TLSv1.2","95","1650","9","Server Hello Done"
"93","21.181977","fe80::4e9:7ecb:78c2:fe8e","fe80::aa:1623:2a4e:a858","TCP","86","203","0","57071  >  60645 [ACK] Seq=203 Ack=1659 Win=130880 Len=0 TSval=803560546 TSecr=1394092405"
"95","21.261078","fe80::4e9:7ecb:78c2:fe8e","fe80::aa:1623:2a4e:a858","TLSv1.2","128","203","42","Client Key Exchange"
"96","21.301434","fe80::aa:1623:2a4e:a858","fe80::4e9:7ecb:78c2:fe8e","TCP","86","1659","0","60645  >  57071 [ACK] Seq=1659 Ack=245 Win=131072 Len=0 TSval=1394092509 TSecr=803560623"
"97","21.301533","fe80::4e9:7ecb:78c2:fe8e","fe80::aa:1623:2a4e:a858","TLSv1.2","177","245","91","Change Cipher Spec, Encrypted Handshake Message"
"98","21.352293","fe80::aa:1623:2a4e:a858","fe80::4e9:7ecb:78c2:fe8e","TCP","86","1659","0","60645  >  57071 [ACK] Seq=1659 Ack=336 Win=131008 Len=0 TSval=1394092561 TSecr=803560662"
"99","21.352765","fe80::aa:1623:2a4e:a858","fe80::4e9:7ecb:78c2:fe8e","TLSv1.2","92","1659","6","Change Cipher Spec"
"100","21.352837","fe80::4e9:7ecb:78c2:fe8e","fe80::aa:1623:2a4e:a858","TCP","86","336","0","57071  >  60645 [ACK] Seq=336 Ack=1665 Win=131008 Len=0 TSval=803560712 TSecr=1394092565"
"101","21.357241","fe80::aa:1623:2a4e:a858","fe80::4e9:7ecb:78c2:fe8e","TLSv1.2","171","1665","85","Encrypted Handshake Message"
"102","21.357336","fe80::4e9:7ecb:78c2:fe8e","fe80::aa:1623:2a4e:a858","TCP","86","336","0","57071  >  60645 [ACK] Seq=336 Ack=1750 Win=130944 Len=0 TSval=803560716 TSecr=1394092582"
"103","21.437598","fe80::4e9:7ecb:78c2:fe8e","fe80::aa:1623:2a4e:a858","TLSv1.2","187","336","101","Application Data"
"104","21.459665","fe80::aa:1623:2a4e:a858","fe80::4e9:7ecb:78c2:fe8e","TCP","86","1750","0","60645  >  57071 [ACK] Seq=1750 Ack=437 Win=130944 Len=0 TSval=1394092684 TSecr=803560796"
"105","21.822740","fe80::aa:1623:2a4e:a858","fe80::4e9:7ecb:78c2:fe8e","TLSv1.2","155","1750","69","Application Data"
"106","21.822851","fe80::4e9:7ecb:78c2:fe8e","fe80::aa:1623:2a4e:a858","TCP","86","437","0","57071  >  60645 [ACK] Seq=437 Ack=1819 Win=130944 Len=0 TSval=803561180 TSecr=1394092785"
"107","21.845711","fe80::aa:1623:2a4e:a858","fe80::4e9:7ecb:78c2:fe8e","TCP","155","1750","69","[TCP Spurious Retransmission] 60645  >  57071 [PSH, ACK] Seq=1750 Ack=437 Win=131072 Len=69 TSval=1394092920 TSecr=803560796"
"108","21.845813","fe80::4e9:7ecb:78c2:fe8e","fe80::aa:1623:2a4e:a858","TCP","98","437","0","[TCP Window Update] 57071  >  60645 [ACK] Seq=437 Ack=1819 Win=131072 Len=0 TSval=803561202 TSecr=1394092920 SLE=1750 SRE=1819"
"109","22.006580","fe80::4e9:7ecb:78c2:fe8e","fe80::aa:1623:2a4e:a858","TLSv1.2","171","437","85","Application Data"
"110","22.213244","fe80::4e9:7ecb:78c2:fe8e","fe80::aa:1623:2a4e:a858","TCP","171","437","85","[TCP Retransmission] 57071  >  60645 [PSH, ACK] Seq=437 Ack=1819 Win=131072 Len=85 TSval=803561568 TSecr=1394092920"
"111","22.231213","fe80::aa:1623:2a4e:a858","fe80::4e9:7ecb:78c2:fe8e","TCP","86","1819","0","60645  >  57071 [ACK] Seq=1819 Ack=522 Win=130944 Len=0 TSval=1394093262 TSecr=803561362"
"112","22.246135","fe80::aa:1623:2a4e:a858","fe80::4e9:7ecb:78c2:fe8e","TLSv1.2","187","1819","101","Application Data"
"113","22.246240","fe80::4e9:7ecb:78c2:fe8e","fe80::aa:1623:2a4e:a858","TCP","86","522","0","57071  >  60645 [ACK] Seq=522 Ack=1920 Win=130944 Len=0 TSval=803561600 TSecr=1394093276"
"114","22.260624","fe80::4e9:7ecb:78c2:fe8e","fe80::aa:1623:2a4e:a858","TLSv1.2","171","522","85","Application Data"
"115","22.266532","fe80::aa:1623:2a4e:a858","fe80::4e9:7ecb:78c2:fe8e","TCP","98","1920","0","[TCP Dup ACK 111#1] 60645  >  57071 [ACK] Seq=1920 Ack=522 Win=131072 Len=0 TSval=1394093480 TSecr=803561568 SLE=437 SRE=522"
"116","22.392017","fe80::aa:1623:2a4e:a858","fe80::4e9:7ecb:78c2:fe8e","TCP","86","1920","0","60645  >  57071 [ACK] Seq=1920 Ack=607 Win=130944 Len=0 TSval=1394093584 TSecr=803561614"
"117","22.414663","fe80::aa:1623:2a4e:a858","fe80::4e9:7ecb:78c2:fe8e","TLSv1.2","251","1920","165","Application Data"
"118","22.414767","fe80::4e9:7ecb:78c2:fe8e","fe80::aa:1623:2a4e:a858","TCP","86","607","0","57071  >  60645 [ACK] Seq=607 Ack=2085 Win=130880 Len=0 TSval=803561767 TSecr=1394093600"
"119","22.587689","fe80::4e9:7ecb:78c2:fe8e","fe80::aa:1623:2a4e:a858","TLSv1.2","171","607","85","Application Data"
"122","23.040050","fe80::aa:1623:2a4e:a858","fe80::4e9:7ecb:78c2:fe8e","TCP","86","2085","0","60645  >  57071 [ACK] Seq=2085 Ack=692 Win=130944 Len=0 TSval=1394094016 TSecr=803561938"
"123","23.041215","fe80::aa:1623:2a4e:a858","fe80::4e9:7ecb:78c2:fe8e","TLSv1.2","171","2085","85","Application Data"
"124","23.041306","fe80::4e9:7ecb:78c2:fe8e","fe80::aa:1623:2a4e:a858","TCP","86","692","0","57071  >  60645 [ACK] Seq=692 Ack=2170 Win=130944 Len=0 TSval=803562391 TSecr=1394094028"
"125","23.378741","fe80::4e9:7ecb:78c2:fe8e","fe80::aa:1623:2a4e:a858","TCP","1514","692","1428","57071  >  60645 [ACK] Seq=692 Ack=2170 Win=131072 Len=1428 TSval=803562727 TSecr=1394094028 [TCP segment of a reassembled PDU]"
"126","23.378742","fe80::4e9:7ecb:78c2:fe8e","fe80::aa:1623:2a4e:a858","TLSv1.2","183","2120","97","Application Data"
"127","23.383944","fe80::aa:1623:2a4e:a858","fe80::4e9:7ecb:78c2:fe8e","TCP","86","2170","0","60645  >  57071 [ACK] Seq=2170 Ack=2120 Win=129600 Len=0 TSval=1394094610 TSecr=803562727"
"128","23.386484","fe80::aa:1623:2a4e:a858","fe80::4e9:7ecb:78c2:fe8e","TCP","86","2170","0","60645  >  57071 [ACK] Seq=2170 Ack=2217 Win=130944 Len=0 TSval=1394094612 TSecr=803562727"
"129","23.475651","fe80::aa:1623:2a4e:a858","fe80::4e9:7ecb:78c2:fe8e","TLSv1.2","187","2170","101","Application Data"
"130","23.475761","fe80::4e9:7ecb:78c2:fe8e","fe80::aa:1623:2a4e:a858","TCP","86","2217","0","57071  >  60645 [ACK] Seq=2217 Ack=2271 Win=130944 Len=0 TSval=803562822 TSecr=1394094680"
"131","23.628280","fe80::4e9:7ecb:78c2:fe8e","fe80::aa:1623:2a4e:a858","TLSv1.2","459","2217","373","Application Data"
"132","23.960452","fe80::aa:1623:2a4e:a858","fe80::4e9:7ecb:78c2:fe8e","TCP","86","2271","0","60645  >  57071 [ACK] Seq=2271 Ack=2590 Win=130688 Len=0 TSval=1394095087 TSecr=803562974"
"133","23.960731","fe80::aa:1623:2a4e:a858","fe80::4e9:7ecb:78c2:fe8e","TLSv1.2","171","2271","85","Application Data"
"134","23.960822","fe80::4e9:7ecb:78c2:fe8e","fe80::aa:1623:2a4e:a858","TCP","86","2590","0","57071  >  60645 [ACK] Seq=2590 Ack=2356 Win=130944 Len=0 TSval=803563305 TSecr=1394095106"
"135","23.983429","fe80::4e9:7ecb:78c2:fe8e","fe80::aa:1623:2a4e:a858","TLSv1.2","187","2590","101","Application Data"
"136","23.991199","fe80::aa:1623:2a4e:a858","fe80::4e9:7ecb:78c2:fe8e","TCP","86","2356","0","60645  >  57071 [ACK] Seq=2356 Ack=2691 Win=130944 Len=0 TSval=1394095214 TSecr=803563327"
"137","24.033810","fe80::aa:1623:2a4e:a858","fe80::4e9:7ecb:78c2:fe8e","TLSv1.2","491","2356","405","Application Data"
"138","24.033917","fe80::4e9:7ecb:78c2:fe8e","fe80::aa:1623:2a4e:a858","TCP","86","2691","0","57071  >  60645 [ACK] Seq=2691 Ack=2761 Win=130624 Len=0 TSval=803563376 TSecr=1394095235"
"139","24.147535","fe80::4e9:7ecb:78c2:fe8e","fe80::aa:1623:2a4e:a858","TLSv1.2","171","2691","85","Application Data"
"143","25.695440","fe80::4e9:7ecb:78c2:fe8e","fe80::aa:1623:2a4e:a858","TCP","171","2691","85","[TCP Retransmission] 57071  >  60645 [PSH, ACK] Seq=2691 Ack=2761 Win=131072 Len=85 TSval=803565036 TSecr=1394095235"
"146","26.034668","fe80::aa:1623:2a4e:a858","fe80::4e9:7ecb:78c2:fe8e","TCP","86","2761","0","60645  >  57071 [ACK] Seq=2761 Ack=2776 Win=130944 Len=0 TSval=1394097182 TSecr=803565036"
"147","26.118351","fe80::aa:1623:2a4e:a858","fe80::4e9:7ecb:78c2:fe8e","TLSv1.2","171","2761","85","Application Data"
"148","26.118461","fe80::4e9:7ecb:78c2:fe8e","fe80::aa:1623:2a4e:a858","TCP","86","2776","0","57071  >  60645 [ACK] Seq=2776 Ack=2846 Win=130944 Len=0 TSval=803565457 TSecr=1394097197"
"149","26.129353","fe80::4e9:7ecb:78c2:fe8e","fe80::aa:1623:2a4e:a858","TLSv1.2","171","2776","85","Application Data"
"150","26.244106","fe80::aa:1623:2a4e:a858","fe80::4e9:7ecb:78c2:fe8e","TCP","86","2846","0","60645  >  57071 [ACK] Seq=2846 Ack=2861 Win=130944 Len=0 TSval=1394097417 TSecr=803565467"
"151","26.252475","fe80::aa:1623:2a4e:a858","fe80::4e9:7ecb:78c2:fe8e","TLSv1.2","203","2846","117","Application Data"
"152","26.252565","fe80::4e9:7ecb:78c2:fe8e","fe80::aa:1623:2a4e:a858","TCP","86","2861","0","57071  >  60645 [ACK] Seq=2861 Ack=2963 Win=130944 Len=0 TSval=803565589 TSecr=1394097425"
"153","26.740875","fe80::aa:1623:2a4e:a858","fe80::4e9:7ecb:78c2:fe8e","TCP","203","2846","117","[TCP Spurious Retransmission] 60645  >  57071 [PSH, ACK] Seq=2846 Ack=2861 Win=131072 Len=117 TSval=1394097730 TSecr=803565467"
"154","26.740968","fe80::4e9:7ecb:78c2:fe8e","fe80::aa:1623:2a4e:a858","TCP","98","2861","0","[TCP Window Update] 57071  >  60645 [ACK] Seq=2861 Ack=2963 Win=131072 Len=0 TSval=803566077 TSecr=1394097730 SLE=2846 SRE=2963"
"155","28.281544","fe80::4e9:7ecb:78c2:fe8e","fe80::aa:1623:2a4e:a858","TLSv1.2","171","2861","85","Application Data"
"156","28.287062","fe80::aa:1623:2a4e:a858","fe80::4e9:7ecb:78c2:fe8e","TCP","86","2963","0","60645  >  57071 [ACK] Seq=2963 Ack=2946 Win=130944 Len=0 TSval=1394099512 TSecr=803567616"
"157","28.354484","fe80::aa:1623:2a4e:a858","fe80::4e9:7ecb:78c2:fe8e","TLSv1.2","203","2963","117","Application Data"
"158","28.354601","fe80::4e9:7ecb:78c2:fe8e","fe80::aa:1623:2a4e:a858","TCP","86","2946","0","57071  >  60645 [ACK] Seq=2946 Ack=3080 Win=130944 Len=0 TSval=803567688 TSecr=1394099522"
"160","30.372680","fe80::4e9:7ecb:78c2:fe8e","fe80::aa:1623:2a4e:a858","TLSv1.2","171","2946","85","Application Data"
"161","30.483387","fe80::aa:1623:2a4e:a858","fe80::4e9:7ecb:78c2:fe8e","TCP","86","3080","0","60645  >  57071 [ACK] Seq=3080 Ack=3031 Win=130944 Len=0 TSval=1394101709 TSecr=803569706"
"162","30.582688","fe80::aa:1623:2a4e:a858","fe80::4e9:7ecb:78c2:fe8e","TLSv1.2","203","3080","117","Application Data"
"163","30.582794","fe80::4e9:7ecb:78c2:fe8e","fe80::aa:1623:2a4e:a858","TCP","86","3031","0","57071  >  60645 [ACK] Seq=3031 Ack=3197 Win=130944 Len=0 TSval=803569915 TSecr=1394101720"
"165","32.601571","fe80::4e9:7ecb:78c2:fe8e","fe80::aa:1623:2a4e:a858","TLSv1.2","171","3031","85","Application Data"
"166","32.720466","fe80::aa:1623:2a4e:a858","fe80::4e9:7ecb:78c2:fe8e","TCP","86","3197","0","60645  >  57071 [ACK] Seq=3197 Ack=3116 Win=130944 Len=0 TSval=1394103932 TSecr=803571932"
"167","32.730955","fe80::aa:1623:2a4e:a858","fe80::4e9:7ecb:78c2:fe8e","TLSv1.2","203","3197","117","Application Data"
"168","32.731045","fe80::4e9:7ecb:78c2:fe8e","fe80::aa:1623:2a4e:a858","TCP","86","3116","0","57071  >  60645 [ACK] Seq=3116 Ack=3314 Win=130944 Len=0 TSval=803572060 TSecr=1394103953"
"172","34.743401","fe80::4e9:7ecb:78c2:fe8e","fe80::aa:1623:2a4e:a858","TLSv1.2","171","3116","85","Application Data"
"173","34.753511","fe80::aa:1623:2a4e:a858","fe80::4e9:7ecb:78c2:fe8e","TCP","86","3314","0","60645  >  57071 [ACK] Seq=3314 Ack=3201 Win=130944 Len=0 TSval=1394105977 TSecr=803574071"
"174","34.761354","fe80::aa:1623:2a4e:a858","fe80::4e9:7ecb:78c2:fe8e","TLSv1.2","203","3314","117","Application Data"
"175","34.761441","fe80::4e9:7ecb:78c2:fe8e","fe80::aa:1623:2a4e:a858","TCP","86","3201","0","57071  >  60645 [ACK] Seq=3201 Ack=3431 Win=130944 Len=0 TSval=803574089 TSecr=1394105987"
"179","36.774136","fe80::4e9:7ecb:78c2:fe8e","fe80::aa:1623:2a4e:a858","TLSv1.2","171","3201","85","Application Data"
"182","37.909259","fe80::4e9:7ecb:78c2:fe8e","fe80::aa:1623:2a4e:a858","TCP","171","3201","85","[TCP Retransmission] 57071  >  60645 [PSH, ACK] Seq=3201 Ack=3431 Win=131072 Len=85 TSval=803577234 TSecr=1394105987"
"183","37.969093","fe80::aa:1623:2a4e:a858","fe80::4e9:7ecb:78c2:fe8e","TCP","86","3431","0","60645  >  57071 [ACK] Seq=3431 Ack=3286 Win=130944 Len=0 TSval=1394109173 TSecr=803577234"
"184","37.988777","fe80::aa:1623:2a4e:a858","fe80::4e9:7ecb:78c2:fe8e","TLSv1.2","203","3431","117","Application Data"
"185","37.988880","fe80::4e9:7ecb:78c2:fe8e","fe80::aa:1623:2a4e:a858","TCP","86","3286","0","57071  >  60645 [ACK] Seq=3286 Ack=3548 Win=130944 Len=0 TSval=803577312 TSecr=1394109183"
"188","40.001877","fe80::4e9:7ecb:78c2:fe8e","fe80::aa:1623:2a4e:a858","TLSv1.2","171","3286","85","Application Data"
"189","40.043305","fe80::aa:1623:2a4e:a858","fe80::4e9:7ecb:78c2:fe8e","TCP","86","3548","0","60645  >  57071 [ACK] Seq=3548 Ack=3371 Win=130944 Len=0 TSval=1394111255 TSecr=803579323"
"190","40.050859","fe80::aa:1623:2a4e:a858","fe80::4e9:7ecb:78c2:fe8e","TLSv1.2","203","3548","117","Application Data"
"191","40.050958","fe80::4e9:7ecb:78c2:fe8e","fe80::aa:1623:2a4e:a858","TCP","86","3371","0","57071  >  60645 [ACK] Seq=3371 Ack=3665 Win=130944 Len=0 TSval=803579371 TSecr=1394111266"
"195","42.062135","fe80::4e9:7ecb:78c2:fe8e","fe80::aa:1623:2a4e:a858","TLSv1.2","171","3371","85","Application Data"
"196","42.068630","fe80::aa:1623:2a4e:a858","fe80::4e9:7ecb:78c2:fe8e","TCP","86","3665","0","60645  >  57071 [ACK] Seq=3665 Ack=3456 Win=130944 Len=0 TSval=1394113296 TSecr=803581382"
"197","42.082104","fe80::aa:1623:2a4e:a858","fe80::4e9:7ecb:78c2:fe8e","TLSv1.2","203","3665","117","Application Data"
"198","42.082234","fe80::4e9:7ecb:78c2:fe8e","fe80::aa:1623:2a4e:a858","TCP","86","3456","0","57071  >  60645 [ACK] Seq=3456 Ack=3782 Win=130944 Len=0 TSval=803581400 TSecr=1394113306"
"228","44.094571","fe80::4e9:7ecb:78c2:fe8e","fe80::aa:1623:2a4e:a858","TLSv1.2","171","3456","85","Application Data"
"229","44.205911","fe80::aa:1623:2a4e:a858","fe80::4e9:7ecb:78c2:fe8e","TCP","86","3782","0","60645  >  57071 [ACK] Seq=3782 Ack=3541 Win=130944 Len=0 TSval=1394115395 TSecr=803583412"
"230","44.244594","fe80::aa:1623:2a4e:a858","fe80::4e9:7ecb:78c2:fe8e","TLSv1.2","203","3782","117","Application Data"
"231","44.244702","fe80::4e9:7ecb:78c2:fe8e","fe80::aa:1623:2a4e:a858","TCP","86","3541","0","57071  >  60645 [ACK] Seq=3541 Ack=3899 Win=130944 Len=0 TSval=803583560 TSecr=1394115406"
"239","46.261303","fe80::4e9:7ecb:78c2:fe8e","fe80::aa:1623:2a4e:a858","TLSv1.2","171","3541","85","Application Data"
"240","46.273807","fe80::aa:1623:2a4e:a858","fe80::4e9:7ecb:78c2:fe8e","TCP","86","3899","0","60645  >  57071 [ACK] Seq=3899 Ack=3626 Win=130944 Len=0 TSval=1394117497 TSecr=803585575"
"241","46.279831","fe80::aa:1623:2a4e:a858","fe80::4e9:7ecb:78c2:fe8e","TLSv1.2","203","3899","117","Application Data"
"242","46.279918","fe80::4e9:7ecb:78c2:fe8e","fe80::aa:1623:2a4e:a858","TCP","86","3626","0","57071  >  60645 [ACK] Seq=3626 Ack=4016 Win=130944 Len=0 TSval=803585592 TSecr=1394117507"
"248","48.296190","fe80::4e9:7ecb:78c2:fe8e","fe80::aa:1623:2a4e:a858","TLSv1.2","171","3626","85","Application Data"
"249","48.414664","fe80::aa:1623:2a4e:a858","fe80::4e9:7ecb:78c2:fe8e","TCP","86","4016","0","60645  >  57071 [ACK] Seq=4016 Ack=3711 Win=130944 Len=0 TSval=1394119592 TSecr=803587606"
"250","48.426917","fe80::aa:1623:2a4e:a858","fe80::4e9:7ecb:78c2:fe8e","TLSv1.2","203","4016","117","Application Data"
"251","48.427008","fe80::4e9:7ecb:78c2:fe8e","fe80::aa:1623:2a4e:a858","TCP","86","3711","0","57071  >  60645 [ACK] Seq=3711 Ack=4133 Win=130944 Len=0 TSval=803587736 TSecr=1394119601"
"252","48.441365","fe80::4e9:7ecb:78c2:fe8e","fe80::aa:1623:2a4e:a858","TLSv1.2","171","3711","85","Application Data"
"253","48.554607","fe80::aa:1623:2a4e:a858","fe80::4e9:7ecb:78c2:fe8e","TCP","86","4133","0","60645  >  57071 [ACK] Seq=4133 Ack=3796 Win=130944 Len=0 TSval=1394119713 TSecr=803587750"
"254","48.605352","fe80::aa:1623:2a4e:a858","fe80::4e9:7ecb:78c2:fe8e","TLSv1.2","171","4133","85","Application Data"
"255","48.605454","fe80::4e9:7ecb:78c2:fe8e","fe80::aa:1623:2a4e:a858","TCP","86","3796","0","57071  >  60645 [ACK] Seq=3796 Ack=4218 Win=130944 Len=0 TSval=803587913 TSecr=1394119723"
"256","48.616033","fe80::4e9:7ecb:78c2:fe8e","fe80::aa:1623:2a4e:a858","TLSv1.2","171","3796","85","Application Data"
"257","48.747261","fe80::aa:1623:2a4e:a858","fe80::4e9:7ecb:78c2:fe8e","TCP","86","4218","0","60645  >  57071 [ACK] Seq=4218 Ack=3881 Win=130944 Len=0 TSval=1394119946 TSecr=803587923"
"258","48.778836","fe80::aa:1623:2a4e:a858","fe80::4e9:7ecb:78c2:fe8e","TLSv1.2","171","4218","85","Application Data"
"259","48.778935","fe80::4e9:7ecb:78c2:fe8e","fe80::aa:1623:2a4e:a858","TCP","86","3881","0","57071  >  60645 [ACK] Seq=3881 Ack=4303 Win=130944 Len=0 TSval=803588084 TSecr=1394119954"
"260","48.811948","fe80::4e9:7ecb:78c2:fe8e","fe80::aa:1623:2a4e:a858","TLSv1.2","155","3881","69","Encrypted Alert"
"261","48.813293","fe80::4e9:7ecb:78c2:fe8e","fe80::aa:1623:2a4e:a858","TCP","86","3950","0","57071  >  60645 [FIN, ACK] Seq=3950 Ack=4303 Win=131072 Len=0 TSval=803588118 TSecr=1394119954"
"265","48.881075","fe80::aa:1623:2a4e:a858","fe80::4e9:7ecb:78c2:fe8e","TCP","86","4303","0","60645  >  57071 [ACK] Seq=4303 Ack=3950 Win=130944 Len=0 TSval=1394120085 TSecr=803588117"
"266","48.917347","fe80::aa:1623:2a4e:a858","fe80::4e9:7ecb:78c2:fe8e","TCP","86","4303","0","60645  >  57071 [ACK] Seq=4303 Ack=3951 Win=130944 Len=0 TSval=1394120085 TSecr=803588118"
"274","53.868917","fe80::aa:1623:2a4e:a858","fe80::4e9:7ecb:78c2:fe8e","TLSv1.2","155","4303","69","Encrypted Alert"
"275","53.869083","fe80::4e9:7ecb:78c2:fe8e","fe80::aa:1623:2a4e:a858","TCP","74","3951","0","57071  >  60645 [RST] Seq=3951 Win=0 Len=0"
"276","53.869436","fe80::aa:1623:2a4e:a858","fe80::4e9:7ecb:78c2:fe8e","TCP","86","4372","0","60645  >  57071 [FIN, ACK] Seq=4372 Ack=3951 Win=130944 Len=0 TSval=1394124961 TSecr=803588118"
"277","53.869441","fe80::aa:1623:2a4e:a858","fe80::4e9:7ecb:78c2:fe8e","TCP","74","4373","0","60645  >  57071 [RST, ACK] Seq=4373 Ack=3951 Win=130944 Len=0"
"278","53.869647","fe80::4e9:7ecb:78c2:fe8e","fe80::aa:1623:2a4e:a858","TCP","74","3951","0","57071  >  60645 [RST] Seq=3951 Win=0 Len=0"
"284","58.933597","fe80::4e9:7ecb:78c2:fe8e","ff02::1","UDP","72","","","57584  >  15118 Len=10"
"287","58.980761","fe80::aa:1623:2a4e:a858","fe80::4e9:7ecb:78c2:fe8e","UDP","90","","","15118  >  57584 Len=28"
"294","60.072118","fe80::4e9:7ecb:78c2:fe8e","fe80::aa:1623:2a4e:a858","TCP","98","0","0","57072  >  60645 [SYN, ECN, CWR] Seq=0 Win=65535 Len=0 MSS=1440 WS=64 TSval=803599369 TSecr=0 SACK_PERM=1"
"295","60.125879","fe80::aa:1623:2a4e:a858","fe80::4e9:7ecb:78c2:fe8e","TCP","98","0","0","60645  >  57072 [SYN, ACK, ECN] Seq=0 Ack=1 Win=65535 Len=0 MSS=1440 WS=64 TSval=3775604192 TSecr=803599369 SACK_PERM=1"
"296","60.125993","fe80::4e9:7ecb:78c2:fe8e","fe80::aa:1623:2a4e:a858","TCP","86","1","0","57072  >  60645 [ACK] Seq=1 Ack=1 Win=131328 Len=0 TSval=803599422 TSecr=3775604192"
"297","60.180753","fe80::4e9:7ecb:78c2:fe8e","fe80::aa:1623:2a4e:a858","TLSv1.2","288","1","202","Client Hello"
"299","60.261883","fe80::aa:1623:2a4e:a858","fe80::4e9:7ecb:78c2:fe8e","TCP","86","1","0","[TCP Window Update] 60645  >  57072 [ACK] Seq=1 Ack=1 Win=131328 Len=0 TSval=3775604242 TSecr=803599422"
"300","60.279603","fe80::aa:1623:2a4e:a858","fe80::4e9:7ecb:78c2:fe8e","TLSv1.2","176","1","90","Server Hello"
"301","60.279702","fe80::4e9:7ecb:78c2:fe8e","fe80::aa:1623:2a4e:a858","TCP","86","203","0","57072  >  60645 [ACK] Seq=203 Ack=91 Win=131264 Len=0 TSval=803599574 TSecr=3775604374"
"302","60.282782","fe80::aa:1623:2a4e:a858","fe80::4e9:7ecb:78c2:fe8e","TCP","1514","91","1428","60645  >  57072 [ACK] Seq=91 Ack=203 Win=131136 Len=1428 TSval=3775604374 TSecr=803599476 [TCP segment of a reassembled PDU]"
"303","60.282788","fe80::aa:1623:2a4e:a858","fe80::4e9:7ecb:78c2:fe8e","TLSv1.2","96","1519","10","Certificate"
"304","60.282887","fe80::4e9:7ecb:78c2:fe8e","fe80::aa:1623:2a4e:a858","TCP","86","203","0","57072  >  60645 [ACK] Seq=203 Ack=1529 Win=129792 Len=0 TSval=803599577 TSecr=3775604374"
"309","60.873204","fe80::aa:1623:2a4e:a858","fe80::4e9:7ecb:78c2:fe8e","TCP","1514","91","1428","[TCP Spurious Retransmission] 60645  >  57072 [ACK] Seq=91 Ack=203 Win=131136 Len=1428 TSval=3775604724 TSecr=803599574"
"310","60.873314","fe80::4e9:7ecb:78c2:fe8e","fe80::aa:1623:2a4e:a858","TCP","98","203","0","[TCP Window Update] 57072  >  60645 [ACK] Seq=203 Ack=1529 Win=131072 Len=0 TSval=803600166 TSecr=3775604374 SLE=91 SRE=1519"
"312","61.460246","fe80::aa:1623:2a4e:a858","fe80::4e9:7ecb:78c2:fe8e","TCP","1274","91","1188","[TCP Spurious Retransmission] 60645  >  57072 [ACK] Seq=91 Ack=203 Win=131136 Len=1188 TSval=3775605126 TSecr=803599574"
"313","61.460347","fe80::4e9:7ecb:78c2:fe8e","fe80::aa:1623:2a4e:a858","TCP","98","203","0","[TCP Dup ACK 304#1] 57072  >  60645 [ACK] Seq=203 Ack=1529 Win=131072 Len=0 TSval=803600753 TSecr=3775604374 SLE=91 SRE=1279"
"314","61.480182","fe80::aa:1623:2a4e:a858","fe80::4e9:7ecb:78c2:fe8e","TLSv1.2","215","1529","129","Server Key Exchange, Server Hello Done"
"315","61.480278","fe80::4e9:7ecb:78c2:fe8e","fe80::aa:1623:2a4e:a858","TCP","86","203","0","57072  >  60645 [ACK] Seq=203 Ack=1658 Win=130880 Len=0 TSval=803600772 TSecr=3775605321"
"316","61.506504","fe80::4e9:7ecb:78c2:fe8e","fe80::aa:1623:2a4e:a858","TLSv1.2","128","203","42","Client Key Exchange"
"317","61.550667","fe80::aa:1623:2a4e:a858","fe80::4e9:7ecb:78c2:fe8e","TCP","86","1658","0","60645  >  57072 [ACK] Seq=1658 Ack=245 Win=131072 Len=0 TSval=3775605614 TSecr=803600797"
"318","61.550777","fe80::4e9:7ecb:78c2:fe8e","fe80::aa:1623:2a4e:a858","TLSv1.2","177","245","91","Change Cipher Spec, Encrypted Handshake Message"
"319","61.705381","fe80::aa:1623:2a4e:a858","fe80::4e9:7ecb:78c2:fe8e","TCP","86","1658","0","60645  >  57072 [ACK] Seq=1658 Ack=336 Win=131008 Len=0 TSval=3775605680 TSecr=803600840"
"320","61.735616","fe80::aa:1623:2a4e:a858","fe80::4e9:7ecb:78c2:fe8e","TLSv1.2","92","1658","6","Change Cipher Spec"
"321","61.735715","fe80::4e9:7ecb:78c2:fe8e","fe80::aa:1623:2a4e:a858","TCP","86","336","0","57072  >  60645 [ACK] Seq=336 Ack=1664 Win=131008 Len=0 TSval=803601024 TSecr=3775605680"
"322","62.372413","fe80::aa:1623:2a4e:a858","fe80::4e9:7ecb:78c2:fe8e","TLSv1.2","171","1664","85","Encrypted Handshake Message"
"323","62.372518","fe80::4e9:7ecb:78c2:fe8e","fe80::aa:1623:2a4e:a858","TCP","86","336","0","57072  >  60645 [ACK] Seq=336 Ack=1749 Win=130944 Len=0 TSval=803601660 TSecr=3775606062"
"324","62.460905","fe80::4e9:7ecb:78c2:fe8e","fe80::aa:1623:2a4e:a858","TLSv1.2","187","336","101","Application Data"
"325","62.464854","fe80::aa:1623:2a4e:a858","fe80::4e9:7ecb:78c2:fe8e","TCP","86","1749","0","60645  >  57072 [ACK] Seq=1749 Ack=437 Win=130944 Len=0 TSval=3775606565 TSecr=803601748"
"326","62.487895","fe80::aa:1623:2a4e:a858","fe80::4e9:7ecb:78c2:fe8e","TLSv1.2","155","1749","69","Application Data"
"327","62.488005","fe80::4e9:7ecb:78c2:fe8e","fe80::aa:1623:2a4e:a858","TCP","86","437","0","57072  >  60645 [ACK] Seq=437 Ack=1818 Win=130944 Len=0 TSval=803601775 TSecr=3775606577"
"328","62.640802","fe80::4e9:7ecb:78c2:fe8e","fe80::aa:1623:2a4e:a858","TLSv1.2","171","437","85","Application Data"
"329","62.717329","fe80::aa:1623:2a4e:a858","fe80::4e9:7ecb:78c2:fe8e","TCP","86","1818","0","60645  >  57072 [ACK] Seq=1818 Ack=522 Win=130944 Len=0 TSval=3775606809 TSecr=803601927"
"330","62.743544","fe80::aa:1623:2a4e:a858","fe80::4e9:7ecb:78c2:fe8e","TLSv1.2","187","1818","101","Application Data"
"331","62.743642","fe80::4e9:7ecb:78c2:fe8e","fe80::aa:1623:2a4e:a858","TCP","86","522","0","57072  >  60645 [ACK] Seq=522 Ack=1919 Win=130944 Len=0 TSval=803602029 TSecr=3775606818"
"332","62.754475","fe80::4e9:7ecb:78c2:fe8e","fe80::aa:1623:2a4e:a858","TLSv1.2","171","522","85","Application Data"
"337","63.089742","fe80::aa:1623:2a4e:a858","fe80::4e9:7ecb:78c2:fe8e","TCP","86","1919","0","60645  >  57072 [ACK] Seq=1919 Ack=607 Win=130944 Len=0 TSval=3775607118 TSecr=803602039"
"338","63.092369","fe80::aa:1623:2a4e:a858","fe80::4e9:7ecb:78c2:fe8e","TLSv1.2","251","1919","165","Application Data"
"339","63.092460","fe80::4e9:7ecb:78c2:fe8e","fe80::aa:1623:2a4e:a858","TCP","86","607","0","57072  >  60645 [ACK] Seq=607 Ack=2084 Win=130880 Len=0 TSval=803602376 TSecr=3775607128"
"340","63.287157","fe80::4e9:7ecb:78c2:fe8e","fe80::aa:1623:2a4e:a858","TLSv1.2","171","607","85","Application Data"
"341","63.434798","fe80::aa:1623:2a4e:a858","fe80::4e9:7ecb:78c2:fe8e","TCP","86","2084","0","60645  >  57072 [ACK] Seq=2084 Ack=692 Win=130944 Len=0 TSval=3775607524 TSecr=803602569"
"342","63.439845","fe80::aa:1623:2a4e:a858","fe80::4e9:7ecb:78c2:fe8e","TLSv1.2","171","2084","85","Application Data"
"343","63.439939","fe80::4e9:7ecb:78c2:fe8e","fe80::aa:1623:2a4e:a858","TCP","86","692","0","57072  >  60645 [ACK] Seq=692 Ack=2169 Win=130944 Len=0 TSval=803602720 TSecr=3775607532"
"346","64.120904","fe80::4e9:7ecb:78c2:fe8e","fe80::aa:1623:2a4e:a858","TCP","1514","692","1428","57072  >  60645 [ACK] Seq=692 Ack=2169 Win=131072 Len=1428 TSval=803603400 TSecr=3775607532 [TCP segment of a reassembled PDU]"
"347","64.120905","fe80::4e9:7ecb:78c2:fe8e","fe80::aa:1623:2a4e:a858","TLSv1.2","183","2120","97","Application Data"
"348","64.258544","fe80::aa:1623:2a4e:a858","fe80::4e9:7ecb:78c2:fe8e","TCP","86","2169","0","60645  >  57072 [ACK] Seq=2169 Ack=2120 Win=129600 Len=0 TSval=3775608339 TSecr=803603400"
"349","64.278234","fe80::aa:1623:2a4e:a858","fe80::4e9:7ecb:78c2:fe8e","TCP","86","2169","0","60645  >  57072 [ACK] Seq=2169 Ack=2217 Win=130944 Len=0 TSval=3775608377 TSecr=803603400"
"350","64.337440","fe80::aa:1623:2a4e:a858","fe80::4e9:7ecb:78c2:fe8e","TLSv1.2","187","2169","101","Application Data"
"351","64.337537","fe80::4e9:7ecb:78c2:fe8e","fe80::aa:1623:2a4e:a858","TCP","86","2217","0","57072  >  60645 [ACK] Seq=2217 Ack=2270 Win=130944 Len=0 TSval=803603615 TSecr=3775608416"
"352","64.607716","fe80::4e9:7ecb:78c2:fe8e","fe80::aa:1623:2a4e:a858","TLSv1.2","459","2217","373","Application Data"
"354","64.817050","fe80::aa:1623:2a4e:a858","fe80::4e9:7ecb:78c2:fe8e","TCP","86","2270","0","60645  >  57072 [ACK] Seq=2270 Ack=2590 Win=130688 Len=0 TSval=3775608910 TSecr=803603885"
"355","64.832677","fe80::aa:1623:2a4e:a858","fe80::4e9:7ecb:78c2:fe8e","TLSv1.2","171","2270","85","Application Data"
"356","64.832775","fe80::4e9:7ecb:78c2:fe8e","fe80::aa:1623:2a4e:a858","TCP","86","2590","0","57072  >  60645 [ACK] Seq=2590 Ack=2355 Win=130944 Len=0 TSval=803604109 TSecr=3775608931"
"357","64.849163","fe80::4e9:7ecb:78c2:fe8e","fe80::aa:1623:2a4e:a858","TLSv1.2","187","2590","101","Application Data"
"358","65.089624","fe80::aa:1623:2a4e:a858","fe80::4e9:7ecb:78c2:fe8e","TCP","86","2355","0","60645  >  57072 [ACK] Seq=2355 Ack=2691 Win=130944 Len=0 TSval=3775609183 TSecr=803604125"
"360","65.131715","fe80::aa:1623:2a4e:a858","fe80::4e9:7ecb:78c2:fe8e","TLSv1.2","491","2355","405","Application Data"
"361","65.131808","fe80::4e9:7ecb:78c2:fe8e","fe80::aa:1623:2a4e:a858","TCP","86","2691","0","57072  >  60645 [ACK] Seq=2691 Ack=2760 Win=130624 Len=0 TSval=803604407 TSecr=3775609204"
"362","65.265128","fe80::4e9:7ecb:78c2:fe8e","fe80::aa:1623:2a4e:a858","TLSv1.2","171","2691","85","Application Data"
"363","65.284259","fe80::aa:1623:2a4e:a858","fe80::4e9:7ecb:78c2:fe8e","TCP","86","2760","0","60645  >  57072 [ACK] Seq=2760 Ack=2776 Win=130944 Len=0 TSval=3775609377 TSecr=803604539"
"364","65.304163","fe80::aa:1623:2a4e:a858","fe80::4e9:7ecb:78c2:fe8e","TLSv1.2","171","2760","85","Application Data"
"365","65.304272","fe80::4e9:7ecb:78c2:fe8e","fe80::aa:1623:2a4e:a858","TCP","86","2776","0","57072  >  60645 [ACK] Seq=2776 Ack=2845 Win=130944 Len=0 TSval=803604577 TSecr=3775609385"
"366","65.316615","fe80::4e9:7ecb:78c2:fe8e","fe80::aa:1623:2a4e:a858","TLSv1.2","171","2776","85","Application Data"
"367","65.349967","fe80::aa:1623:2a4e:a858","fe80::4e9:7ecb:78c2:fe8e","TCP","86","2845","0","60645  >  57072 [ACK] Seq=2845 Ack=2861 Win=130944 Len=0 TSval=3775609450 TSecr=803604589"
"368","65.359236","fe80::aa:1623:2a4e:a858","fe80::4e9:7ecb:78c2:fe8e","TLSv1.2","203","2845","117","Application Data"
"369","65.359356","fe80::4e9:7ecb:78c2:fe8e","fe80::aa:1623:2a4e:a858","TCP","86","2861","0","57072  >  60645 [ACK] Seq=2861 Ack=2962 Win=130944 Len=0 TSval=803604631 TSecr=3775609459"
"376","67.379579","fe80::4e9:7ecb:78c2:fe8e","fe80::aa:1623:2a4e:a858","TLSv1.2","171","2861","85","Application Data"
"377","68.065026","fe80::4e9:7ecb:78c2:fe8e","fe80::aa:1623:2a4e:a858","TCP","171","2861","85","[TCP Retransmission] 57072  >  60645 [PSH, ACK] Seq=2861 Ack=2962 Win=131072 Len=85 TSval=803607334 TSecr=3775609459"
"384","68.525289","fe80::aa:1623:2a4e:a858","fe80::4e9:7ecb:78c2:fe8e","TCP","86","2962","0","60645  >  57072 [ACK] Seq=2962 Ack=2946 Win=130944 Len=0 TSval=3775612510 TSecr=803607334"
"385","68.550317","fe80::aa:1623:2a4e:a858","fe80::4e9:7ecb:78c2:fe8e","TLSv1.2","203","2962","117","Application Data"
"386","68.550414","fe80::4e9:7ecb:78c2:fe8e","fe80::aa:1623:2a4e:a858","TCP","86","2946","0","57072  >  60645 [ACK] Seq=2946 Ack=3079 Win=130944 Len=0 TSval=803607819 TSecr=3775612520"
"388","70.574852","fe80::4e9:7ecb:78c2:fe8e","fe80::aa:1623:2a4e:a858","TLSv1.2","171","2946","85","Application Data"
"389","70.643784","fe80::aa:1623:2a4e:a858","fe80::4e9:7ecb:78c2:fe8e","TCP","86","3079","0","60645  >  57072 [ACK] Seq=3079 Ack=3031 Win=130944 Len=0 TSval=3775614710 TSecr=803609842"
"390","70.657891","fe80::aa:1623:2a4e:a858","fe80::4e9:7ecb:78c2:fe8e","TLSv1.2","203","3079","117","Application Data"
"391","70.658034","fe80::4e9:7ecb:78c2:fe8e","fe80::aa:1623:2a4e:a858","TCP","86","3031","0","57072  >  60645 [ACK] Seq=3031 Ack=3196 Win=130944 Len=0 TSval=803609924 TSecr=3775614718"
"395","72.671812","fe80::4e9:7ecb:78c2:fe8e","fe80::aa:1623:2a4e:a858","TLSv1.2","171","3031","85","Application Data"
"397","73.141968","fe80::aa:1623:2a4e:a858","fe80::4e9:7ecb:78c2:fe8e","TCP","86","3196","0","60645  >  57072 [ACK] Seq=3196 Ack=3116 Win=130944 Len=0 TSval=3775617150 TSecr=803611936"
"398","73.162226","fe80::aa:1623:2a4e:a858","fe80::4e9:7ecb:78c2:fe8e","TLSv1.2","203","3196","117","Application Data"
"399","73.162382","fe80::4e9:7ecb:78c2:fe8e","fe80::aa:1623:2a4e:a858","TCP","86","3116","0","57072  >  60645 [ACK] Seq=3116 Ack=3313 Win=130944 Len=0 TSval=803612426 TSecr=3775617159"
"403","75.178924","fe80::4e9:7ecb:78c2:fe8e","fe80::aa:1623:2a4e:a858","TLSv1.2","171","3116","85","Application Data"
"404","75.263142","fe80::aa:1623:2a4e:a858","fe80::4e9:7ecb:78c2:fe8e","TCP","86","3313","0","60645  >  57072 [ACK] Seq=3313 Ack=3201 Win=130944 Len=0 TSval=3775619364 TSecr=803614441"
"405","75.272481","fe80::aa:1623:2a4e:a858","fe80::4e9:7ecb:78c2:fe8e","TLSv1.2","203","3313","117","Application Data"
"406","75.272570","fe80::4e9:7ecb:78c2:fe8e","fe80::aa:1623:2a4e:a858","TCP","86","3201","0","57072  >  60645 [ACK] Seq=3201 Ack=3430 Win=130944 Len=0 TSval=803614534 TSecr=3775619373"
"411","77.286898","fe80::4e9:7ecb:78c2:fe8e","fe80::aa:1623:2a4e:a858","TLSv1.2","171","3201","85","Application Data"
"412","77.382421","fe80::aa:1623:2a4e:a858","fe80::4e9:7ecb:78c2:fe8e","TCP","86","3430","0","60645  >  57072 [ACK] Seq=3430 Ack=3286 Win=130944 Len=0 TSval=3775621453 TSecr=803616547"
"413","77.392443","fe80::aa:1623:2a4e:a858","fe80::4e9:7ecb:78c2:fe8e","TLSv1.2","203","3430","117","Application Data"
"414","77.392565","fe80::4e9:7ecb:78c2:fe8e","fe80::aa:1623:2a4e:a858","TCP","86","3286","0","57072  >  60645 [ACK] Seq=3286 Ack=3547 Win=130944 Len=0 TSval=803616652 TSecr=3775621461"
"420","79.406578","fe80::4e9:7ecb:78c2:fe8e","fe80::aa:1623:2a4e:a858","TLSv1.2","171","3286","85","Application Data"
"421","79.442379","fe80::aa:1623:2a4e:a858","fe80::4e9:7ecb:78c2:fe8e","TCP","86","3547","0","60645  >  57072 [ACK] Seq=3547 Ack=3371 Win=130944 Len=0 TSval=3775623535 TSecr=803618665"
"422","79.444206","fe80::aa:1623:2a4e:a858","fe80::4e9:7ecb:78c2:fe8e","TLSv1.2","203","3547","117","Application Data"
"423","79.444302","fe80::4e9:7ecb:78c2:fe8e","fe80::aa:1623:2a4e:a858","TCP","86","3371","0","57072  >  60645 [ACK] Seq=3371 Ack=3664 Win=130944 Len=0 TSval=803618701 TSecr=3775623545"
"431","81.460095","fe80::4e9:7ecb:78c2:fe8e","fe80::aa:1623:2a4e:a858","TLSv1.2","171","3371","85","Application Data"
"432","81.463526","fe80::aa:1623:2a4e:a858","fe80::4e9:7ecb:78c2:fe8e","TCP","86","3664","0","60645  >  57072 [ACK] Seq=3664 Ack=3456 Win=130944 Len=0 TSval=3775625565 TSecr=803620715"
"433","81.473791","fe80::aa:1623:2a4e:a858","fe80::4e9:7ecb:78c2:fe8e","TLSv1.2","203","3664","117","Application Data"
"434","81.473874","fe80::4e9:7ecb:78c2:fe8e","fe80::aa:1623:2a4e:a858","TCP","86","3456","0","57072  >  60645 [ACK] Seq=3456 Ack=3781 Win=130944 Len=0 TSval=803620728 TSecr=3775625575"
"442","83.490854","fe80::4e9:7ecb:78c2:fe8e","fe80::aa:1623:2a4e:a858","TLSv1.2","171","3456","85","Application Data"
"443","83.561241","fe80::aa:1623:2a4e:a858","fe80::4e9:7ecb:78c2:fe8e","TCP","86","3781","0","60645  >  57072 [ACK] Seq=3781 Ack=3541 Win=130944 Len=0 TSval=3775627662 TSecr=803622742"
"444","83.568309","fe80::aa:1623:2a4e:a858","fe80::4e9:7ecb:78c2:fe8e","TLSv1.2","203","3781","117","Application Data"
"445","83.568397","fe80::4e9:7ecb:78c2:fe8e","fe80::aa:1623:2a4e:a858","TCP","86","3541","0","57072  >  60645 [ACK] Seq=3541 Ack=3898 Win=130944 Len=0 TSval=803622819 TSecr=3775627670"
"452","85.586786","fe80::4e9:7ecb:78c2:fe8e","fe80::aa:1623:2a4e:a858","TLSv1.2","171","3541","85","Application Data"
"453","85.637672","fe80::aa:1623:2a4e:a858","fe80::4e9:7ecb:78c2:fe8e","TCP","86","3898","0","60645  >  57072 [ACK] Seq=3898 Ack=3626 Win=130944 Len=0 TSval=3775629738 TSecr=803624835"
"454","85.644416","fe80::aa:1623:2a4e:a858","fe80::4e9:7ecb:78c2:fe8e","TLSv1.2","203","3898","117","Application Data"
"455","85.644560","fe80::4e9:7ecb:78c2:fe8e","fe80::aa:1623:2a4e:a858","TCP","86","3626","0","57072  >  60645 [ACK] Seq=3626 Ack=4015 Win=130944 Len=0 TSval=803624891 TSecr=3775629746"
"457","87.657581","fe80::4e9:7ecb:78c2:fe8e","fe80::aa:1623:2a4e:a858","TLSv1.2","171","3626","85","Application Data"
"458","87.663171","fe80::aa:1623:2a4e:a858","fe80::4e9:7ecb:78c2:fe8e","TCP","86","4015","0","60645  >  57072 [ACK] Seq=4015 Ack=3711 Win=130944 Len=0 TSval=3775631764 TSecr=803626903"
"459","87.671018","fe80::aa:1623:2a4e:a858","fe80::4e9:7ecb:78c2:fe8e","TLSv1.2","203","4015","117","Application Data"
"460","87.671115","fe80::4e9:7ecb:78c2:fe8e","fe80::aa:1623:2a4e:a858","TCP","86","3711","0","57072  >  60645 [ACK] Seq=3711 Ack=4132 Win=130944 Len=0 TSval=803626915 TSecr=3775631772"
"461","87.682886","fe80::4e9:7ecb:78c2:fe8e","fe80::aa:1623:2a4e:a858","TLSv1.2","171","3711","85","Application Data"
"462","87.779251","fe80::aa:1623:2a4e:a858","fe80::4e9:7ecb:78c2:fe8e","TCP","86","4132","0","60645  >  57072 [ACK] Seq=4132 Ack=3796 Win=130944 Len=0 TSval=3775631832 TSecr=803626926"
"463","87.786204","fe80::aa:1623:2a4e:a858","fe80::4e9:7ecb:78c2:fe8e","TLSv1.2","171","4132","85","Application Data"
"464","87.786301","fe80::4e9:7ecb:78c2:fe8e","fe80::aa:1623:2a4e:a858","TCP","86","3796","0","57072  >  60645 [ACK] Seq=3796 Ack=4217 Win=130944 Len=0 TSval=803627028 TSecr=3775631840"
"465","87.796448","fe80::4e9:7ecb:78c2:fe8e","fe80::aa:1623:2a4e:a858","TLSv1.2","171","3796","85","Application Data"
"466","87.847447","fe80::aa:1623:2a4e:a858","fe80::4e9:7ecb:78c2:fe8e","TCP","86","4217","0","60645  >  57072 [ACK] Seq=4217 Ack=3881 Win=130944 Len=0 TSval=3775631932 TSecr=803627038"
"467","87.847701","fe80::aa:1623:2a4e:a858","fe80::4e9:7ecb:78c2:fe8e","TLSv1.2","171","4217","85","Application Data"
"468","87.847779","fe80::4e9:7ecb:78c2:fe8e","fe80::aa:1623:2a4e:a858","TCP","86","3881","0","57072  >  60645 [ACK] Seq=3881 Ack=4302 Win=130944 Len=0 TSval=803627089 TSecr=3775631939"
"469","87.878837","fe80::4e9:7ecb:78c2:fe8e","fe80::aa:1623:2a4e:a858","TLSv1.2","155","3881","69","Encrypted Alert"
"470","87.880072","fe80::4e9:7ecb:78c2:fe8e","fe80::aa:1623:2a4e:a858","TCP","86","3950","0","57072  >  60645 [FIN, ACK] Seq=3950 Ack=4302 Win=131072 Len=0 TSval=803627121 TSecr=3775631939"
"471","87.929031","fe80::aa:1623:2a4e:a858","fe80::4e9:7ecb:78c2:fe8e","TCP","86","4302","0","60645  >  57072 [ACK] Seq=4302 Ack=3950 Win=130944 Len=0 TSval=3775632014 TSecr=803627120"
"472","88.468032","fe80::aa:1623:2a4e:a858","fe80::4e9:7ecb:78c2:fe8e","TCP","86","4302","0","60645  >  57072 [ACK] Seq=4302 Ack=3951 Win=130944 Len=0 TSval=3775632032 TSecr=803627121"
"484","93.115042","fe80::aa:1623:2a4e:a858","fe80::4e9:7ecb:78c2:fe8e","TLSv1.2","155","4302","69","Encrypted Alert"
"485","93.115193","fe80::4e9:7ecb:78c2:fe8e","fe80::aa:1623:2a4e:a858","TCP","74","3951","0","57072  >  60645 [RST] Seq=3951 Win=0 Len=0"
"486","93.136954","fe80::aa:1623:2a4e:a858","fe80::4e9:7ecb:78c2:fe8e","TCP","86","4371","0","60645  >  57072 [FIN, ACK] Seq=4371 Ack=3951 Win=130944 Len=0 TSval=3775636944 TSecr=803627121"
"487","93.136959","fe80::aa:1623:2a4e:a858","fe80::4e9:7ecb:78c2:fe8e","TCP","74","4372","0","60645  >  57072 [RST, ACK] Seq=4372 Ack=3951 Win=130944 Len=0"
"488","93.137042","fe80::4e9:7ecb:78c2:fe8e","fe80::aa:1623:2a4e:a858","TCP","74","3951","0","57072  >  60645 [RST] Seq=3951 Win=0 Len=0"
