"No.","Time","Source","Destination","Protocol","Length","Sequence Number","Acknowledgment Number","TCP Segment Len","Info"
"1","0.000000000","fe80::f4af:cb28:5ee1:34bd","ff02::1","UDP","72","","","","57458  >  15118 Len=10"
"2","0.034018913","fe80::18b6:b99d:235d:1cb2","fe80::f4af:cb28:5ee1:34bd","UDP","90","","","","15118  >  57458 Len=28"
"3","0.331517185","fe80::f4af:cb28:5ee1:34bd","fe80::18b6:b99d:235d:1cb2","TCP","94","0","0","0","46514  >  55178 [SYN] Seq=0 Win=64800 Len=0 MSS=1440 SACK_PERM=1 TSval=1598897946 TSecr=0 WS=128"
"4","0.535276824","fe80::18b6:b99d:235d:1cb2","fe80::f4af:cb28:5ee1:34bd","TCP","98","0","1","0","55178  >  46514 [SYN, ACK] Seq=0 Ack=1 Win=65535 Len=0 MSS=1440 WS=64 TSval=1164500321 TSecr=1598897946 SACK_PERM=1"
"5","0.535299988","fe80::f4af:cb28:5ee1:34bd","fe80::18b6:b99d:235d:1cb2","TCP","86","1","1","0","46514  >  55178 [ACK] Seq=1 Ack=1 Win=64896 Len=0 TSval=1598898149 TSecr=1164500321"
"6","0.539040421","fe80::18b6:b99d:235d:1cb2","fe80::f4af:cb28:5ee1:34bd","TCP","86","1","1","0","[TCP Window Update] 55178  >  46514 [ACK] Seq=1 Ack=1 Win=131328 Len=0 TSval=1164500424 TSecr=1598898149"
"7","0.553241382","fe80::f4af:cb28:5ee1:34bd","fe80::18b6:b99d:235d:1cb2","TLSv1.2","288","1","1","202","Client Hello"
"8","0.558660615","fe80::18b6:b99d:235d:1cb2","fe80::f4af:cb28:5ee1:34bd","TCP","86","1","203","0","55178  >  46514 [ACK] Seq=1 Ack=203 Win=131136 Len=0 TSval=1164500443 TSecr=1598898167"
"9","0.618862198","fe80::18b6:b99d:235d:1cb2","fe80::f4af:cb28:5ee1:34bd","TLSv1.2","176","1","203","90","Server Hello"
"10","0.618941622","fe80::f4af:cb28:5ee1:34bd","fe80::18b6:b99d:235d:1cb2","TCP","86","203","91","0","46514  >  55178 [ACK] Seq=203 Ack=91 Win=64896 Len=0 TSval=1598898233 TSecr=1164500503"
"11","0.621102207","fe80::18b6:b99d:235d:1cb2","fe80::f4af:cb28:5ee1:34bd","TLSv1.2","1524","91","203","1438","Certificate"
"12","0.621105924","fe80::f4af:cb28:5ee1:34bd","fe80::18b6:b99d:235d:1cb2","TCP","86","203","1529","0","46514  >  55178 [ACK] Seq=203 Ack=1529 Win=63488 Len=0 TSval=1598898235 TSecr=1164500503"
"13","0.634478713","fe80::18b6:b99d:235d:1cb2","fe80::f4af:cb28:5ee1:34bd","TLSv1.2","207","1529","203","121","Server Key Exchange"
"14","0.634497980","fe80::f4af:cb28:5ee1:34bd","fe80::18b6:b99d:235d:1cb2","TCP","86","203","1650","0","46514  >  55178 [ACK] Seq=203 Ack=1650 Win=63488 Len=0 TSval=1598898249 TSecr=1164500516"
"15","0.638257651","fe80::18b6:b99d:235d:1cb2","fe80::f4af:cb28:5ee1:34bd","TLSv1.2","95","1650","203","9","Server Hello Done"
"16","0.638272493","fe80::f4af:cb28:5ee1:34bd","fe80::18b6:b99d:235d:1cb2","TCP","86","203","1659","0","46514  >  55178 [ACK] Seq=203 Ack=1659 Win=63488 Len=0 TSval=1598898252 TSecr=1164500523"
"17","0.651139344","fe80::f4af:cb28:5ee1:34bd","fe80::18b6:b99d:235d:1cb2","TLSv1.2","128","203","1659","42","Client Key Exchange"
"18","0.654830983","fe80::18b6:b99d:235d:1cb2","fe80::f4af:cb28:5ee1:34bd","TCP","86","1659","245","0","55178  >  46514 [ACK] Seq=1659 Ack=245 Win=131072 Len=0 TSval=1164500540 TSecr=1598898265"
"19","0.655828616","fe80::f4af:cb28:5ee1:34bd","fe80::18b6:b99d:235d:1cb2","TLSv1.2","92","245","1659","6","Change Cipher Spec"
"20","0.659082253","fe80::18b6:b99d:235d:1cb2","fe80::f4af:cb28:5ee1:34bd","TCP","86","1659","251","0","55178  >  46514 [ACK] Seq=1659 Ack=251 Win=131072 Len=0 TSval=1164500544 TSecr=1598898270"
"21","0.659095977","fe80::f4af:cb28:5ee1:34bd","fe80::18b6:b99d:235d:1cb2","TLSv1.2","171","251","1659","85","Encrypted Handshake Message"
"22","0.664651566","fe80::18b6:b99d:235d:1cb2","fe80::f4af:cb28:5ee1:34bd","TCP","86","1659","336","0","55178  >  46514 [ACK] Seq=1659 Ack=336 Win=131008 Len=0 TSval=1164500547 TSecr=1598898273"
"23","0.666380340","fe80::18b6:b99d:235d:1cb2","fe80::f4af:cb28:5ee1:34bd","TLSv1.2","92","1659","336","6","Change Cipher Spec"
"24","0.715704564","fe80::f4af:cb28:5ee1:34bd","fe80::18b6:b99d:235d:1cb2","TCP","86","336","1665","0","46514  >  55178 [ACK] Seq=336 Ack=1665 Win=64128 Len=0 TSval=1598898330 TSecr=1164500552"
"25","0.722300806","fe80::18b6:b99d:235d:1cb2","fe80::f4af:cb28:5ee1:34bd","TLSv1.2","171","1665","336","85","Encrypted Handshake Message"
"26","0.722316760","fe80::f4af:cb28:5ee1:34bd","fe80::18b6:b99d:235d:1cb2","TCP","86","336","1750","0","46514  >  55178 [ACK] Seq=336 Ack=1750 Win=64128 Len=0 TSval=1598898336 TSecr=1164500604"
"27","0.756105981","fe80::f4af:cb28:5ee1:34bd","fe80::18b6:b99d:235d:1cb2","TLSv1.2","187","336","1750","101","Application Data"
"28","0.759938754","fe80::18b6:b99d:235d:1cb2","fe80::f4af:cb28:5ee1:34bd","TCP","86","1750","437","0","55178  >  46514 [ACK] Seq=1750 Ack=437 Win=130944 Len=0 TSval=1164500645 TSecr=1598898370"
"29","0.944555842","fe80::18b6:b99d:235d:1cb2","fe80::f4af:cb28:5ee1:34bd","TLSv1.2","155","1750","437","69","Application Data"
"30","0.987669077","fe80::f4af:cb28:5ee1:34bd","fe80::18b6:b99d:235d:1cb2","TCP","86","437","1819","0","46514  >  55178 [ACK] Seq=437 Ack=1819 Win=64128 Len=0 TSval=1598898602 TSecr=1164500746"
"31","0.999924379","fe80::f4af:cb28:5ee1:34bd","fe80::18b6:b99d:235d:1cb2","TLSv1.2","171","437","1819","85","Application Data"
"32","1.003757438","fe80::18b6:b99d:235d:1cb2","fe80::f4af:cb28:5ee1:34bd","TCP","86","1819","522","0","55178  >  46514 [ACK] Seq=1819 Ack=522 Win=130944 Len=0 TSval=1164500889 TSecr=1598898614"
"33","1.018835810","fe80::18b6:b99d:235d:1cb2","fe80::f4af:cb28:5ee1:34bd","TLSv1.2","187","1819","522","101","Application Data"
"34","1.018861651","fe80::f4af:cb28:5ee1:34bd","fe80::18b6:b99d:235d:1cb2","TCP","86","522","1920","0","46514  >  55178 [ACK] Seq=522 Ack=1920 Win=64128 Len=0 TSval=1598898633 TSecr=1164500903"
"35","1.023865188","fe80::f4af:cb28:5ee1:34bd","fe80::18b6:b99d:235d:1cb2","TLSv1.2","171","522","1920","85","Application Data"
"36","1.027788553","fe80::18b6:b99d:235d:1cb2","fe80::f4af:cb28:5ee1:34bd","TCP","86","1920","607","0","55178  >  46514 [ACK] Seq=1920 Ack=607 Win=130944 Len=0 TSval=1164500912 TSecr=1598898638"
"37","1.040366412","fe80::18b6:b99d:235d:1cb2","fe80::f4af:cb28:5ee1:34bd","TLSv1.2","251","1920","607","165","Application Data"
"38","1.087669082","fe80::f4af:cb28:5ee1:34bd","fe80::18b6:b99d:235d:1cb2","TCP","86","607","2085","0","46514  >  55178 [ACK] Seq=607 Ack=2085 Win=64128 Len=0 TSval=1598898702 TSecr=1164500925"
"39","1.097604701","fe80::f4af:cb28:5ee1:34bd","fe80::18b6:b99d:235d:1cb2","TLSv1.2","171","607","2085","85","Application Data"
"40","1.100564737","fe80::18b6:b99d:235d:1cb2","fe80::f4af:cb28:5ee1:34bd","TCP","86","2085","692","0","55178  >  46514 [ACK] Seq=2085 Ack=692 Win=130944 Len=0 TSval=1164500985 TSecr=1598898712"
"41","1.109907688","fe80::18b6:b99d:235d:1cb2","fe80::f4af:cb28:5ee1:34bd","TLSv1.2","171","2085","692","85","Application Data"
"42","1.110084959","fe80::f4af:cb28:5ee1:34bd","fe80::18b6:b99d:235d:1cb2","TCP","86","692","2170","0","46514  >  55178 [ACK] Seq=692 Ack=2170 Win=64128 Len=0 TSval=1598898724 TSecr=1164500994"
"43","1.281151604","fe80::f4af:cb28:5ee1:34bd","fe80::18b6:b99d:235d:1cb2","TCP","1514","692","2170","1428","46514  >  55178 [ACK] Seq=692 Ack=2170 Win=64128 Len=1428 TSval=1598898895 TSecr=1164500994 [TCP segment of a reassembled PDU]"
"44","1.281165855","fe80::f4af:cb28:5ee1:34bd","fe80::18b6:b99d:235d:1cb2","TLSv1.2","183","2120","2170","97","Application Data"
"45","1.288496172","fe80::18b6:b99d:235d:1cb2","fe80::f4af:cb28:5ee1:34bd","TCP","86","2170","2217","0","55178  >  46514 [ACK] Seq=2170 Ack=2217 Win=129536 Len=0 TSval=1164501173 TSecr=1598898895"
"46","1.352280924","fe80::18b6:b99d:235d:1cb2","fe80::f4af:cb28:5ee1:34bd","TLSv1.2","187","2170","2217","101","Application Data"
"47","1.352452280","fe80::f4af:cb28:5ee1:34bd","fe80::18b6:b99d:235d:1cb2","TCP","86","2217","2271","0","46514  >  55178 [ACK] Seq=2217 Ack=2271 Win=64128 Len=0 TSval=1598898966 TSecr=1164501237"
"48","1.424074328","fe80::f4af:cb28:5ee1:34bd","fe80::18b6:b99d:235d:1cb2","TLSv1.2","459","2217","2271","373","Application Data"
"49","1.428309375","fe80::18b6:b99d:235d:1cb2","fe80::f4af:cb28:5ee1:34bd","TCP","86","2271","2590","0","55178  >  46514 [ACK] Seq=2271 Ack=2590 Win=130688 Len=0 TSval=1164501313 TSecr=1598899038"
"50","1.457984608","fe80::18b6:b99d:235d:1cb2","fe80::f4af:cb28:5ee1:34bd","TLSv1.2","171","2271","2590","85","Application Data"
"51","1.458012751","fe80::f4af:cb28:5ee1:34bd","fe80::18b6:b99d:235d:1cb2","TCP","86","2590","2356","0","46514  >  55178 [ACK] Seq=2590 Ack=2356 Win=64128 Len=0 TSval=1598899072 TSecr=1164501342"
"52","1.463332760","fe80::f4af:cb28:5ee1:34bd","fe80::18b6:b99d:235d:1cb2","TLSv1.2","187","2590","2356","101","Application Data"
"53","1.466718533","fe80::18b6:b99d:235d:1cb2","fe80::f4af:cb28:5ee1:34bd","TCP","86","2356","2691","0","55178  >  46514 [ACK] Seq=2356 Ack=2691 Win=130944 Len=0 TSval=1164501351 TSecr=1598899077"
"54","1.503247520","fe80::18b6:b99d:235d:1cb2","fe80::f4af:cb28:5ee1:34bd","TLSv1.2","491","2356","2691","405","Application Data"
"55","1.543667355","fe80::f4af:cb28:5ee1:34bd","fe80::18b6:b99d:235d:1cb2","TCP","86","2691","2761","0","46514  >  55178 [ACK] Seq=2691 Ack=2761 Win=64128 Len=0 TSval=1598899158 TSecr=1164501378"
"56","1.558807398","fe80::f4af:cb28:5ee1:34bd","fe80::18b6:b99d:235d:1cb2","TLSv1.2","171","2691","2761","85","Application Data"
"57","1.562402015","fe80::18b6:b99d:235d:1cb2","fe80::f4af:cb28:5ee1:34bd","TCP","86","2761","2776","0","55178  >  46514 [ACK] Seq=2761 Ack=2776 Win=130944 Len=0 TSval=1164501447 TSecr=1598899173"
"58","1.576028049","fe80::18b6:b99d:235d:1cb2","fe80::f4af:cb28:5ee1:34bd","TLSv1.2","171","2761","2776","85","Application Data"
"59","1.576104830","fe80::f4af:cb28:5ee1:34bd","fe80::18b6:b99d:235d:1cb2","TCP","86","2776","2846","0","46514  >  55178 [ACK] Seq=2776 Ack=2846 Win=64128 Len=0 TSval=1598899190 TSecr=1164501460"
"60","1.579489656","fe80::f4af:cb28:5ee1:34bd","fe80::18b6:b99d:235d:1cb2","TLSv1.2","171","2776","2846","85","Application Data"
"61","1.582711827","fe80::18b6:b99d:235d:1cb2","fe80::f4af:cb28:5ee1:34bd","TCP","86","2846","2861","0","55178  >  46514 [ACK] Seq=2846 Ack=2861 Win=130944 Len=0 TSval=1164501467 TSecr=1598899194"
"62","1.592824421","fe80::18b6:b99d:235d:1cb2","fe80::f4af:cb28:5ee1:34bd","TLSv1.2","203","2846","2861","117","Application Data"
"63","1.635660323","fe80::f4af:cb28:5ee1:34bd","fe80::18b6:b99d:235d:1cb2","TCP","86","2861","2963","0","46514  >  55178 [ACK] Seq=2861 Ack=2963 Win=64128 Len=0 TSval=1598899250 TSecr=1164501477"
"64","3.599183793","fe80::f4af:cb28:5ee1:34bd","fe80::18b6:b99d:235d:1cb2","TLSv1.2","171","2861","2963","85","Application Data"
"65","3.812599749","fe80::18b6:b99d:235d:1cb2","fe80::f4af:cb28:5ee1:34bd","TCP","86","2963","2946","0","55178  >  46514 [ACK] Seq=2963 Ack=2946 Win=130944 Len=0 TSval=1164503599 TSecr=1598901213"
"66","3.812615906","fe80::18b6:b99d:235d:1cb2","fe80::f4af:cb28:5ee1:34bd","TLSv1.2","203","2963","2946","117","Application Data"
"67","3.812628803","fe80::f4af:cb28:5ee1:34bd","fe80::18b6:b99d:235d:1cb2","TCP","86","2946","3080","0","46514  >  55178 [ACK] Seq=2946 Ack=3080 Win=64128 Len=0 TSval=1598901426 TSecr=1164503610"
"70","5.818747779","fe80::f4af:cb28:5ee1:34bd","fe80::18b6:b99d:235d:1cb2","TLSv1.2","171","2946","3080","85","Application Data"
"71","5.864267894","fe80::18b6:b99d:235d:1cb2","fe80::f4af:cb28:5ee1:34bd","TCP","86","3080","3031","0","55178  >  46514 [ACK] Seq=3080 Ack=3031 Win=130944 Len=0 TSval=1164505748 TSecr=1598903432"
"72","5.874998894","fe80::18b6:b99d:235d:1cb2","fe80::f4af:cb28:5ee1:34bd","TLSv1.2","203","3080","3031","117","Application Data"
"73","5.875021516","fe80::f4af:cb28:5ee1:34bd","fe80::18b6:b99d:235d:1cb2","TCP","86","3031","3197","0","46514  >  55178 [ACK] Seq=3031 Ack=3197 Win=64128 Len=0 TSval=1598903489 TSecr=1164505759"
"76","7.881057205","fe80::f4af:cb28:5ee1:34bd","fe80::18b6:b99d:235d:1cb2","TLSv1.2","171","3031","3197","85","Application Data"
"77","7.885565611","fe80::18b6:b99d:235d:1cb2","fe80::f4af:cb28:5ee1:34bd","TCP","86","3197","3116","0","55178  >  46514 [ACK] Seq=3197 Ack=3116 Win=130944 Len=0 TSval=1164507770 TSecr=1598905494"
"78","7.905999043","fe80::18b6:b99d:235d:1cb2","fe80::f4af:cb28:5ee1:34bd","TLSv1.2","203","3197","3116","117","Application Data"
"79","7.906019059","fe80::f4af:cb28:5ee1:34bd","fe80::18b6:b99d:235d:1cb2","TCP","86","3116","3314","0","46514  >  55178 [ACK] Seq=3116 Ack=3314 Win=64128 Len=0 TSval=1598905519 TSecr=1164507781"
"91","9.911335241","fe80::f4af:cb28:5ee1:34bd","fe80::18b6:b99d:235d:1cb2","TLSv1.2","171","3116","3314","85","Application Data"
"92","10.075715937","fe80::18b6:b99d:235d:1cb2","fe80::f4af:cb28:5ee1:34bd","TCP","86","3314","3201","0","55178  >  46514 [ACK] Seq=3314 Ack=3201 Win=131072 Len=0 TSval=1164509851 TSecr=1598907525"
"93","10.075731004","fe80::18b6:b99d:235d:1cb2","fe80::f4af:cb28:5ee1:34bd","TLSv1.2","203","3314","3201","117","Application Data"
"94","10.075743414","fe80::f4af:cb28:5ee1:34bd","fe80::18b6:b99d:235d:1cb2","TCP","86","3201","3431","0","46514  >  55178 [ACK] Seq=3201 Ack=3431 Win=64128 Len=0 TSval=1598907689 TSecr=1164509862"
"95","12.081613991","fe80::f4af:cb28:5ee1:34bd","fe80::18b6:b99d:235d:1cb2","TLSv1.2","171","3201","3431","85","Application Data"
"96","12.115813910","fe80::18b6:b99d:235d:1cb2","fe80::f4af:cb28:5ee1:34bd","TCP","86","3431","3286","0","55178  >  46514 [ACK] Seq=3431 Ack=3286 Win=131072 Len=0 TSval=1164511997 TSecr=1598909695"
"97","12.124275016","fe80::18b6:b99d:235d:1cb2","fe80::f4af:cb28:5ee1:34bd","TLSv1.2","203","3431","3286","117","Application Data"
"98","12.124297170","fe80::f4af:cb28:5ee1:34bd","fe80::18b6:b99d:235d:1cb2","TCP","86","3286","3548","0","46514  >  55178 [ACK] Seq=3286 Ack=3548 Win=64128 Len=0 TSval=1598909737 TSecr=1164512007"
"99","12.128514924","fe80::f4af:cb28:5ee1:34bd","fe80::18b6:b99d:235d:1cb2","TLSv1.2","171","3286","3548","85","Application Data"
"100","12.133242824","fe80::18b6:b99d:235d:1cb2","fe80::f4af:cb28:5ee1:34bd","TCP","86","3548","3371","0","55178  >  46514 [ACK] Seq=3548 Ack=3371 Win=131072 Len=0 TSval=1164512017 TSecr=1598909741"
"101","12.142932566","fe80::18b6:b99d:235d:1cb2","fe80::f4af:cb28:5ee1:34bd","TLSv1.2","171","3548","3371","85","Application Data"
"102","12.146858744","fe80::f4af:cb28:5ee1:34bd","fe80::18b6:b99d:235d:1cb2","TLSv1.2","171","3371","3633","85","Application Data"
"103","12.151423049","fe80::18b6:b99d:235d:1cb2","fe80::f4af:cb28:5ee1:34bd","TCP","86","3633","3456","0","55178  >  46514 [ACK] Seq=3633 Ack=3456 Win=130944 Len=0 TSval=1164512035 TSecr=1598909760"
"104","12.160505438","fe80::18b6:b99d:235d:1cb2","fe80::f4af:cb28:5ee1:34bd","TLSv1.2","171","3633","3456","85","Application Data"
"105","12.169117567","fe80::f4af:cb28:5ee1:34bd","fe80::18b6:b99d:235d:1cb2","TLSv1.2","155","3456","3718","69","Encrypted Alert"
"106","12.169168492","fe80::f4af:cb28:5ee1:34bd","fe80::18b6:b99d:235d:1cb2","TCP","86","3525","3718","0","46514  >  55178 [FIN, ACK] Seq=3525 Ack=3718 Win=64128 Len=0 TSval=1598909782 TSecr=1164512044"
"107","12.176441160","fe80::18b6:b99d:235d:1cb2","fe80::f4af:cb28:5ee1:34bd","TCP","86","3718","3525","0","55178  >  46514 [ACK] Seq=3718 Ack=3525 Win=130944 Len=0 TSval=1164512057 TSecr=1598909782"
"108","12.184298691","fe80::18b6:b99d:235d:1cb2","fe80::f4af:cb28:5ee1:34bd","TCP","86","3718","3526","0","55178  >  46514 [ACK] Seq=3718 Ack=3526 Win=130944 Len=0 TSval=1164512057 TSecr=1598909782"
"111","17.228297016","fe80::18b6:b99d:235d:1cb2","fe80::f4af:cb28:5ee1:34bd","TLSv1.2","155","3718","3526","69","Encrypted Alert"
"112","17.228313576","fe80::f4af:cb28:5ee1:34bd","fe80::18b6:b99d:235d:1cb2","TCP","74","3526","0","0","46514  >  55178 [RST] Seq=3526 Win=0 Len=0"
"113","17.228328934","fe80::18b6:b99d:235d:1cb2","fe80::f4af:cb28:5ee1:34bd","TCP","86","3787","3526","0","55178  >  46514 [FIN, ACK] Seq=3787 Ack=3526 Win=130944 Len=0 TSval=1164517052 TSecr=1598909782"
"114","17.228330958","fe80::f4af:cb28:5ee1:34bd","fe80::18b6:b99d:235d:1cb2","TCP","74","3526","0","0","46514  >  55178 [RST] Seq=3526 Win=0 Len=0"
"115","17.228333449","fe80::18b6:b99d:235d:1cb2","fe80::f4af:cb28:5ee1:34bd","TCP","74","3788","3526","0","55178  >  46514 [RST, ACK] Seq=3788 Ack=3526 Win=130944 Len=0"
"118","19.920449906","fe80::f4af:cb28:5ee1:34bd","ff02::1","UDP","72","","","","57227  >  15118 Len=10"
"119","20.001149880","fe80::18b6:b99d:235d:1cb2","fe80::f4af:cb28:5ee1:34bd","UDP","90","","","","15118  >  57227 Len=28"
"120","20.287897946","fe80::f4af:cb28:5ee1:34bd","fe80::18b6:b99d:235d:1cb2","TCP","94","0","0","0","46516  >  55178 [SYN] Seq=0 Win=64800 Len=0 MSS=1440 SACK_PERM=1 TSval=1598917900 TSecr=0 WS=128"
"121","20.505329584","fe80::18b6:b99d:235d:1cb2","fe80::f4af:cb28:5ee1:34bd","TCP","98","0","1","0","55178  >  46516 [SYN, ACK] Seq=0 Ack=1 Win=65535 Len=0 MSS=1440 WS=64 TSval=90705186 TSecr=1598917900 SACK_PERM=1"
"122","20.505359539","fe80::f4af:cb28:5ee1:34bd","fe80::18b6:b99d:235d:1cb2","TCP","86","1","1","0","46516  >  55178 [ACK] Seq=1 Ack=1 Win=64896 Len=0 TSval=1598918118 TSecr=90705186"
"123","20.508813305","fe80::18b6:b99d:235d:1cb2","fe80::f4af:cb28:5ee1:34bd","TCP","86","1","1","0","[TCP Window Update] 55178  >  46516 [ACK] Seq=1 Ack=1 Win=131328 Len=0 TSval=90705282 TSecr=1598918118"
"124","20.523978551","fe80::f4af:cb28:5ee1:34bd","fe80::18b6:b99d:235d:1cb2","TLSv1.2","288","1","1","202","Client Hello"
"125","20.528805316","fe80::18b6:b99d:235d:1cb2","fe80::f4af:cb28:5ee1:34bd","TCP","86","1","203","0","55178  >  46516 [ACK] Seq=1 Ack=203 Win=131136 Len=0 TSval=90705303 TSecr=1598918136"
"126","20.546717765","fe80::18b6:b99d:235d:1cb2","fe80::f4af:cb28:5ee1:34bd","TLSv1.2","176","1","203","90","Server Hello"
"127","20.546731311","fe80::f4af:cb28:5ee1:34bd","fe80::18b6:b99d:235d:1cb2","TCP","86","203","91","0","46516  >  55178 [ACK] Seq=203 Ack=91 Win=64896 Len=0 TSval=1598918159 TSecr=90705320"
"128","20.546778818","fe80::18b6:b99d:235d:1cb2","fe80::f4af:cb28:5ee1:34bd","TCP","1514","91","203","1428","55178  >  46516 [ACK] Seq=91 Ack=203 Win=131136 Len=1428 TSval=90705320 TSecr=1598918136 [TCP segment of a reassembled PDU]"
"129","20.546782327","fe80::f4af:cb28:5ee1:34bd","fe80::18b6:b99d:235d:1cb2","TCP","86","203","1519","0","46516  >  55178 [ACK] Seq=203 Ack=1519 Win=63488 Len=0 TSval=1598918159 TSecr=90705320"
"130","20.546932841","fe80::18b6:b99d:235d:1cb2","fe80::f4af:cb28:5ee1:34bd","TLSv1.2","96","1519","203","10","Certificate"
"131","20.546935045","fe80::f4af:cb28:5ee1:34bd","fe80::18b6:b99d:235d:1cb2","TCP","86","203","1529","0","46516  >  55178 [ACK] Seq=203 Ack=1529 Win=63488 Len=0 TSval=1598918159 TSecr=90705320"
"132","20.554679055","fe80::18b6:b99d:235d:1cb2","fe80::f4af:cb28:5ee1:34bd","TLSv1.2","216","1529","203","130","Server Key Exchange, Server Hello Done"
"133","20.554698281","fe80::f4af:cb28:5ee1:34bd","fe80::18b6:b99d:235d:1cb2","TCP","86","203","1659","0","46516  >  55178 [ACK] Seq=203 Ack=1659 Win=63360 Len=0 TSval=1598918167 TSecr=90705328"
"134","20.577479580","fe80::f4af:cb28:5ee1:34bd","fe80::18b6:b99d:235d:1cb2","TLSv1.2","128","203","1659","42","Client Key Exchange"
"135","20.580779947","fe80::18b6:b99d:235d:1cb2","fe80::f4af:cb28:5ee1:34bd","TCP","86","1659","245","0","55178  >  46516 [ACK] Seq=1659 Ack=245 Win=131072 Len=0 TSval=90705355 TSecr=1598918190"
"136","20.583037297","fe80::f4af:cb28:5ee1:34bd","fe80::18b6:b99d:235d:1cb2","TLSv1.2","92","245","1659","6","Change Cipher Spec"
"137","20.585674314","fe80::18b6:b99d:235d:1cb2","fe80::f4af:cb28:5ee1:34bd","TCP","86","1659","251","0","55178  >  46516 [ACK] Seq=1659 Ack=251 Win=131072 Len=0 TSval=90705360 TSecr=1598918195"
"138","20.585686149","fe80::f4af:cb28:5ee1:34bd","fe80::18b6:b99d:235d:1cb2","TLSv1.2","171","251","1659","85","Encrypted Handshake Message"
"139","20.588613762","fe80::18b6:b99d:235d:1cb2","fe80::f4af:cb28:5ee1:34bd","TCP","86","1659","336","0","55178  >  46516 [ACK] Seq=1659 Ack=336 Win=131008 Len=0 TSval=90705363 TSecr=1598918198"
"140","20.589417389","fe80::18b6:b99d:235d:1cb2","fe80::f4af:cb28:5ee1:34bd","TLSv1.2","92","1659","336","6","Change Cipher Spec"
"141","20.648174841","fe80::f4af:cb28:5ee1:34bd","fe80::18b6:b99d:235d:1cb2","TCP","86","336","1665","0","46516  >  55178 [ACK] Seq=336 Ack=1665 Win=64128 Len=0 TSval=1598918260 TSecr=90705363"
"142","20.652142230","fe80::18b6:b99d:235d:1cb2","fe80::f4af:cb28:5ee1:34bd","TLSv1.2","171","1665","336","85","Encrypted Handshake Message"
"143","20.652157908","fe80::f4af:cb28:5ee1:34bd","fe80::18b6:b99d:235d:1cb2","TCP","86","336","1750","0","46516  >  55178 [ACK] Seq=336 Ack=1750 Win=64128 Len=0 TSval=1598918264 TSecr=90705425"
"144","20.679264855","fe80::f4af:cb28:5ee1:34bd","fe80::18b6:b99d:235d:1cb2","TLSv1.2","187","336","1750","101","Application Data"
"145","20.683208227","fe80::18b6:b99d:235d:1cb2","fe80::f4af:cb28:5ee1:34bd","TCP","86","1750","437","0","55178  >  46516 [ACK] Seq=1750 Ack=437 Win=130944 Len=0 TSval=90705457 TSecr=1598918291"
"146","20.706884688","fe80::18b6:b99d:235d:1cb2","fe80::f4af:cb28:5ee1:34bd","TLSv1.2","155","1750","437","69","Application Data"
"147","20.747678956","fe80::f4af:cb28:5ee1:34bd","fe80::18b6:b99d:235d:1cb2","TCP","86","437","1819","0","46516  >  55178 [ACK] Seq=437 Ack=1819 Win=64128 Len=0 TSval=1598918360 TSecr=90705470"
"148","20.769312901","fe80::f4af:cb28:5ee1:34bd","fe80::18b6:b99d:235d:1cb2","TLSv1.2","171","437","1819","85","Application Data"
"149","20.773213877","fe80::18b6:b99d:235d:1cb2","fe80::f4af:cb28:5ee1:34bd","TCP","86","1819","522","0","55178  >  46516 [ACK] Seq=1819 Ack=522 Win=130944 Len=0 TSval=90705547 TSecr=1598918381"
"150","20.783424582","fe80::18b6:b99d:235d:1cb2","fe80::f4af:cb28:5ee1:34bd","TLSv1.2","187","1819","522","101","Application Data"
"151","20.783441746","fe80::f4af:cb28:5ee1:34bd","fe80::18b6:b99d:235d:1cb2","TCP","86","522","1920","0","46516  >  55178 [ACK] Seq=522 Ack=1920 Win=64128 Len=0 TSval=1598918396 TSecr=90705557"
"152","20.789861392","fe80::f4af:cb28:5ee1:34bd","fe80::18b6:b99d:235d:1cb2","TLSv1.2","171","522","1920","85","Application Data"
"153","20.792712151","fe80::18b6:b99d:235d:1cb2","fe80::f4af:cb28:5ee1:34bd","TCP","86","1920","607","0","55178  >  46516 [ACK] Seq=1920 Ack=607 Win=130944 Len=0 TSval=90705566 TSecr=1598918402"
"154","20.802413350","fe80::18b6:b99d:235d:1cb2","fe80::f4af:cb28:5ee1:34bd","TLSv1.2","251","1920","607","165","Application Data"
"155","20.843707916","fe80::f4af:cb28:5ee1:34bd","fe80::18b6:b99d:235d:1cb2","TCP","86","607","2085","0","46516  >  55178 [ACK] Seq=607 Ack=2085 Win=64128 Len=0 TSval=1598918456 TSecr=90705576"
"156","20.852672142","fe80::f4af:cb28:5ee1:34bd","fe80::18b6:b99d:235d:1cb2","TLSv1.2","171","607","2085","85","Application Data"
"157","20.855858879","fe80::18b6:b99d:235d:1cb2","fe80::f4af:cb28:5ee1:34bd","TCP","86","2085","692","0","55178  >  46516 [ACK] Seq=2085 Ack=692 Win=130944 Len=0 TSval=90705629 TSecr=1598918465"
"158","20.865365461","fe80::18b6:b99d:235d:1cb2","fe80::f4af:cb28:5ee1:34bd","TLSv1.2","171","2085","692","85","Application Data"
"159","20.865478750","fe80::f4af:cb28:5ee1:34bd","fe80::18b6:b99d:235d:1cb2","TCP","86","692","2170","0","46516  >  55178 [ACK] Seq=692 Ack=2170 Win=64128 Len=0 TSval=1598918478 TSecr=90705639"
"160","20.989880543","fe80::f4af:cb28:5ee1:34bd","fe80::18b6:b99d:235d:1cb2","TCP","1514","692","2170","1428","46516  >  55178 [ACK] Seq=692 Ack=2170 Win=64128 Len=1428 TSval=1598918602 TSecr=90705639 [TCP segment of a reassembled PDU]"
"161","20.989893687","fe80::f4af:cb28:5ee1:34bd","fe80::18b6:b99d:235d:1cb2","TLSv1.2","183","2120","2170","97","Application Data"
"162","21.000382621","fe80::18b6:b99d:235d:1cb2","fe80::f4af:cb28:5ee1:34bd","TCP","86","2170","2217","0","55178  >  46516 [ACK] Seq=2170 Ack=2217 Win=129536 Len=0 TSval=90705773 TSecr=1598918602"
"163","21.041432968","fe80::18b6:b99d:235d:1cb2","fe80::f4af:cb28:5ee1:34bd","TLSv1.2","187","2170","2217","101","Application Data"
"164","21.041556043","fe80::f4af:cb28:5ee1:34bd","fe80::18b6:b99d:235d:1cb2","TCP","86","2217","2271","0","46516  >  55178 [ACK] Seq=2217 Ack=2271 Win=64128 Len=0 TSval=1598918654 TSecr=90705813"
"165","21.105604121","fe80::f4af:cb28:5ee1:34bd","fe80::18b6:b99d:235d:1cb2","TLSv1.2","459","2217","2271","373","Application Data"
"166","21.111244375","fe80::18b6:b99d:235d:1cb2","fe80::f4af:cb28:5ee1:34bd","TCP","86","2271","2590","0","55178  >  46516 [ACK] Seq=2271 Ack=2590 Win=130688 Len=0 TSval=90705883 TSecr=1598918718"
"167","21.131921145","fe80::18b6:b99d:235d:1cb2","fe80::f4af:cb28:5ee1:34bd","TLSv1.2","171","2271","2590","85","Application Data"
"168","21.132003259","fe80::f4af:cb28:5ee1:34bd","fe80::18b6:b99d:235d:1cb2","TCP","86","2590","2356","0","46516  >  55178 [ACK] Seq=2590 Ack=2356 Win=64128 Len=0 TSval=1598918744 TSecr=90705903"
"169","21.136976707","fe80::f4af:cb28:5ee1:34bd","fe80::18b6:b99d:235d:1cb2","TLSv1.2","187","2590","2356","101","Application Data"
"170","21.142690307","fe80::18b6:b99d:235d:1cb2","fe80::f4af:cb28:5ee1:34bd","TCP","86","2356","2691","0","55178  >  46516 [ACK] Seq=2356 Ack=2691 Win=130944 Len=0 TSval=90705915 TSecr=1598918749"
"171","21.167818381","fe80::18b6:b99d:235d:1cb2","fe80::f4af:cb28:5ee1:34bd","TLSv1.2","491","2356","2691","405","Application Data"
"172","21.218918126","fe80::f4af:cb28:5ee1:34bd","fe80::18b6:b99d:235d:1cb2","TLSv1.2","171","2691","2761","85","Application Data"
"173","21.223134041","fe80::18b6:b99d:235d:1cb2","fe80::f4af:cb28:5ee1:34bd","TCP","86","2761","2776","0","55178  >  46516 [ACK] Seq=2761 Ack=2776 Win=130944 Len=0 TSval=90705995 TSecr=1598918831"
"174","21.232372517","fe80::18b6:b99d:235d:1cb2","fe80::f4af:cb28:5ee1:34bd","TLSv1.2","171","2761","2776","85","Application Data"
"175","21.236329277","fe80::f4af:cb28:5ee1:34bd","fe80::18b6:b99d:235d:1cb2","TLSv1.2","171","2776","2846","85","Application Data"
"176","21.240013026","fe80::18b6:b99d:235d:1cb2","fe80::f4af:cb28:5ee1:34bd","TCP","86","2846","2861","0","55178  >  46516 [ACK] Seq=2846 Ack=2861 Win=130944 Len=0 TSval=90706013 TSecr=1598918848"
"177","21.249049429","fe80::18b6:b99d:235d:1cb2","fe80::f4af:cb28:5ee1:34bd","TLSv1.2","203","2846","2861","117","Application Data"
"178","21.295769991","fe80::f4af:cb28:5ee1:34bd","fe80::18b6:b99d:235d:1cb2","TCP","86","2861","2963","0","46516  >  55178 [ACK] Seq=2861 Ack=2963 Win=64128 Len=0 TSval=1598918908 TSecr=90706019"
"179","23.256115560","fe80::f4af:cb28:5ee1:34bd","fe80::18b6:b99d:235d:1cb2","TLSv1.2","171","2861","2963","85","Application Data"
"180","23.267879164","fe80::18b6:b99d:235d:1cb2","fe80::f4af:cb28:5ee1:34bd","TCP","86","2963","2946","0","55178  >  46516 [ACK] Seq=2963 Ack=2946 Win=130944 Len=0 TSval=90708035 TSecr=1598920868"
"181","23.278889893","fe80::18b6:b99d:235d:1cb2","fe80::f4af:cb28:5ee1:34bd","TLSv1.2","203","2963","2946","117","Application Data"
"182","23.278912855","fe80::f4af:cb28:5ee1:34bd","fe80::18b6:b99d:235d:1cb2","TCP","86","2946","3080","0","46516  >  55178 [ACK] Seq=2946 Ack=3080 Win=64128 Len=0 TSval=1598920891 TSecr=90708044"
"187","25.285254924","fe80::f4af:cb28:5ee1:34bd","fe80::18b6:b99d:235d:1cb2","TLSv1.2","171","2946","3080","85","Application Data"
"188","25.322384148","fe80::18b6:b99d:235d:1cb2","fe80::f4af:cb28:5ee1:34bd","TCP","86","3080","3031","0","55178  >  46516 [ACK] Seq=3080 Ack=3031 Win=130944 Len=0 TSval=90710095 TSecr=1598922897"
"189","25.330872200","fe80::18b6:b99d:235d:1cb2","fe80::f4af:cb28:5ee1:34bd","TLSv1.2","203","3080","3031","117","Application Data"
"190","25.330893947","fe80::f4af:cb28:5ee1:34bd","fe80::18b6:b99d:235d:1cb2","TCP","86","3031","3197","0","46516  >  55178 [ACK] Seq=3031 Ack=3197 Win=64128 Len=0 TSval=1598922943 TSecr=90710104"
"191","27.336473514","fe80::f4af:cb28:5ee1:34bd","fe80::18b6:b99d:235d:1cb2","TLSv1.2","171","3031","3197","85","Application Data"
"192","27.378383681","fe80::18b6:b99d:235d:1cb2","fe80::f4af:cb28:5ee1:34bd","TCP","86","3197","3116","0","55178  >  46516 [ACK] Seq=3197 Ack=3116 Win=130944 Len=0 TSval=90712151 TSecr=1598924948"
"193","27.386873627","fe80::18b6:b99d:235d:1cb2","fe80::f4af:cb28:5ee1:34bd","TLSv1.2","203","3197","3116","117","Application Data"
"194","27.386895803","fe80::f4af:cb28:5ee1:34bd","fe80::18b6:b99d:235d:1cb2","TCP","86","3116","3314","0","46516  >  55178 [ACK] Seq=3116 Ack=3314 Win=64128 Len=0 TSval=1598924998 TSecr=90712159"
"222","29.392335268","fe80::f4af:cb28:5ee1:34bd","fe80::18b6:b99d:235d:1cb2","TLSv1.2","171","3116","3314","85","Application Data"
"223","29.418907851","fe80::18b6:b99d:235d:1cb2","fe80::f4af:cb28:5ee1:34bd","TCP","86","3314","3201","0","55178  >  46516 [ACK] Seq=3314 Ack=3201 Win=131072 Len=0 TSval=90714191 TSecr=1598927004"
"224","29.427140489","fe80::18b6:b99d:235d:1cb2","fe80::f4af:cb28:5ee1:34bd","TLSv1.2","203","3314","3201","117","Application Data"
"225","29.427162529","fe80::f4af:cb28:5ee1:34bd","fe80::18b6:b99d:235d:1cb2","TCP","86","3201","3431","0","46516  >  55178 [ACK] Seq=3201 Ack=3431 Win=64128 Len=0 TSval=1598927038 TSecr=90714199"
"228","31.433120973","fe80::f4af:cb28:5ee1:34bd","fe80::18b6:b99d:235d:1cb2","TLSv1.2","171","3201","3431","85","Application Data"
"229","31.466872140","fe80::18b6:b99d:235d:1cb2","fe80::f4af:cb28:5ee1:34bd","TCP","86","3431","3286","0","55178  >  46516 [ACK] Seq=3431 Ack=3286 Win=131072 Len=0 TSval=90716239 TSecr=1598929044"
"230","31.475272738","fe80::18b6:b99d:235d:1cb2","fe80::f4af:cb28:5ee1:34bd","TLSv1.2","203","3431","3286","117","Application Data"
"231","31.475295791","fe80::f4af:cb28:5ee1:34bd","fe80::18b6:b99d:235d:1cb2","TCP","86","3286","3548","0","46516  >  55178 [ACK] Seq=3286 Ack=3548 Win=64128 Len=0 TSval=1598929086 TSecr=90716247"
"232","31.479416810","fe80::f4af:cb28:5ee1:34bd","fe80::18b6:b99d:235d:1cb2","TLSv1.2","171","3286","3548","85","Application Data"
"233","31.482016664","fe80::18b6:b99d:235d:1cb2","fe80::f4af:cb28:5ee1:34bd","TCP","86","3548","3371","0","55178  >  46516 [ACK] Seq=3548 Ack=3371 Win=131072 Len=0 TSval=90716255 TSecr=1598929090"
"234","31.486609007","fe80::18b6:b99d:235d:1cb2","fe80::f4af:cb28:5ee1:34bd","TLSv1.2","171","3548","3371","85","Application Data"
"235","31.490653695","fe80::f4af:cb28:5ee1:34bd","fe80::18b6:b99d:235d:1cb2","TLSv1.2","171","3371","3633","85","Application Data"
"236","31.493142802","fe80::18b6:b99d:235d:1cb2","fe80::f4af:cb28:5ee1:34bd","TCP","86","3633","3456","0","55178  >  46516 [ACK] Seq=3633 Ack=3456 Win=130944 Len=0 TSval=90716266 TSecr=1598929102"
"237","31.497602744","fe80::18b6:b99d:235d:1cb2","fe80::f4af:cb28:5ee1:34bd","TLSv1.2","171","3633","3456","85","Application Data"
"238","31.506759840","fe80::f4af:cb28:5ee1:34bd","fe80::18b6:b99d:235d:1cb2","TLSv1.2","155","3456","3718","69","Encrypted Alert"
"239","31.506808952","fe80::f4af:cb28:5ee1:34bd","fe80::18b6:b99d:235d:1cb2","TCP","86","3525","3718","0","46516  >  55178 [FIN, ACK] Seq=3525 Ack=3718 Win=64128 Len=0 TSval=1598929118 TSecr=90716270"
"240","31.508896009","fe80::18b6:b99d:235d:1cb2","fe80::f4af:cb28:5ee1:34bd","TCP","86","3718","3525","0","55178  >  46516 [ACK] Seq=3718 Ack=3525 Win=130944 Len=0 TSval=90716282 TSecr=1598929118"
"241","31.509698181","fe80::18b6:b99d:235d:1cb2","fe80::f4af:cb28:5ee1:34bd","TCP","86","3718","3526","0","55178  >  46516 [ACK] Seq=3718 Ack=3526 Win=130944 Len=0 TSval=90716282 TSecr=1598929118"
"277","36.569027080","fe80::18b6:b99d:235d:1cb2","fe80::f4af:cb28:5ee1:34bd","TLSv1.2","155","3718","3526","69","Encrypted Alert"
"278","36.569042901","fe80::f4af:cb28:5ee1:34bd","fe80::18b6:b99d:235d:1cb2","TCP","74","3526","0","0","46516  >  55178 [RST] Seq=3526 Win=0 Len=0"
"279","36.569056731","fe80::18b6:b99d:235d:1cb2","fe80::f4af:cb28:5ee1:34bd","TCP","86","3787","3526","0","55178  >  46516 [FIN, ACK] Seq=3787 Ack=3526 Win=130944 Len=0 TSval=90721277 TSecr=1598929118"
"280","36.569058707","fe80::f4af:cb28:5ee1:34bd","fe80::18b6:b99d:235d:1cb2","TCP","74","3526","0","0","46516  >  55178 [RST] Seq=3526 Win=0 Len=0"
"281","36.569062454","fe80::18b6:b99d:235d:1cb2","fe80::f4af:cb28:5ee1:34bd","TCP","74","3788","3526","0","55178  >  46516 [RST, ACK] Seq=3788 Ack=3526 Win=130944 Len=0"
"315","39.247010700","fe80::f4af:cb28:5ee1:34bd","ff02::1","UDP","72","","","","52032  >  15118 Len=10"
"316","39.361962186","fe80::18b6:b99d:235d:1cb2","fe80::f4af:cb28:5ee1:34bd","UDP","90","","","","15118  >  52032 Len=28"
"317","39.650570149","fe80::f4af:cb28:5ee1:34bd","fe80::18b6:b99d:235d:1cb2","TCP","94","0","0","0","46518  >  55178 [SYN] Seq=0 Win=64800 Len=0 MSS=1440 SACK_PERM=1 TSval=1598937261 TSecr=0 WS=128"
"318","39.767479370","fe80::18b6:b99d:235d:1cb2","fe80::f4af:cb28:5ee1:34bd","TCP","98","0","1","0","55178  >  46518 [SYN, ACK] Seq=0 Ack=1 Win=65535 Len=0 MSS=1440 WS=64 TSval=1046817293 TSecr=1598937261 SACK_PERM=1"
"319","39.767506490","fe80::f4af:cb28:5ee1:34bd","fe80::18b6:b99d:235d:1cb2","TCP","86","1","1","0","46518  >  55178 [ACK] Seq=1 Ack=1 Win=64896 Len=0 TSval=1598937378 TSecr=1046817293"
"320","39.772284305","fe80::18b6:b99d:235d:1cb2","fe80::f4af:cb28:5ee1:34bd","TCP","86","1","1","0","[TCP Window Update] 55178  >  46518 [ACK] Seq=1 Ack=1 Win=131328 Len=0 TSval=1046817301 TSecr=1598937378"
"321","39.788650900","fe80::f4af:cb28:5ee1:34bd","fe80::18b6:b99d:235d:1cb2","TLSv1.2","288","1","1","202","Client Hello"
"322","39.793060093","fe80::18b6:b99d:235d:1cb2","fe80::f4af:cb28:5ee1:34bd","TCP","86","1","203","0","55178  >  46518 [ACK] Seq=1 Ack=203 Win=131136 Len=0 TSval=1046817322 TSecr=1598937399"
"323","39.799488416","fe80::18b6:b99d:235d:1cb2","fe80::f4af:cb28:5ee1:34bd","TLSv1.2","176","1","203","90","Server Hello"
"324","39.799509998","fe80::f4af:cb28:5ee1:34bd","fe80::18b6:b99d:235d:1cb2","TCP","86","203","91","0","46518  >  55178 [ACK] Seq=203 Ack=91 Win=64896 Len=0 TSval=1598937410 TSecr=1046817328"
"325","39.801147304","fe80::18b6:b99d:235d:1cb2","fe80::f4af:cb28:5ee1:34bd","TLSv1.2","1524","91","203","1438","Certificate"
"326","39.801157559","fe80::f4af:cb28:5ee1:34bd","fe80::18b6:b99d:235d:1cb2","TCP","86","203","1529","0","46518  >  55178 [ACK] Seq=203 Ack=1529 Win=63488 Len=0 TSval=1598937411 TSecr=1046817328"
"327","39.805492797","fe80::18b6:b99d:235d:1cb2","fe80::f4af:cb28:5ee1:34bd","TLSv1.2","214","1529","203","128","Server Key Exchange, Server Hello Done"
"328","39.805517400","fe80::f4af:cb28:5ee1:34bd","fe80::18b6:b99d:235d:1cb2","TCP","86","203","1657","0","46518  >  55178 [ACK] Seq=203 Ack=1657 Win=63360 Len=0 TSval=1598937416 TSecr=1046817334"
"329","39.831788109","fe80::f4af:cb28:5ee1:34bd","fe80::18b6:b99d:235d:1cb2","TLSv1.2","128","203","1657","42","Client Key Exchange"
"330","39.836421976","fe80::18b6:b99d:235d:1cb2","fe80::f4af:cb28:5ee1:34bd","TCP","86","1657","245","0","55178  >  46518 [ACK] Seq=1657 Ack=245 Win=131072 Len=0 TSval=1046817365 TSecr=1598937442"
"331","39.837580339","fe80::f4af:cb28:5ee1:34bd","fe80::18b6:b99d:235d:1cb2","TLSv1.2","92","245","1657","6","Change Cipher Spec"
"332","39.841591103","fe80::18b6:b99d:235d:1cb2","fe80::f4af:cb28:5ee1:34bd","TCP","86","1657","251","0","55178  >  46518 [ACK] Seq=1657 Ack=251 Win=131072 Len=0 TSval=1046817370 TSecr=1598937448"
"333","39.841601952","fe80::f4af:cb28:5ee1:34bd","fe80::18b6:b99d:235d:1cb2","TLSv1.2","171","251","1657","85","Encrypted Handshake Message"
"334","39.846131082","fe80::18b6:b99d:235d:1cb2","fe80::f4af:cb28:5ee1:34bd","TCP","86","1657","336","0","55178  >  46518 [ACK] Seq=1657 Ack=336 Win=131008 Len=0 TSval=1046817374 TSecr=1598937452"
"335","39.848079410","fe80::18b6:b99d:235d:1cb2","fe80::f4af:cb28:5ee1:34bd","TLSv1.2","92","1657","336","6","Change Cipher Spec"
"336","39.892371970","fe80::f4af:cb28:5ee1:34bd","fe80::18b6:b99d:235d:1cb2","TCP","86","336","1663","0","46518  >  55178 [ACK] Seq=336 Ack=1663 Win=64128 Len=0 TSval=1598937503 TSecr=1046817374"
"337","39.906674916","fe80::18b6:b99d:235d:1cb2","fe80::f4af:cb28:5ee1:34bd","TLSv1.2","171","1663","336","85","Encrypted Handshake Message"
"338","39.906696957","fe80::f4af:cb28:5ee1:34bd","fe80::18b6:b99d:235d:1cb2","TCP","86","336","1748","0","46518  >  55178 [ACK] Seq=336 Ack=1748 Win=64128 Len=0 TSval=1598937517 TSecr=1046817427"
"339","39.933854139","fe80::f4af:cb28:5ee1:34bd","fe80::18b6:b99d:235d:1cb2","TLSv1.2","187","336","1748","101","Application Data"
"340","39.939630041","fe80::18b6:b99d:235d:1cb2","fe80::f4af:cb28:5ee1:34bd","TCP","86","1748","437","0","55178  >  46518 [ACK] Seq=1748 Ack=437 Win=130944 Len=0 TSval=1046817467 TSecr=1598937544"
"341","39.949246826","fe80::18b6:b99d:235d:1cb2","fe80::f4af:cb28:5ee1:34bd","TLSv1.2","155","1748","437","69","Application Data"
"342","39.991684603","fe80::f4af:cb28:5ee1:34bd","fe80::18b6:b99d:235d:1cb2","TCP","86","437","1817","0","46518  >  55178 [ACK] Seq=437 Ack=1817 Win=64128 Len=0 TSval=1598937602 TSecr=1046817477"
"343","40.016932096","fe80::f4af:cb28:5ee1:34bd","fe80::18b6:b99d:235d:1cb2","TLSv1.2","171","437","1817","85","Application Data"
"344","40.021907166","fe80::18b6:b99d:235d:1cb2","fe80::f4af:cb28:5ee1:34bd","TCP","86","1817","522","0","55178  >  46518 [ACK] Seq=1817 Ack=522 Win=130944 Len=0 TSval=1046817550 TSecr=1598937627"
"345","40.030020624","fe80::18b6:b99d:235d:1cb2","fe80::f4af:cb28:5ee1:34bd","TLSv1.2","187","1817","522","101","Application Data"
"346","40.030040101","fe80::f4af:cb28:5ee1:34bd","fe80::18b6:b99d:235d:1cb2","TCP","86","522","1918","0","46518  >  55178 [ACK] Seq=522 Ack=1918 Win=64128 Len=0 TSval=1598937640 TSecr=1046817558"
"347","40.035389226","fe80::f4af:cb28:5ee1:34bd","fe80::18b6:b99d:235d:1cb2","TLSv1.2","171","522","1918","85","Application Data"
"348","40.041025138","fe80::18b6:b99d:235d:1cb2","fe80::f4af:cb28:5ee1:34bd","TCP","86","1918","607","0","55178  >  46518 [ACK] Seq=1918 Ack=607 Win=130944 Len=0 TSval=1046817569 TSecr=1598937646"
"349","40.049910087","fe80::18b6:b99d:235d:1cb2","fe80::f4af:cb28:5ee1:34bd","TLSv1.2","251","1918","607","165","Application Data"
"350","40.091719524","fe80::f4af:cb28:5ee1:34bd","fe80::18b6:b99d:235d:1cb2","TCP","86","607","2083","0","46518  >  55178 [ACK] Seq=607 Ack=2083 Win=64128 Len=0 TSval=1598937702 TSecr=1046817578"
"351","40.098672916","fe80::f4af:cb28:5ee1:34bd","fe80::18b6:b99d:235d:1cb2","TLSv1.2","171","607","2083","85","Application Data"
"352","40.104203971","fe80::18b6:b99d:235d:1cb2","fe80::f4af:cb28:5ee1:34bd","TCP","86","2083","692","0","55178  >  46518 [ACK] Seq=2083 Ack=692 Win=130944 Len=0 TSval=1046817632 TSecr=1598937709"
"353","40.113444227","fe80::18b6:b99d:235d:1cb2","fe80::f4af:cb28:5ee1:34bd","TLSv1.2","171","2083","692","85","Application Data"
"354","40.113466942","fe80::f4af:cb28:5ee1:34bd","fe80::18b6:b99d:235d:1cb2","TCP","86","692","2168","0","46518  >  55178 [ACK] Seq=692 Ack=2168 Win=64128 Len=0 TSval=1598937724 TSecr=1046817640"
"355","40.236965808","fe80::f4af:cb28:5ee1:34bd","fe80::18b6:b99d:235d:1cb2","TCP","1514","692","2168","1428","46518  >  55178 [ACK] Seq=692 Ack=2168 Win=64128 Len=1428 TSval=1598937847 TSecr=1046817640 [TCP segment of a reassembled PDU]"
"356","40.236981499","fe80::f4af:cb28:5ee1:34bd","fe80::18b6:b99d:235d:1cb2","TLSv1.2","183","2120","2168","97","Application Data"
"357","40.242653001","fe80::18b6:b99d:235d:1cb2","fe80::f4af:cb28:5ee1:34bd","TCP","86","2168","2217","0","55178  >  46518 [ACK] Seq=2168 Ack=2217 Win=129536 Len=0 TSval=1046817771 TSecr=1598937847"
"358","40.278546446","fe80::18b6:b99d:235d:1cb2","fe80::f4af:cb28:5ee1:34bd","TLSv1.2","187","2168","2217","101","Application Data"
"359","40.278857789","fe80::f4af:cb28:5ee1:34bd","fe80::18b6:b99d:235d:1cb2","TCP","86","2217","2269","0","46518  >  55178 [ACK] Seq=2217 Ack=2269 Win=64128 Len=0 TSval=1598937889 TSecr=1046817805"
"360","40.348406707","fe80::f4af:cb28:5ee1:34bd","fe80::18b6:b99d:235d:1cb2","TLSv1.2","459","2217","2269","373","Application Data"
"361","40.354075986","fe80::18b6:b99d:235d:1cb2","fe80::f4af:cb28:5ee1:34bd","TCP","86","2269","2590","0","55178  >  46518 [ACK] Seq=2269 Ack=2590 Win=130688 Len=0 TSval=1046817882 TSecr=1598937959"
"362","40.373492506","fe80::18b6:b99d:235d:1cb2","fe80::f4af:cb28:5ee1:34bd","TLSv1.2","171","2269","2590","85","Application Data"
