"No.","Time","Time Diff","Source","Destination","Protocol","Length","Sequence Number","Acknowledgment Number","Traffic Class","Info"
"1","0.000000000","0.000000000","fe80::f4af:cb28:5ee1:34bd","ff02::1","UDP","72","","","0x00","63145  >  15118 Len=10"
"2","0.251157148","0.251157148","fe80::f4af:cb28:5ee1:34bd","ff02::1","UDP","72","","","0x00","63145  >  15118 Len=10"
"3","0.258969159","0.007812011","fe80::18b6:b99d:235d:1cb2","fe80::f4af:cb28:5ee1:34bd","UDP","90","","","0x00","15118  >  63145 Len=28"
"4","0.425035970","0.166066811","fe80::18b6:b99d:235d:1cb2","fe80::f4af:cb28:5ee1:34bd","UDP","90","","","0x00","15118  >  63145 Len=28"
"5","0.554377339","0.129341369","fe80::f4af:cb28:5ee1:34bd","fe80::18b6:b99d:235d:1cb2","TCP","94","0","0","0x00","36612  >  58226 [SYN] Seq=0 Win=64800 Len=0 MSS=1440 SACK_PERM=1 TSval=911831554 TSecr=0 WS=128"
"6","0.608681217","0.054303878","fe80::18b6:b99d:235d:1cb2","fe80::f4af:cb28:5ee1:34bd","TCP","98","0","1","0x00","58226  >  36612 [SYN, ACK] Seq=0 Ack=1 Win=65535 Len=0 MSS=1440 WS=64 TSval=4198266404 TSecr=911831554 SACK_PERM=1"
"7","0.608706985","0.000025768","fe80::f4af:cb28:5ee1:34bd","fe80::18b6:b99d:235d:1cb2","TCP","86","1","1","0x00","36612  >  58226 [ACK] Seq=1 Ack=1 Win=64896 Len=0 TSval=911831608 TSecr=4198266404"
"8","0.629300896","0.020593911","fe80::f4af:cb28:5ee1:34bd","fe80::18b6:b99d:235d:1cb2","TLSv1.2","288","1","1","0x00","Client Hello"
"9","0.638331390","0.009030494","fe80::18b6:b99d:235d:1cb2","fe80::f4af:cb28:5ee1:34bd","TCP","86","1","1","0x00","[TCP Window Update] 58226  >  36612 [ACK] Seq=1 Ack=1 Win=131328 Len=0 TSval=4198266480 TSecr=911831608"
"10","0.638432294","0.000100904","fe80::18b6:b99d:235d:1cb2","fe80::f4af:cb28:5ee1:34bd","TCP","86","1","203","0x00","58226  >  36612 [ACK] Seq=1 Ack=203 Win=131136 Len=0 TSval=4198266480 TSecr=911831629"
"11","0.834009536","0.195577242","fe80::18b6:b99d:235d:1cb2","fe80::f4af:cb28:5ee1:34bd","TLSv1.2","176","1","203","0x00","Server Hello"
"12","0.834031422","0.000021886","fe80::f4af:cb28:5ee1:34bd","fe80::18b6:b99d:235d:1cb2","TCP","86","203","91","0x00","36612  >  58226 [ACK] Seq=203 Ack=91 Win=64896 Len=0 TSval=911831833 TSecr=4198266558"
"13","0.834044689","0.000013267","fe80::18b6:b99d:235d:1cb2","fe80::f4af:cb28:5ee1:34bd","TLSv1.2","1524","91","203","0x00","Certificate"
"14","0.834046855","0.000002166","fe80::f4af:cb28:5ee1:34bd","fe80::18b6:b99d:235d:1cb2","TCP","86","203","1529","0x00","36612  >  58226 [ACK] Seq=203 Ack=1529 Win=63488 Len=0 TSval=911831833 TSecr=4198266558"
"15","0.853484477","0.019437622","fe80::18b6:b99d:235d:1cb2","fe80::f4af:cb28:5ee1:34bd","TLSv1.2","214","1529","203","0x00","Server Key Exchange, Server Hello Done"
"16","0.853503019","0.000018542","fe80::f4af:cb28:5ee1:34bd","fe80::18b6:b99d:235d:1cb2","TCP","86","203","1657","0x00","36612  >  58226 [ACK] Seq=203 Ack=1657 Win=63360 Len=0 TSval=911831853 TSecr=4198266682"
"17","0.866266995","0.012763976","fe80::f4af:cb28:5ee1:34bd","fe80::18b6:b99d:235d:1cb2","TLSv1.2","128","203","1657","0x00","Client Key Exchange"
"18","0.939676711","0.073409716","fe80::18b6:b99d:235d:1cb2","fe80::f4af:cb28:5ee1:34bd","TCP","86","1657","245","0x00","58226  >  36612 [ACK] Seq=1657 Ack=245 Win=131072 Len=0 TSval=4198266771 TSecr=911831866"
"19","0.939696259","0.000019548","fe80::f4af:cb28:5ee1:34bd","fe80::18b6:b99d:235d:1cb2","TLSv1.2","177","245","1657","0x00","Change Cipher Spec, Encrypted Handshake Message"
"20","0.945256941","0.005560682","fe80::18b6:b99d:235d:1cb2","fe80::f4af:cb28:5ee1:34bd","TCP","86","1657","336","0x00","58226  >  36612 [ACK] Seq=1657 Ack=336 Win=131008 Len=0 TSval=4198266787 TSecr=911831939"
"21","1.005221501","0.059964560","fe80::18b6:b99d:235d:1cb2","fe80::f4af:cb28:5ee1:34bd","TLSv1.2","92","1657","336","0x00","Change Cipher Spec"
"22","1.052160768","0.046939267","fe80::f4af:cb28:5ee1:34bd","fe80::18b6:b99d:235d:1cb2","TCP","86","336","1663","0x00","36612  >  58226 [ACK] Seq=336 Ack=1663 Win=64128 Len=0 TSval=911832052 TSecr=4198266791"
"23","1.270434941","0.218274173","fe80::18b6:b99d:235d:1cb2","fe80::f4af:cb28:5ee1:34bd","TLSv1.2","171","1663","336","0x00","Encrypted Handshake Message"
"24","1.270455542","0.000020601","fe80::f4af:cb28:5ee1:34bd","fe80::18b6:b99d:235d:1cb2","TCP","86","336","1748","0x00","36612  >  58226 [ACK] Seq=336 Ack=1748 Win=64128 Len=0 TSval=911832270 TSecr=4198266958"
"25","1.297421069","0.026965527","fe80::f4af:cb28:5ee1:34bd","fe80::18b6:b99d:235d:1cb2","TLSv1.2","187","336","1748","0x00","Application Data"
"26","1.436988047","0.139566978","fe80::18b6:b99d:235d:1cb2","fe80::f4af:cb28:5ee1:34bd","TCP","86","1748","437","0x00","58226  >  36612 [ACK] Seq=1748 Ack=437 Win=130944 Len=0 TSval=4198267190 TSecr=911832297"
"27","1.460788538","0.023800491","fe80::18b6:b99d:235d:1cb2","fe80::f4af:cb28:5ee1:34bd","TLSv1.2","155","1748","437","0x00","Application Data"
"28","1.504084424","0.043295886","fe80::f4af:cb28:5ee1:34bd","fe80::18b6:b99d:235d:1cb2","TCP","86","437","1817","0x00","36612  >  58226 [ACK] Seq=437 Ack=1817 Win=64128 Len=0 TSval=911832503 TSecr=4198267293"
"29","1.523795689","0.019711265","fe80::f4af:cb28:5ee1:34bd","fe80::18b6:b99d:235d:1cb2","TLSv1.2","171","437","1817","0x00","Application Data"
"30","1.531202906","0.007407217","fe80::18b6:b99d:235d:1cb2","fe80::f4af:cb28:5ee1:34bd","TCP","86","1817","522","0x00","58226  >  36612 [ACK] Seq=1817 Ack=522 Win=130944 Len=0 TSval=4198267373 TSecr=911832523"
"31","1.547192134","0.015989228","fe80::18b6:b99d:235d:1cb2","fe80::f4af:cb28:5ee1:34bd","TLSv1.2","187","1817","522","0x00","Application Data"
"32","1.547212106","0.000019972","fe80::f4af:cb28:5ee1:34bd","fe80::18b6:b99d:235d:1cb2","TCP","86","522","1918","0x00","36612  >  58226 [ACK] Seq=522 Ack=1918 Win=64128 Len=0 TSval=911832547 TSecr=4198267379"
"33","1.554453255","0.007241149","fe80::f4af:cb28:5ee1:34bd","fe80::18b6:b99d:235d:1cb2","TLSv1.2","171","522","1918","0x00","Application Data"
"34","1.571689194","0.017235939","fe80::18b6:b99d:235d:1cb2","fe80::f4af:cb28:5ee1:34bd","TCP","86","1918","607","0x00","58226  >  36612 [ACK] Seq=1918 Ack=607 Win=130944 Len=0 TSval=4198267402 TSecr=911832554"
"35","1.579633968","0.007944774","fe80::18b6:b99d:235d:1cb2","fe80::f4af:cb28:5ee1:34bd","TLSv1.2","251","1918","607","0x00","Application Data"
"36","1.628112183","0.048478215","fe80::f4af:cb28:5ee1:34bd","fe80::18b6:b99d:235d:1cb2","TCP","86","607","2083","0x00","36612  >  58226 [ACK] Seq=607 Ack=2083 Win=64128 Len=0 TSval=911832628 TSecr=4198267409"
"37","1.634182947","0.006070764","fe80::f4af:cb28:5ee1:34bd","fe80::18b6:b99d:235d:1cb2","TLSv1.2","171","607","2083","0x00","Application Data"
"38","1.699057731","0.064874784","fe80::18b6:b99d:235d:1cb2","fe80::f4af:cb28:5ee1:34bd","TCP","86","2083","692","0x00","58226  >  36612 [ACK] Seq=2083 Ack=692 Win=130944 Len=0 TSval=4198267490 TSecr=911832634"
"39","1.713079765","0.014022034","fe80::18b6:b99d:235d:1cb2","fe80::f4af:cb28:5ee1:34bd","TLSv1.2","171","2083","692","0x00","Application Data"
"40","1.713140846","0.000061081","fe80::f4af:cb28:5ee1:34bd","fe80::18b6:b99d:235d:1cb2","TCP","86","692","2168","0x00","36612  >  58226 [ACK] Seq=692 Ack=2168 Win=64128 Len=0 TSval=911832713 TSecr=4198267503"
"41","1.837499733","0.124358887","fe80::f4af:cb28:5ee1:34bd","fe80::18b6:b99d:235d:1cb2","TCP","1514","692","2168","0x00","36612  >  58226 [ACK] Seq=692 Ack=2168 Win=64128 Len=1428 TSval=911832837 TSecr=4198267503 [TCP segment of a reassembled PDU]"
"42","1.837513208","0.000013475","fe80::f4af:cb28:5ee1:34bd","fe80::18b6:b99d:235d:1cb2","TLSv1.2","183","2120","2168","0x00","Application Data"
"45","1.926203128","0.088689920","fe80::18b6:b99d:235d:1cb2","fe80::f4af:cb28:5ee1:34bd","TCP","86","2168","2217","0x00","58226  >  36612 [ACK] Seq=2168 Ack=2217 Win=129536 Len=0 TSval=4198267739 TSecr=911832837"
"46","2.019489861","0.093286733","fe80::18b6:b99d:235d:1cb2","fe80::f4af:cb28:5ee1:34bd","TLSv1.2","187","2168","2217","0x00","Application Data"
"47","2.019510915","0.000021054","fe80::f4af:cb28:5ee1:34bd","fe80::18b6:b99d:235d:1cb2","TCP","86","2217","2269","0x00","36612  >  58226 [ACK] Seq=2217 Ack=2269 Win=64128 Len=0 TSval=911833019 TSecr=4198267801"
"48","2.090011324","0.070500409","fe80::f4af:cb28:5ee1:34bd","fe80::18b6:b99d:235d:1cb2","TLSv1.2","459","2217","2269","0x00","Application Data"
"49","2.151803578","0.061792254","fe80::18b6:b99d:235d:1cb2","fe80::f4af:cb28:5ee1:34bd","TCP","86","2269","2590","0x00","58226  >  36612 [ACK] Seq=2269 Ack=2590 Win=130688 Len=0 TSval=4198267936 TSecr=911833089"
"50","2.151849040","0.000045462","fe80::18b6:b99d:235d:1cb2","fe80::f4af:cb28:5ee1:34bd","TLSv1.2","171","2269","2590","0x00","Application Data"
"51","2.151860702","0.000011662","fe80::f4af:cb28:5ee1:34bd","fe80::18b6:b99d:235d:1cb2","TCP","86","2590","2354","0x00","36612  >  58226 [ACK] Seq=2590 Ack=2354 Win=64128 Len=0 TSval=911833151 TSecr=4198267963"
"52","2.158603180","0.006742478","fe80::f4af:cb28:5ee1:34bd","fe80::18b6:b99d:235d:1cb2","TLSv1.2","187","2590","2354","0x00","Application Data"
"53","2.189702076","0.031098896","fe80::18b6:b99d:235d:1cb2","fe80::f4af:cb28:5ee1:34bd","TCP","86","2354","2691","0x00","58226  >  36612 [ACK] Seq=2354 Ack=2691 Win=130944 Len=0 TSval=4198268025 TSecr=911833158"
"54","2.227603692","0.037901616","fe80::18b6:b99d:235d:1cb2","fe80::f4af:cb28:5ee1:34bd","TLSv1.2","491","2354","2691","0x00","Application Data"
"55","2.268106627","0.040502935","fe80::f4af:cb28:5ee1:34bd","fe80::18b6:b99d:235d:1cb2","TCP","86","2691","2759","0x00","36612  >  58226 [ACK] Seq=2691 Ack=2759 Win=64128 Len=0 TSval=911833268 TSecr=4198268064"
"56","2.281495860","0.013389233","fe80::f4af:cb28:5ee1:34bd","fe80::18b6:b99d:235d:1cb2","TLSv1.2","171","2691","2759","0x00","Application Data"
"57","2.312162331","0.030666471","fe80::18b6:b99d:235d:1cb2","fe80::f4af:cb28:5ee1:34bd","TCP","86","2759","2776","0x00","58226  >  36612 [ACK] Seq=2759 Ack=2776 Win=130944 Len=0 TSval=4198268136 TSecr=911833281"
"58","2.312225129","0.000062798","fe80::18b6:b99d:235d:1cb2","fe80::f4af:cb28:5ee1:34bd","TLSv1.2","171","2759","2776","0x00","Application Data"
"59","2.312270757","0.000045628","fe80::f4af:cb28:5ee1:34bd","fe80::18b6:b99d:235d:1cb2","TCP","86","2776","2844","0x00","36612  >  58226 [ACK] Seq=2776 Ack=2844 Win=64128 Len=0 TSval=911833312 TSecr=4198268142"
"60","2.315619152","0.003348395","fe80::f4af:cb28:5ee1:34bd","fe80::18b6:b99d:235d:1cb2","TLSv1.2","171","2776","2844","0x00","Application Data"
"61","2.568091530","0.252472378","fe80::f4af:cb28:5ee1:34bd","fe80::18b6:b99d:235d:1cb2","TCP","171","2776","2844","0x00","[TCP Retransmission] 36612  >  58226 [PSH, ACK] Seq=2776 Ack=2844 Win=64128 Len=85 TSval=911833568 TSecr=4198268142"
"62","2.655980419","0.087888889","fe80::18b6:b99d:235d:1cb2","fe80::f4af:cb28:5ee1:34bd","TCP","86","2844","2861","0x00","58226  >  36612 [ACK] Seq=2844 Ack=2861 Win=130944 Len=0 TSval=4198268167 TSecr=911833315"
"63","2.655995757","0.000015338","fe80::18b6:b99d:235d:1cb2","fe80::f4af:cb28:5ee1:34bd","TLSv1.2","203","2844","2861","0x00","Application Data"
"64","2.656003151","0.000007394","fe80::18b6:b99d:235d:1cb2","fe80::f4af:cb28:5ee1:34bd","TCP","203","2844","2861","0x00","[TCP Retransmission] 58226  >  36612 [PSH, ACK] Seq=2844 Ack=2861 Win=131072 Len=117 TSval=4198268402 TSecr=911833315"
"65","2.656010254","0.000007103","fe80::f4af:cb28:5ee1:34bd","fe80::18b6:b99d:235d:1cb2","TCP","98","2861","2961","0x00","36612  >  58226 [ACK] Seq=2861 Ack=2961 Win=64128 Len=0 TSval=911833655 TSecr=4198268402 SLE=2844 SRE=2961"
"66","2.656020951","0.000010697","fe80::18b6:b99d:235d:1cb2","fe80::f4af:cb28:5ee1:34bd","TCP","98","2961","2861","0x00","[TCP Dup ACK 62#1] 58226  >  36612 [ACK] Seq=2961 Ack=2861 Win=131072 Len=0 TSval=4198268441 TSecr=911833568 SLE=2776 SRE=2861"
"68","4.661941293","2.005920342","fe80::f4af:cb28:5ee1:34bd","fe80::18b6:b99d:235d:1cb2","TLSv1.2","171","2861","2961","0x00","Application Data"
"69","4.892431065","0.230489772","fe80::18b6:b99d:235d:1cb2","fe80::f4af:cb28:5ee1:34bd","TCP","86","2961","2946","0x00","58226  >  36612 [ACK] Seq=2961 Ack=2946 Win=130944 Len=0 TSval=4198270609 TSecr=911835661"
"70","4.892446908","0.000015843","fe80::18b6:b99d:235d:1cb2","fe80::f4af:cb28:5ee1:34bd","TLSv1.2","203","2961","2946","0x00","Application Data"
"71","4.892459367","0.000012459","fe80::f4af:cb28:5ee1:34bd","fe80::18b6:b99d:235d:1cb2","TCP","86","2946","3078","0x00","36612  >  58226 [ACK] Seq=2946 Ack=3078 Win=64128 Len=0 TSval=911835892 TSecr=4198270620"
"78","6.897787098","2.005327731","fe80::f4af:cb28:5ee1:34bd","fe80::18b6:b99d:235d:1cb2","TLSv1.2","171","2946","3078","0x00","Application Data"
"81","7.080174192","0.182387094","fe80::18b6:b99d:235d:1cb2","fe80::f4af:cb28:5ee1:34bd","TCP","86","3078","3031","0x00","58226  >  36612 [ACK] Seq=3078 Ack=3031 Win=130944 Len=0 TSval=4198272846 TSecr=911837897"
"82","7.080212441","0.000038249","fe80::18b6:b99d:235d:1cb2","fe80::f4af:cb28:5ee1:34bd","TLSv1.2","203","3078","3031","0x00","Application Data"
"83","7.080224501","0.000012060","fe80::f4af:cb28:5ee1:34bd","fe80::18b6:b99d:235d:1cb2","TCP","86","3031","3195","0x00","36612  >  58226 [ACK] Seq=3031 Ack=3195 Win=64128 Len=0 TSval=911838080 TSecr=4198272857"
"86","9.085296128","2.005071627","fe80::f4af:cb28:5ee1:34bd","fe80::18b6:b99d:235d:1cb2","TLSv1.2","171","3031","3195","0x00","Application Data"
"87","9.165060823","0.079764695","fe80::18b6:b99d:235d:1cb2","fe80::f4af:cb28:5ee1:34bd","TCP","86","3195","3116","0x00","58226  >  36612 [ACK] Seq=3195 Ack=3116 Win=130944 Len=0 TSval=4198274990 TSecr=911840085"
"88","9.165077173","0.000016350","fe80::18b6:b99d:235d:1cb2","fe80::f4af:cb28:5ee1:34bd","TLSv1.2","203","3195","3116","0x00","Application Data"
"89","9.165089273","0.000012100","fe80::f4af:cb28:5ee1:34bd","fe80::18b6:b99d:235d:1cb2","TCP","86","3116","3312","0x00","36612  >  58226 [ACK] Seq=3116 Ack=3312 Win=64128 Len=0 TSval=911840165 TSecr=4198275000"
"90","11.169966025","2.004876752","fe80::f4af:cb28:5ee1:34bd","fe80::18b6:b99d:235d:1cb2","TLSv1.2","171","3116","3312","0x00","Application Data"
"91","11.449499716","0.279533691","fe80::18b6:b99d:235d:1cb2","fe80::f4af:cb28:5ee1:34bd","TCP","86","3312","3201","0x00","58226  >  36612 [ACK] Seq=3312 Ack=3201 Win=131072 Len=0 TSval=4198277139 TSecr=911842170"
"92","11.449514363","0.000014647","fe80::18b6:b99d:235d:1cb2","fe80::f4af:cb28:5ee1:34bd","TLSv1.2","203","3312","3201","0x00","Application Data"
"93","11.449527181","0.000012818","fe80::f4af:cb28:5ee1:34bd","fe80::18b6:b99d:235d:1cb2","TCP","86","3201","3429","0x00","36612  >  58226 [ACK] Seq=3201 Ack=3429 Win=64128 Len=0 TSval=911842449 TSecr=4198277149"
"94","13.454311226","2.004784045","fe80::f4af:cb28:5ee1:34bd","fe80::18b6:b99d:235d:1cb2","TLSv1.2","171","3201","3429","0x00","Application Data"
"97","13.532012848","0.077701622","fe80::18b6:b99d:235d:1cb2","fe80::f4af:cb28:5ee1:34bd","TCP","86","3429","3286","0x00","58226  >  36612 [ACK] Seq=3429 Ack=3286 Win=131072 Len=0 TSval=4198279372 TSecr=911844454"
"98","13.553326439","0.021313591","fe80::18b6:b99d:235d:1cb2","fe80::f4af:cb28:5ee1:34bd","TLSv1.2","203","3429","3286","0x00","Application Data"
"99","13.553348300","0.000021861","fe80::f4af:cb28:5ee1:34bd","fe80::18b6:b99d:235d:1cb2","TCP","86","3286","3546","0x00","36612  >  58226 [ACK] Seq=3286 Ack=3546 Win=64128 Len=0 TSval=911844553 TSecr=4198279382"
"100","13.556779694","0.003431394","fe80::f4af:cb28:5ee1:34bd","fe80::18b6:b99d:235d:1cb2","TLSv1.2","171","3286","3546","0x00","Application Data"
"101","13.648894234","0.092114540","fe80::18b6:b99d:235d:1cb2","fe80::f4af:cb28:5ee1:34bd","TCP","86","3546","3371","0x00","58226  >  36612 [ACK] Seq=3546 Ack=3371 Win=131072 Len=0 TSval=4198279484 TSecr=911844556"
"102","13.657025699","0.008131465","fe80::18b6:b99d:235d:1cb2","fe80::f4af:cb28:5ee1:34bd","TLSv1.2","171","3546","3371","0x00","Application Data"
"103","13.660359063","0.003333364","fe80::f4af:cb28:5ee1:34bd","fe80::18b6:b99d:235d:1cb2","TLSv1.2","171","3371","3631","0x00","Application Data"
"104","13.699285005","0.038925942","fe80::18b6:b99d:235d:1cb2","fe80::f4af:cb28:5ee1:34bd","TCP","86","3631","3456","0x00","58226  >  36612 [ACK] Seq=3631 Ack=3456 Win=130944 Len=0 TSval=4198279508 TSecr=911844660"
"105","13.699299981","0.000014976","fe80::18b6:b99d:235d:1cb2","fe80::f4af:cb28:5ee1:34bd","TLSv1.2","171","3631","3456","0x00","Application Data"
"106","13.707000733","0.007700752","fe80::f4af:cb28:5ee1:34bd","fe80::18b6:b99d:235d:1cb2","TLSv1.2","155","3456","3716","0x00","Encrypted Alert"
"107","13.707052756","0.000052023","fe80::f4af:cb28:5ee1:34bd","fe80::18b6:b99d:235d:1cb2","TCP","86","3525","3716","0x00","36612  >  58226 [FIN, ACK] Seq=3525 Ack=3716 Win=64128 Len=0 TSval=911844707 TSecr=4198279518"
"108","13.740000010","0.032947254","fe80::18b6:b99d:235d:1cb2","fe80::f4af:cb28:5ee1:34bd","TCP","86","3716","3525","0x00","58226  >  36612 [ACK] Seq=3716 Ack=3525 Win=130944 Len=0 TSval=4198279561 TSecr=911844707"
"109","13.751818010","0.011818000","fe80::18b6:b99d:235d:1cb2","fe80::f4af:cb28:5ee1:34bd","TCP","86","3716","3526","0x00","58226  >  36612 [ACK] Seq=3716 Ack=3526 Win=130944 Len=0 TSval=4198279584 TSecr=911844707"
"114","19.177153110","5.425335100","fe80::18b6:b99d:235d:1cb2","fe80::f4af:cb28:5ee1:34bd","TLSv1.2","155","3716","3526","0x00","Encrypted Alert"
"115","19.177169413","0.000016303","fe80::f4af:cb28:5ee1:34bd","fe80::18b6:b99d:235d:1cb2","TCP","74","3526","0","0x00","36612  >  58226 [RST] Seq=3526 Win=0 Len=0"
"116","19.177182203","0.000012790","fe80::18b6:b99d:235d:1cb2","fe80::f4af:cb28:5ee1:34bd","TCP","86","3785","3526","0x00","58226  >  36612 [FIN, ACK] Seq=3785 Ack=3526 Win=130944 Len=0 TSval=4198284527 TSecr=911844707"
"117","19.177184613","0.000002410","fe80::f4af:cb28:5ee1:34bd","fe80::18b6:b99d:235d:1cb2","TCP","74","3526","0","0x00","36612  >  58226 [RST] Seq=3526 Win=0 Len=0"
"118","19.177186526","0.000001913","fe80::18b6:b99d:235d:1cb2","fe80::f4af:cb28:5ee1:34bd","TCP","74","3786","3526","0x00","58226  >  36612 [RST, ACK] Seq=3786 Ack=3526 Win=130944 Len=0"
"121","21.445582864","2.268396338","fe80::f4af:cb28:5ee1:34bd","ff02::1","UDP","72","","","0x00","59703  >  15118 Len=10"
"122","21.571555268","0.125972404","fe80::18b6:b99d:235d:1cb2","fe80::f4af:cb28:5ee1:34bd","UDP","90","","","0x00","15118  >  59703 Len=28"
"123","21.887855578","0.316300310","fe80::f4af:cb28:5ee1:34bd","fe80::18b6:b99d:235d:1cb2","TCP","94","0","0","0x00","36614  >  58226 [SYN] Seq=0 Win=64800 Len=0 MSS=1440 SACK_PERM=1 TSval=911852888 TSecr=0 WS=128"
"124","21.987245013","0.099389435","fe80::18b6:b99d:235d:1cb2","fe80::f4af:cb28:5ee1:34bd","TCP","98","0","1","0x00","58226  >  36614 [SYN, ACK] Seq=0 Ack=1 Win=65535 Len=0 MSS=1440 WS=64 TSval=4131133361 TSecr=911852888 SACK_PERM=1"
"125","21.987270364","0.000025351","fe80::f4af:cb28:5ee1:34bd","fe80::18b6:b99d:235d:1cb2","TCP","86","1","1","0x00","36614  >  58226 [ACK] Seq=1 Ack=1 Win=64896 Len=0 TSval=911852987 TSecr=4131133361"
"126","21.999913524","0.012643160","fe80::18b6:b99d:235d:1cb2","fe80::f4af:cb28:5ee1:34bd","TCP","86","1","1","0x00","[TCP Window Update] 58226  >  36614 [ACK] Seq=1 Ack=1 Win=131328 Len=0 TSval=4131133410 TSecr=911852987"
"127","22.007412167","0.007498643","fe80::f4af:cb28:5ee1:34bd","fe80::18b6:b99d:235d:1cb2","TLSv1.2","288","1","1","0x00","Client Hello"
"128","22.016957533","0.009545366","fe80::18b6:b99d:235d:1cb2","fe80::f4af:cb28:5ee1:34bd","TCP","86","1","203","0x00","58226  >  36614 [ACK] Seq=1 Ack=203 Win=131136 Len=0 TSval=4131133426 TSecr=911853007"
"129","22.331363641","0.314406108","fe80::18b6:b99d:235d:1cb2","fe80::f4af:cb28:5ee1:34bd","TLSv1.2","176","1","203","0x00","Server Hello"
"130","22.331385365","0.000021724","fe80::f4af:cb28:5ee1:34bd","fe80::18b6:b99d:235d:1cb2","TCP","86","203","91","0x00","36614  >  58226 [ACK] Seq=203 Ack=91 Win=64896 Len=0 TSval=911853331 TSecr=4131133437"
"131","22.331398209","0.000012844","fe80::18b6:b99d:235d:1cb2","fe80::f4af:cb28:5ee1:34bd","TLSv1.2","1524","91","203","0x00","Certificate"
"132","22.331400440","0.000002231","fe80::f4af:cb28:5ee1:34bd","fe80::18b6:b99d:235d:1cb2","TCP","86","203","1529","0x00","36614  >  58226 [ACK] Seq=203 Ack=1529 Win=63488 Len=0 TSval=911853331 TSecr=4131133437"
"140","22.383732999","0.052332559","fe80::18b6:b99d:235d:1cb2","fe80::f4af:cb28:5ee1:34bd","TCP","1514","1","203","0x00","[TCP Spurious Retransmission] 58226  >  36614 [ACK] Seq=1 Ack=203 Win=131136 Len=1428 TSval=4131133774 TSecr=911853007"
"141","22.383753479","0.000020480","fe80::f4af:cb28:5ee1:34bd","fe80::18b6:b99d:235d:1cb2","TCP","98","203","1529","0x00","[TCP Window Update] 36614  >  58226 [ACK] Seq=203 Ack=1529 Win=64128 Len=0 TSval=911853384 TSecr=4131133437 SLE=1 SRE=1429"
"142","22.383763036","0.000009557","fe80::18b6:b99d:235d:1cb2","fe80::f4af:cb28:5ee1:34bd","TLSv1.2","215","1529","203","0x00","Server Key Exchange, Server Hello Done"
"143","22.383765098","0.000002062","fe80::f4af:cb28:5ee1:34bd","fe80::18b6:b99d:235d:1cb2","TCP","86","203","1658","0x00","36614  >  58226 [ACK] Seq=203 Ack=1658 Win=64000 Len=0 TSval=911853384 TSecr=4131133776"
"146","22.398417097","0.014651999","fe80::f4af:cb28:5ee1:34bd","fe80::18b6:b99d:235d:1cb2","TLSv1.2","128","203","1658","0x00","Client Key Exchange"
"148","22.408818613","0.010401516","fe80::18b6:b99d:235d:1cb2","fe80::f4af:cb28:5ee1:34bd","TCP","215","1529","203","0x00","[TCP Spurious Retransmission] 58226  >  36614 [PSH, ACK] Seq=1529 Ack=203 Win=131136 Len=129 TSval=4131133811 TSecr=911853331"
"149","22.408837513","0.000018900","fe80::f4af:cb28:5ee1:34bd","fe80::18b6:b99d:235d:1cb2","TCP","98","245","1658","0x00","[TCP Dup ACK 143#1] 36614  >  58226 [ACK] Seq=245 Ack=1658 Win=64128 Len=0 TSval=911853409 TSecr=4131133811 SLE=1529 SRE=1658"
"150","22.462066313","0.053228800","fe80::18b6:b99d:235d:1cb2","fe80::f4af:cb28:5ee1:34bd","TCP","86","1658","245","0x00","58226  >  36614 [ACK] Seq=1658 Ack=245 Win=131072 Len=0 TSval=4131133822 TSecr=911853398"
"151","22.462086231","0.000019918","fe80::f4af:cb28:5ee1:34bd","fe80::18b6:b99d:235d:1cb2","TLSv1.2","177","245","1658","0x00","Change Cipher Spec, Encrypted Handshake Message"
"161","22.760575359","0.298489128","fe80::f4af:cb28:5ee1:34bd","fe80::18b6:b99d:235d:1cb2","TCP","177","245","1658","0x00","[TCP Retransmission] 36614  >  58226 [PSH, ACK] Seq=245 Ack=1658 Win=64128 Len=91 TSval=911853761 TSecr=4131133822"
"164","22.781925499","0.021350140","fe80::18b6:b99d:235d:1cb2","fe80::f4af:cb28:5ee1:34bd","TCP","86","1658","336","0x00","58226  >  36614 [ACK] Seq=1658 Ack=336 Win=131008 Len=0 TSval=4131133969 TSecr=911853462"
"165","22.781938693","0.000013194","fe80::18b6:b99d:235d:1cb2","fe80::f4af:cb28:5ee1:34bd","TLSv1.2","92","1658","336","0x00","Change Cipher Spec"
"166","22.781950231","0.000011538","fe80::f4af:cb28:5ee1:34bd","fe80::18b6:b99d:235d:1cb2","TCP","86","336","1664","0x00","36614  >  58226 [ACK] Seq=336 Ack=1664 Win=64128 Len=0 TSval=911853782 TSecr=4131133972"
"168","22.812323257","0.030373026","fe80::18b6:b99d:235d:1cb2","fe80::f4af:cb28:5ee1:34bd","TLSv1.2","183","1664","336","0x00","Encrypted Handshake Message"
"169","22.812345089","0.000021832","fe80::f4af:cb28:5ee1:34bd","fe80::18b6:b99d:235d:1cb2","TCP","86","336","1749","0x00","36614  >  58226 [ACK] Seq=336 Ack=1749 Win=64128 Len=0 TSval=911853812 TSecr=4131134184"
"171","22.838851619","0.026506530","fe80::18b6:b99d:235d:1cb2","fe80::f4af:cb28:5ee1:34bd","TCP","98","1749","336","0x00","[TCP Dup ACK 164#1] 58226  >  36614 [ACK] Seq=1749 Ack=336 Win=131072 Len=0 TSval=4131134221 TSecr=911853761 SLE=245 SRE=336"
"172","22.842967050","0.004115431","fe80::f4af:cb28:5ee1:34bd","fe80::18b6:b99d:235d:1cb2","TLSv1.2","187","336","1749","0x00","Application Data"
"173","22.932854038","0.089886988","fe80::18b6:b99d:235d:1cb2","fe80::f4af:cb28:5ee1:34bd","TCP","86","1749","437","0x00","58226  >  36614 [ACK] Seq=1749 Ack=437 Win=130944 Len=0 TSval=4131134268 TSecr=911853843"
"175","22.991206324","0.058352286","fe80::18b6:b99d:235d:1cb2","fe80::f4af:cb28:5ee1:34bd","TLSv1.2","155","1749","437","0x00","Application Data"
"178","23.044064000","0.052857676","fe80::f4af:cb28:5ee1:34bd","fe80::18b6:b99d:235d:1cb2","TCP","86","437","1818","0x00","36614  >  58226 [ACK] Seq=437 Ack=1818 Win=64128 Len=0 TSval=911854044 TSecr=4131134278"
"179","23.048150474","0.004086474","fe80::f4af:cb28:5ee1:34bd","fe80::18b6:b99d:235d:1cb2","TLSv1.2","171","437","1818","0x00","Application Data"
"180","23.179058445","0.130907971","fe80::18b6:b99d:235d:1cb2","fe80::f4af:cb28:5ee1:34bd","TCP","86","1818","522","0x00","58226  >  36614 [ACK] Seq=1818 Ack=522 Win=130944 Len=0 TSval=4131134520 TSecr=911854048"
"181","23.179074227","0.000015782","fe80::18b6:b99d:235d:1cb2","fe80::f4af:cb28:5ee1:34bd","TLSv1.2","187","1818","522","0x00","Application Data"
"182","23.179085135","0.000010908","fe80::f4af:cb28:5ee1:34bd","fe80::18b6:b99d:235d:1cb2","TCP","86","522","1919","0x00","36614  >  58226 [ACK] Seq=522 Ack=1919 Win=64128 Len=0 TSval=911854179 TSecr=4131134531"
"183","23.184022210","0.004937075","fe80::f4af:cb28:5ee1:34bd","fe80::18b6:b99d:235d:1cb2","TLSv1.2","171","522","1919","0x00","Application Data"
"185","23.242477697","0.058455487","fe80::18b6:b99d:235d:1cb2","fe80::f4af:cb28:5ee1:34bd","TCP","86","1919","607","0x00","58226  >  36614 [ACK] Seq=1919 Ack=607 Win=130944 Len=0 TSval=4131134629 TSecr=911854184"
"186","23.242493974","0.000016277","fe80::18b6:b99d:235d:1cb2","fe80::f4af:cb28:5ee1:34bd","TLSv1.2","251","1919","607","0x00","Application Data"
"187","23.284091763","0.041597789","fe80::f4af:cb28:5ee1:34bd","fe80::18b6:b99d:235d:1cb2","TCP","86","607","2084","0x00","36614  >  58226 [ACK] Seq=607 Ack=2084 Win=64128 Len=0 TSval=911854284 TSecr=4131134640"
"188","23.300268851","0.016177088","fe80::f4af:cb28:5ee1:34bd","fe80::18b6:b99d:235d:1cb2","TLSv1.2","171","607","2084","0x00","Application Data"
"189","23.383035566","0.082766715","fe80::18b6:b99d:235d:1cb2","fe80::f4af:cb28:5ee1:34bd","TCP","86","2084","692","0x00","58226  >  36614 [ACK] Seq=2084 Ack=692 Win=130944 Len=0 TSval=4131134771 TSecr=911854300"
"190","23.383052439","0.000016873","fe80::18b6:b99d:235d:1cb2","fe80::f4af:cb28:5ee1:34bd","TLSv1.2","171","2084","692","0x00","Application Data"
"191","23.383063418","0.000010979","fe80::f4af:cb28:5ee1:34bd","fe80::18b6:b99d:235d:1cb2","TCP","86","692","2169","0x00","36614  >  58226 [ACK] Seq=692 Ack=2169 Win=64128 Len=0 TSval=911854383 TSecr=4131134780"
"192","23.503997014","0.120933596","fe80::f4af:cb28:5ee1:34bd","fe80::18b6:b99d:235d:1cb2","TCP","1514","692","2169","0x00","36614  >  58226 [ACK] Seq=692 Ack=2169 Win=64128 Len=1428 TSval=911854504 TSecr=4131134780 [TCP segment of a reassembled PDU]"
"193","23.504010159","0.000013145","fe80::f4af:cb28:5ee1:34bd","fe80::18b6:b99d:235d:1cb2","TLSv1.2","183","2120","2169","0x00","Application Data"
"194","23.588417737","0.084407578","fe80::18b6:b99d:235d:1cb2","fe80::f4af:cb28:5ee1:34bd","TCP","86","2169","2217","0x00","58226  >  36614 [ACK] Seq=2169 Ack=2217 Win=129536 Len=0 TSval=4131134973 TSecr=911854504"
"195","23.628405981","0.039988244","fe80::18b6:b99d:235d:1cb2","fe80::f4af:cb28:5ee1:34bd","TLSv1.2","187","2169","2217","0x00","Application Data"
"196","23.628421716","0.000015735","fe80::f4af:cb28:5ee1:34bd","fe80::18b6:b99d:235d:1cb2","TCP","86","2217","2270","0x00","36614  >  58226 [ACK] Seq=2217 Ack=2270 Win=64128 Len=0 TSval=911854628 TSecr=4131135012"
"197","23.693489964","0.065068248","fe80::f4af:cb28:5ee1:34bd","fe80::18b6:b99d:235d:1cb2","TLSv1.2","459","2217","2270","0x00","Application Data"
"198","24.069290638","0.375800674","fe80::18b6:b99d:235d:1cb2","fe80::f4af:cb28:5ee1:34bd","TCP","86","2270","2590","0x00","58226  >  36614 [ACK] Seq=2270 Ack=2590 Win=130688 Len=0 TSval=4131135184 TSecr=911854693"
"199","24.069435446","0.000144808","fe80::18b6:b99d:235d:1cb2","fe80::f4af:cb28:5ee1:34bd","TLSv1.2","171","2270","2590","0x00","Application Data"
"201","24.069523849","0.000088403","fe80::f4af:cb28:5ee1:34bd","fe80::18b6:b99d:235d:1cb2","TCP","86","2590","2355","0x00","36614  >  58226 [ACK] Seq=2590 Ack=2355 Win=64128 Len=0 TSval=911855069 TSecr=4131135204"
"204","24.076399488","0.006875639","fe80::f4af:cb28:5ee1:34bd","fe80::18b6:b99d:235d:1cb2","TLSv1.2","187","2590","2355","0x00","Application Data"
"206","24.228885445","0.152485957","fe80::18b6:b99d:235d:1cb2","fe80::f4af:cb28:5ee1:34bd","TCP","86","2355","2691","0x00","58226  >  36614 [ACK] Seq=2355 Ack=2691 Win=130944 Len=0 TSval=4131135557 TSecr=911855076"
"207","24.228896190","0.000010745","fe80::18b6:b99d:235d:1cb2","fe80::f4af:cb28:5ee1:34bd","TLSv1.2","491","2355","2691","0x00","Application Data"
"208","24.272103645","0.043207455","fe80::f4af:cb28:5ee1:34bd","fe80::18b6:b99d:235d:1cb2","TCP","86","2691","2760","0x00","36614  >  58226 [ACK] Seq=2691 Ack=2760 Win=64128 Len=0 TSval=911855272 TSecr=4131135579"
"209","24.283009589","0.010905944","fe80::f4af:cb28:5ee1:34bd","fe80::18b6:b99d:235d:1cb2","TLSv1.2","171","2691","2760","0x00","Application Data"
"210","24.330483226","0.047473637","fe80::18b6:b99d:235d:1cb2","fe80::f4af:cb28:5ee1:34bd","TCP","86","2760","2776","0x00","58226  >  36614 [ACK] Seq=2760 Ack=2776 Win=130944 Len=0 TSval=4131135707 TSecr=911855283"
"211","24.354041073","0.023557847","fe80::18b6:b99d:235d:1cb2","fe80::f4af:cb28:5ee1:34bd","TLSv1.2","171","2760","2776","0x00","Application Data"
"212","24.354260591","0.000219518","fe80::f4af:cb28:5ee1:34bd","fe80::18b6:b99d:235d:1cb2","TCP","86","2776","2845","0x00","36614  >  58226 [ACK] Seq=2776 Ack=2845 Win=64128 Len=0 TSval=911855354 TSecr=4131135714"
"213","24.358192807","0.003932216","fe80::f4af:cb28:5ee1:34bd","fe80::18b6:b99d:235d:1cb2","TLSv1.2","171","2776","2845","0x00","Application Data"
"214","24.422584762","0.064391955","fe80::18b6:b99d:235d:1cb2","fe80::f4af:cb28:5ee1:34bd","TCP","86","2845","2861","0x00","58226  >  36614 [ACK] Seq=2845 Ack=2861 Win=130944 Len=0 TSval=4131135824 TSecr=911855358"
"215","24.459854885","0.037270123","fe80::18b6:b99d:235d:1cb2","fe80::f4af:cb28:5ee1:34bd","TLSv1.2","203","2845","2861","0x00","Application Data"
"216","24.500565686","0.040710801","fe80::f4af:cb28:5ee1:34bd","fe80::18b6:b99d:235d:1cb2","TCP","86","2861","2962","0x00","36614  >  58226 [ACK] Seq=2861 Ack=2962 Win=64128 Len=0 TSval=911855501 TSecr=4131135832"
"219","26.466250598","1.965684912","fe80::f4af:cb28:5ee1:34bd","fe80::18b6:b99d:235d:1cb2","TLSv1.2","171","2861","2962","0x00","Application Data"
"220","26.805561133","0.339310535","fe80::18b6:b99d:235d:1cb2","fe80::f4af:cb28:5ee1:34bd","TCP","86","2962","2946","0x00","58226  >  36614 [ACK] Seq=2962 Ack=2946 Win=130944 Len=0 TSval=4131138088 TSecr=911857466"
"221","26.805577499","0.000016366","fe80::18b6:b99d:235d:1cb2","fe80::f4af:cb28:5ee1:34bd","TLSv1.2","203","2962","2946","0x00","Application Data"
"222","26.805589678","0.000012179","fe80::f4af:cb28:5ee1:34bd","fe80::18b6:b99d:235d:1cb2","TCP","86","2946","3079","0x00","36614  >  58226 [ACK] Seq=2946 Ack=3079 Win=64128 Len=0 TSval=911857806 TSecr=4131138096"
"223","28.810791718","2.005202040","fe80::f4af:cb28:5ee1:34bd","fe80::18b6:b99d:235d:1cb2","TLSv1.2","171","2946","3079","0x00","Application Data"
"224","28.911264176","0.100472458","fe80::18b6:b99d:235d:1cb2","fe80::f4af:cb28:5ee1:34bd","TCP","86","3079","3031","0x00","58226  >  36614 [ACK] Seq=3079 Ack=3031 Win=130944 Len=0 TSval=4131140311 TSecr=911859811"
"225","28.921185373","0.009921197","fe80::18b6:b99d:235d:1cb2","fe80::f4af:cb28:5ee1:34bd","TLSv1.2","203","3079","3031","0x00","Application Data"
"226","28.921207656","0.000022283","fe80::f4af:cb28:5ee1:34bd","fe80::18b6:b99d:235d:1cb2","TCP","86","3031","3196","0x00","36614  >  58226 [ACK] Seq=3031 Ack=3196 Win=64128 Len=0 TSval=911859921 TSecr=4131140320"
"227","30.925886101","2.004678445","fe80::f4af:cb28:5ee1:34bd","fe80::18b6:b99d:235d:1cb2","TLSv1.2","171","3031","3196","0x00","Application Data"
"230","31.144687344","0.218801243","fe80::18b6:b99d:235d:1cb2","fe80::f4af:cb28:5ee1:34bd","TCP","86","3196","3116","0x00","58226  >  36614 [ACK] Seq=3196 Ack=3116 Win=130944 Len=0 TSval=4131142462 TSecr=911861926"
"231","31.144703473","0.000016129","fe80::18b6:b99d:235d:1cb2","fe80::f4af:cb28:5ee1:34bd","TLSv1.2","203","3196","3116","0x00","Application Data"
"232","31.144715680","0.000012207","fe80::f4af:cb28:5ee1:34bd","fe80::18b6:b99d:235d:1cb2","TCP","86","3116","3313","0x00","36614  >  58226 [ACK] Seq=3116 Ack=3313 Win=64128 Len=0 TSval=911862145 TSecr=4131142471"
"250","33.150242344","2.005526664","fe80::f4af:cb28:5ee1:34bd","fe80::18b6:b99d:235d:1cb2","TLSv1.2","171","3116","3313","0x00","Application Data"
"251","33.253278453","0.103036109","fe80::18b6:b99d:235d:1cb2","fe80::f4af:cb28:5ee1:34bd","TCP","86","3313","3201","0x00","58226  >  36614 [ACK] Seq=3313 Ack=3201 Win=131072 Len=0 TSval=4131144648 TSecr=911864150"
"252","33.253293445","0.000014992","fe80::18b6:b99d:235d:1cb2","fe80::f4af:cb28:5ee1:34bd","TLSv1.2","203","3313","3201","0x00","Application Data"
"253","33.253306037","0.000012592","fe80::f4af:cb28:5ee1:34bd","fe80::18b6:b99d:235d:1cb2","TCP","86","3201","3430","0x00","36614  >  58226 [ACK] Seq=3201 Ack=3430 Win=64128 Len=0 TSval=911864254 TSecr=4131144656"
"254","35.257889032","2.004582995","fe80::f4af:cb28:5ee1:34bd","fe80::18b6:b99d:235d:1cb2","TLSv1.2","171","3201","3430","0x00","Application Data"
"255","35.445834893","0.187945861","fe80::18b6:b99d:235d:1cb2","fe80::f4af:cb28:5ee1:34bd","TCP","86","3430","3286","0x00","58226  >  36614 [ACK] Seq=3430 Ack=3286 Win=131072 Len=0 TSval=4131146779 TSecr=911866258"
"256","35.445850073","0.000015180","fe80::18b6:b99d:235d:1cb2","fe80::f4af:cb28:5ee1:34bd","TLSv1.2","203","3430","3286","0x00","Application Data"
"257","35.445862709","0.000012636","fe80::f4af:cb28:5ee1:34bd","fe80::18b6:b99d:235d:1cb2","TCP","86","3286","3547","0x00","36614  >  58226 [ACK] Seq=3286 Ack=3547 Win=64128 Len=0 TSval=911866446 TSecr=4131146788"
"258","35.449187951","0.003325242","fe80::f4af:cb28:5ee1:34bd","fe80::18b6:b99d:235d:1cb2","TLSv1.2","171","3286","3547","0x00","Application Data"
"259","35.568069548","0.118881597","fe80::18b6:b99d:235d:1cb2","fe80::f4af:cb28:5ee1:34bd","TCP","86","3547","3371","0x00","58226  >  36614 [ACK] Seq=3547 Ack=3371 Win=131072 Len=0 TSval=4131146955 TSecr=911866449"
"260","35.568085999","0.000016451","fe80::18b6:b99d:235d:1cb2","fe80::f4af:cb28:5ee1:34bd","TLSv1.2","171","3547","3371","0x00","Application Data"
"261","35.571182124","0.003096125","fe80::f4af:cb28:5ee1:34bd","fe80::18b6:b99d:235d:1cb2","TLSv1.2","171","3371","3632","0x00","Application Data"
"262","35.662106398","0.090924274","fe80::18b6:b99d:235d:1cb2","fe80::f4af:cb28:5ee1:34bd","TCP","86","3632","3456","0x00","58226  >  36614 [ACK] Seq=3632 Ack=3456 Win=130944 Len=0 TSval=4131146992 TSecr=911866571"
"263","35.662123280","0.000016882","fe80::18b6:b99d:235d:1cb2","fe80::f4af:cb28:5ee1:34bd","TLSv1.2","171","3632","3456","0x00","Application Data"
"264","35.669489347","0.007366067","fe80::f4af:cb28:5ee1:34bd","fe80::18b6:b99d:235d:1cb2","TLSv1.2","155","3456","3717","0x00","Encrypted Alert"
"265","35.669540385","0.000051038","fe80::f4af:cb28:5ee1:34bd","fe80::18b6:b99d:235d:1cb2","TCP","86","3525","3717","0x00","36614  >  58226 [FIN, ACK] Seq=3525 Ack=3717 Win=64128 Len=0 TSval=911866670 TSecr=4131147000"
"266","35.735306796","0.065766411","fe80::18b6:b99d:235d:1cb2","fe80::f4af:cb28:5ee1:34bd","TCP","86","3717","3525","0x00","58226  >  36614 [ACK] Seq=3717 Ack=3525 Win=130944 Len=0 TSval=4131147136 TSecr=911866670"
"267","35.744569897","0.009263101","fe80::18b6:b99d:235d:1cb2","fe80::f4af:cb28:5ee1:34bd","TCP","86","3717","3526","0x00","58226  >  36614 [ACK] Seq=3717 Ack=3526 Win=130944 Len=0 TSval=4131147138 TSecr=911866670"
"270","41.078066797","5.333496900","fe80::18b6:b99d:235d:1cb2","fe80::f4af:cb28:5ee1:34bd","TLSv1.2","155","3717","3526","0x00","Encrypted Alert"
"271","41.078088403","0.000021606","fe80::f4af:cb28:5ee1:34bd","fe80::18b6:b99d:235d:1cb2","TCP","74","3526","0","0x00","36614  >  58226 [RST] Seq=3526 Win=0 Len=0"
"272","41.078123277","0.000034874","fe80::18b6:b99d:235d:1cb2","fe80::f4af:cb28:5ee1:34bd","TCP","86","3786","3526","0x00","58226  >  36614 [FIN, ACK] Seq=3786 Ack=3526 Win=130944 Len=0 TSval=4131152004 TSecr=911866670"
"273","41.078125812","0.000002535","fe80::f4af:cb28:5ee1:34bd","fe80::18b6:b99d:235d:1cb2","TCP","74","3526","0","0x00","36614  >  58226 [RST] Seq=3526 Win=0 Len=0"
"274","41.078128431","0.000002619","fe80::18b6:b99d:235d:1cb2","fe80::f4af:cb28:5ee1:34bd","TCP","74","3787","3526","0x00","58226  >  36614 [RST, ACK] Seq=3787 Ack=3526 Win=130944 Len=0"
"279","43.432214339","2.354085908","fe80::f4af:cb28:5ee1:34bd","ff02::1","UDP","72","","","0x00","49371  >  15118 Len=10"
"280","43.684241704","0.252027365","fe80::f4af:cb28:5ee1:34bd","ff02::1","UDP","72","","","0x00","49371  >  15118 Len=10"
"281","43.694700745","0.010459041","fe80::18b6:b99d:235d:1cb2","fe80::f4af:cb28:5ee1:34bd","UDP","90","","","0x00","15118  >  49371 Len=28"
"282","43.760392701","0.065691956","fe80::18b6:b99d:235d:1cb2","fe80::f4af:cb28:5ee1:34bd","UDP","90","","","0x00","15118  >  49371 Len=28"
"283","43.969267425","0.208874724","fe80::f4af:cb28:5ee1:34bd","fe80::18b6:b99d:235d:1cb2","TCP","94","0","0","0x00","36616  >  58226 [SYN] Seq=0 Win=64800 Len=0 MSS=1440 SACK_PERM=1 TSval=911874970 TSecr=0 WS=128"
"284","44.051300188","0.082032763","fe80::18b6:b99d:235d:1cb2","fe80::f4af:cb28:5ee1:34bd","TCP","98","0","1","0x00","58226  >  36616 [SYN, ACK] Seq=0 Ack=1 Win=65535 Len=0 MSS=1440 WS=64 TSval=4011540613 TSecr=911874970 SACK_PERM=1"
"285","44.051320961","0.000020773","fe80::f4af:cb28:5ee1:34bd","fe80::18b6:b99d:235d:1cb2","TCP","86","1","1","0x00","36616  >  58226 [ACK] Seq=1 Ack=1 Win=64896 Len=0 TSval=911875052 TSecr=4011540613"
"286","44.070640042","0.019319081","fe80::f4af:cb28:5ee1:34bd","fe80::18b6:b99d:235d:1cb2","TLSv1.2","288","1","1","0x00","Client Hello"
"287","44.131869778","0.061229736","fe80::18b6:b99d:235d:1cb2","fe80::f4af:cb28:5ee1:34bd","TCP","86","1","1","0x00","[TCP Window Update] 58226  >  36616 [ACK] Seq=1 Ack=1 Win=131328 Len=0 TSval=4011540671 TSecr=911875052"
"288","44.134462767","0.002592989","fe80::18b6:b99d:235d:1cb2","fe80::f4af:cb28:5ee1:34bd","TCP","86","1","203","0x00","58226  >  36616 [ACK] Seq=1 Ack=203 Win=131136 Len=0 TSval=4011540687 TSecr=911875071"
"289","44.223198950","0.088736183","fe80::18b6:b99d:235d:1cb2","fe80::f4af:cb28:5ee1:34bd","TLSv1.2","176","1","203","0x00","Server Hello"
"290","44.223218068","0.000019118","fe80::f4af:cb28:5ee1:34bd","fe80::18b6:b99d:235d:1cb2","TCP","86","203","91","0x00","36616  >  58226 [ACK] Seq=203 Ack=91 Win=64896 Len=0 TSval=911875224 TSecr=4011540699"
"291","44.223231267","0.000013199","fe80::18b6:b99d:235d:1cb2","fe80::f4af:cb28:5ee1:34bd","TLSv1.2","1524","91","203","0x00","Certificate"
"292","44.223233067","0.000001800","fe80::f4af:cb28:5ee1:34bd","fe80::18b6:b99d:235d:1cb2","TCP","86","203","1529","0x00","36616  >  58226 [ACK] Seq=203 Ack=1529 Win=63488 Len=0 TSval=911875224 TSecr=4011540699"
"293","44.327479331","0.104246264","fe80::18b6:b99d:235d:1cb2","fe80::f4af:cb28:5ee1:34bd","TLSv1.2","216","1529","203","0x00","Server Key Exchange, Server Hello Done"
"294","44.327495290","0.000015959","fe80::f4af:cb28:5ee1:34bd","fe80::18b6:b99d:235d:1cb2","TCP","86","203","1659","0x00","36616  >  58226 [ACK] Seq=203 Ack=1659 Win=63360 Len=0 TSval=911875328 TSecr=4011540895"
"295","44.338816331","0.011321041","fe80::f4af:cb28:5ee1:34bd","fe80::18b6:b99d:235d:1cb2","TLSv1.2","128","203","1659","0x00","Client Key Exchange"
"296","44.368110286","0.029293955","fe80::18b6:b99d:235d:1cb2","fe80::f4af:cb28:5ee1:34bd","TCP","86","1659","245","0x00","58226  >  36616 [ACK] Seq=1659 Ack=245 Win=131072 Len=0 TSval=4011540915 TSecr=911875339"
"297","44.368133233","0.000022947","fe80::f4af:cb28:5ee1:34bd","fe80::18b6:b99d:235d:1cb2","TLSv1.2","177","245","1659","0x00","Change Cipher Spec, Encrypted Handshake Message"
